Item Title,Publication Title,Book Series Title,Journal Volume,Journal Issue,Item DOI,Authors,Publication Year,URL,Content Type
"Thermal history, hydrocarbon generation and migration in the Horn Graben in the Danish North Sea: a 2D basin modelling study",International Journal of Earth Sciences,,,,10.1007/s00531-007-0247-2,Andreas BehaRene O. ThomsenRalf Littke,2007,https://link.springer.com/article/10.1007/s00531-007-0247-2,Article
"Proceedings of the VII. Alps-Adria Scientific Workshop, 28 April–2 May 2008, Stara Lesna, Slovakia. Part III",Cereal Research Communications,,,,10.1556/CRC.36.2008.Suppl.3,,2008,https://link.springer.com/article/10.1556/CRC.36.2008.Suppl.3,Article
Ternary geochemical-tracing system in natural gas accumulation,Science in China Series D: Earth Sciences,,,,10.1007/s11430-007-0091-z,Liu WenHuiChen MengJinGuan PingZheng JianJingJin QiangLi JianWang WanChunHu GuoYiXia YanQingZhang DianWei,2007,https://link.springer.com/article/10.1007/s11430-007-0091-z,Article
Isotopic-geochemical signs of coal and bitumen transformation in different-type ore mineralization: Communication 1. Isotopic-geochemical signs of structural transformation of coal and bitumen,Lithology and Mineral Resources,,,,10.1134/S0024490207050021,E. D. SyngaevskiiYu. V. Shchegol’kovG. Ch. VitozhentsG. K. KhachatryanS. N. Petrova,2007,https://link.springer.com/article/10.1134/S0024490207050021,Article
"Geochemical features and genesis of the natural gas and bitumen in paleo-oil reservoirs of Nanpanjiang Basin, China",Science in China Series D: Earth Sciences,,,,10.1007/s11430-007-0018-8,Zhao MengJunZhang ShuiChangZhao LinDa Jiang,2007,https://link.springer.com/article/10.1007/s11430-007-0018-8,Article
From deep basin gas to diagenetic trap—An example from the Yulin Gas Field in the Ordos Basin,Chinese Science Bulletin,,,,10.1007/s11434-007-0405-8,Zhang LiuPingLuo XiaoRongMa XinHuaChen MengJinWu MingHui,2007,https://link.springer.com/article/10.1007/s11434-007-0405-8,Article
Dynamic Fragmentation of Solids,"Shock Wave Science and Technology Reference Library, Vol. 3",,,,10.1007/978-3-540-77080-0_4,,2008,https://link.springer.com/chapter/10.1007/978-3-540-77080-0_4,Chapter
Dominant factors in controlling marine gas pools in South China,Frontiers of Earth Science in China,,,,10.1007/s11707-007-0060-z,Xu SihuangW. Lynn Watney,2007,https://link.springer.com/article/10.1007/s11707-007-0060-z,Article
"New maturation parameters based on naphthalene and phenanthrene isomerization and dealkylation processes aimed at improved classification of crude oils (Southeastern Pannonian Basin, Serbia)",Geochemistry International,,,,10.1134/S0016702907080058,K. StojanovićBr. JovančićevićDr. VitoroviG. S. PevnevaJu. A. GolovkoA. K. Golovko,2007,https://link.springer.com/article/10.1134/S0016702907080058,Article
Thermal dissolution of solid fossil fuels,Solid Fuel Chemistry,,,,10.3103/S0361521907050047,E. G. Gorlov,2007,https://link.springer.com/article/10.3103/S0361521907050047,Article
Sulfur Chemical Moieties in Carbonaceous Materials,"Asphaltenes, Heavy Oils, and Petroleomics",,,,10.1007/0-387-68903-6_6,Sudipa Mitra-KirtleyOliver C. Mullins,2007,https://link.springer.com/chapter/10.1007/0-387-68903-6_6,Chapter
Salt Dynamics,Dynamics of Complex Intracontinental Basins,,,,10.1007/978-3-540-85085-4_5,J.K. WarrenJ.L. UraiZ. SchléderC.J. SpiersP.A. KuklaM. MohrM. Scheck-WenderothY. MaystrenkoC. HübscherM. HansenS. MazurF. MagriR. LittkeS. RodonU. Bayer,2008,https://link.springer.com/chapter/10.1007/978-3-540-85085-4_5,Chapter
Laser-induced Fourier transform ion cyclotron resonance mass spectrometry of organic and inorganic compounds: methodologies and applications,Analytical and Bioanalytical Chemistry,,,,10.1007/s00216-007-1491-9,Frédéric Aubriet,2007,https://link.springer.com/article/10.1007/s00216-007-1491-9,Article
"Formation and transformation of mixed-layer minerals by tertiary intrusives in cretaceous mudstones, West Greenland",Clays and Clay Minerals,,,,10.1346/CCMN.2007.0550304,Victor A. DritsHolger LindgreenBoris A. SakharovHans Jørgen JakobsenAnthony E. FallickAlfred L. SalynLidia G. DainyakBella B. ZviaginaDan N. Barfod,2007,https://link.springer.com/article/10.1346/CCMN.2007.0550304,Article
Evolution of Maturity in Northern Fars and in the Izeh Zone (Iranian Zagros) and Link with Hydrocarbon Prospectivity,Thrust Belts and Foreland Basins,,,,10.1007/978-3-540-69426-7_12,Jean Luc RudkiewiczShahram SherkatiJean Letouzey,2007,https://link.springer.com/chapter/10.1007/978-3-540-69426-7_12,Conference paper
Research on preservation and enrichment mechanisms of organic matter in muddy sediment and mudstone,Science in China Series D: Earth Sciences,,,,10.1007/s11430-007-0005-0,Cai JinGongBao YuJinYang ShouYeWang XingXinFan DaiDuXu JinLiWang AiPing,2007,https://link.springer.com/article/10.1007/s11430-007-0005-0,Article
"The Early Earth's Record of Supposed Extremophilic Bacteria and Cyanobacteria, at 3.8 to 2.5 GA",Algae and Cyanobacteria in Extreme Environments,,,,10.1007/978-1-4020-6112-7_41,Wladyslaw Altermann,2007,https://link.springer.com/chapter/10.1007/978-1-4020-6112-7_41,Chapter
Gold-bearing reefs of the Witwatersrand Basin: A model of synsedimentation hydrothermal formation,Geology of Ore Deposits,,,,10.1134/S1075701506060018,Yu. G. SafonovV. Yu. Prokof’ev,2006,https://link.springer.com/article/10.1134/S1075701506060018,Article
Evolution of Protoplanetary Disks Including Detailed Chemistry and Mineralogy,"Reactive Flows, Diffusion and Transport",,,,10.1007/978-3-540-28396-6_17,H. -P. GailW. M. Tscharnuter,2007,https://link.springer.com/chapter/10.1007/978-3-540-28396-6_17,Conference paper
The Chemistry of Processes in the Hydrosphere,Environmental Chemistry,,,,10.1007/978-0-387-31435-8_6,,2007,https://link.springer.com/chapter/10.1007/978-0-387-31435-8_6,Chapter
Hydrocarbon-induced magnetic contrasts in some Venezuelan and Colombian oil wells,"Earth, Planets and Space",,,,10.1186/BF03352636,Vincenzo Costanzo-AlvarezMilagrosa AldanaMarisel DíazGermán BayonaCarolina Ayala,2006,https://link.springer.com/article/10.1186/BF03352636,Article
Predicting Fate-Related Physicochemical Properties,Risk Assessment of Chemicals,,,,10.1007/978-1-4020-6102-8_9,G. SchüürmannR.-U. EbertM. NendzaJ.C. DeardenA. PaschkeR. Kühne,2007,https://link.springer.com/chapter/10.1007/978-1-4020-6102-8_9,Chapter
"Sedimentary environments of organic matter from Middle Permian source rocks in northern Xinjiang, China",Chinese Journal of Geochemistry,,,,10.1007/BF02840421,Miao JianyuKou HanshengZhou LifaHan Zhongyuan,2006,https://link.springer.com/article/10.1007/BF02840421,Article
The Evolution of Eating Systems,The Quest for Food,,,,10.1007/0-387-45461-6_4,Harald Brüssow,2007,https://link.springer.com/chapter/10.1007/0-387-45461-6_4,Chapter
Prediction of the phase state of hydrocarbon accumulations in the Mesozoic deposits of northwestern Siberia,Geochemistry International,,,,10.1134/S0016702906090060,S. A. PunanovaT. L. Vinogradova,2006,https://link.springer.com/article/10.1134/S0016702906090060,Article
CORALUS: An Integrated <i>In Situ</i> Corrosion Test on α-Active HLW Glass,MRS Online Proceedings Library,,,,10.1557/PROC-932-118.1,Elie ValckeSteven SmetsSerge LabatKarel LemmensPierre Van IseghemPeter ThomasNicole GodonPatrick JollivetGéraldine ParisotJean-Pierre MestreNorbert JockwerKlaus WieczorekClaudine Pozo,2006,https://link.springer.com/article/10.1557/PROC-932-118.1,Article
"Palaeoenvironmental implications of <i>Palaeomicrocodium</i> in Upper Devonian microbial mounds of the Chernyshev Swell, Timan-northern Ural Region",Facies,,,,10.1007/s10347-006-0083-z,Anna I. Antoshkina,2006,https://link.springer.com/article/10.1007/s10347-006-0083-z,Article
Technische Geochemie — Konzepte und Praxis,Ingenieurgeochemie,,,,10.1007/978-3-540-39512-6_1,Ulrich Förstner,2007,https://link.springer.com/chapter/10.1007/978-3-540-39512-6_1,Chapter
On the early stages of the evolution of the geosphere and biosphere,Paleontological Journal,,,,10.1134/S0031030106100017,N. L. DobretsovN. A. KolchanovV. V. Suslov,2006,https://link.springer.com/article/10.1134/S0031030106100017,Article
" 7. Ancient Fossil Record and Early Evolution (ca.&#xa0;3.8 to 0.5&#xa0;Ga)","Earth, Moon, and Planets",,,,10.1007/s11038-006-9091-9,Purificacón López-GarciaDavid MoreiraEmmanuel DouzeryPatrick ForterreMark Van ZuilenPhilippe ClaeysDaniel Prieur,2006,https://link.springer.com/article/10.1007/s11038-006-9091-9,Article
Phenomenon of life: Between equilibrium and non-linearity. Origin and principles of evolution,Geochemistry International,,,,10.1134/S0016702906130015,E. M. Galimov,2006,https://link.springer.com/article/10.1134/S0016702906130015,Article
"The Persian Gulf Basin: Geological history, sedimentary formations, and petroleum potential",Lithology and Mineral Resources,,,,10.1134/S0024490206040055,A. I. KonyuhovB. Maleki,2006,https://link.springer.com/article/10.1134/S0024490206040055,Article
The Origin of Petroleum,Practical Advances in Petroleum Processing,,,,10.1007/978-0-387-25789-1_2,Clifford C. Walters,2006,https://link.springer.com/chapter/10.1007/978-0-387-25789-1_2,Chapter
Organic Matter: The Driving Force for Early Diagenesis,Marine Geochemistry,,,,10.1007/3-540-32144-6_4,Jürgen Rullkötter,2006,https://link.springer.com/chapter/10.1007/3-540-32144-6_4,Chapter
Petroleum naphthenomono-and naphthenobiarenes,Petroleum Chemistry,,,,10.1134/S0965544106020022,Yu. A. GolovkoN. G. VoronetskayaG. S. PevnevaA. K. Golovko,2006,https://link.springer.com/article/10.1134/S0965544106020022,Article
"Palaeobiology of Mesoproterozoic Salkhan Limestone, Semri Group, Rohtas, Bihar, India: Systematics and significance",Journal of Earth System Science,,,,10.1007/BF02703027,Mukund Sharma,2006,https://link.springer.com/article/10.1007/BF02703027,Article
Thermogravimetry-differential thermal analysis coupled with chromatography as a thermal simulation experimental method and its application to gaseous hydrocarbons from different source rocks,Chinese Journal of Geochemistry,,,,10.1007/BF02871324,Shi Ji’anZhao XinWang QiLiu Quanyou,2005,https://link.springer.com/article/10.1007/BF02871324,Article
SULFUR AND METHANE CYCLING DURING THE HOLOCENE IN ACE LAKE (ANTARCTICA) REVEALED BY LIPID AND DNA STRATIGRAPHY,Past and Present Water Column Anoxia,,,,10.1007/1-4020-4297-3_03,Marco J.L. CoolenGerard MuyzerStefan SchoutenJohn K. VolkmanJaap S. Sinninghe Damsté,2006,https://link.springer.com/chapter/10.1007/1-4020-4297-3_03,Conference paper
References,Organic Contaminants in Riverine and Groundwater Systems,,,,10.1007/3-540-31172-6_8,,2006,https://link.springer.com/chapter/10.1007/3-540-31172-6_8,Chapter
The role of sulfur in the pyrolysis of kerogen,Chinese Science Bulletin,,,,10.1007/BF02890448,Qin YanPing’an PengChiling YuJinzhong Liu,2004,https://link.springer.com/article/10.1007/BF02890448,Article
Bacteria and Marine Biogeochemistry,Marine Geochemistry,,,,10.1007/3-540-32144-6_5,Bo Barker Jørgensen,2006,https://link.springer.com/chapter/10.1007/3-540-32144-6_5,Chapter
Atomic Force Microscopy,"Atomic Force Microscopy, Scanning Nearfield Optical Microscopy and Nanoscratching",,,,10.1007/978-3-540-28472-7_1,,2006,https://link.springer.com/chapter/10.1007/978-3-540-28472-7_1,Chapter
The Phototrophic Way of Life,The Prokaryotes,,,,10.1007/0-387-30742-7_3,Jörg OvermannFerrau Garcia-Pichel,2006,https://link.springer.com/rwe/10.1007/0-387-30742-7_3,Reference work entry
Sulphur,Handbook of Soil Analysis,,,,10.1007/978-3-540-31211-6_30,,2006,https://link.springer.com/chapter/10.1007/978-3-540-31211-6_30,Chapter
Environmental Pollution Control,Practical Advances in Petroleum Processing,,,,10.1007/978-0-387-25789-1_14,Paul R. RobinsonEli I. ShaheenEsber I. Shaheen,2006,https://link.springer.com/chapter/10.1007/978-0-387-25789-1_14,Chapter
Behavior of Pesticides in Water—Sediment Systems,Reviews of Environmental Contamination and Toxicology,,,,10.1007/978-1-4612-1280-5_4,Toshiyuki Katagi,2006,https://link.springer.com/chapter/10.1007/978-1-4612-1280-5_4,Chapter
The Evolution of Life on Earth and in the Universe,Life as We Know It,,,,10.1007/978-1-4020-4403-8_3,David DeamerJohn EvansBaruch S. BlumbergA. M. CarnerupA. G. ChristyJ. M. García–ruizS. T. HydeA.-K. LarssonEben C. RoseNicola McloughlinMartin D. BrasierP. J. L. BellJohn J. LeeMary Beth SaffoK. Tahir ShahClaudio Maccone,2006,https://link.springer.com/chapter/10.1007/978-1-4020-4403-8_3,Chapter
Behavior of Pesticides in Water-Sediment Systems,Reviews of Environmental Contamination and Toxicology,,,,10.1007/0-387-32885-8_4,Toshiyuki Katagi,2006,https://link.springer.com/chapter/10.1007/0-387-32885-8_4,Chapter
Early Cretaceous anoxic basin of the Russian Plate: Organic geochemistry,Lithology and Mineral Resources,,,,10.1007/s10987-005-0003-2,D. A. Bushnev,2005,https://link.springer.com/article/10.1007/s10987-005-0003-2,Article
Electrical Properties of Crustal and Mantle Rocks – A Review of Laboratory Measurements and their Explanation,Surveys in Geophysics,,,,10.1007/s10712-005-1759-6,Georg Nover,2005,https://link.springer.com/article/10.1007/s10712-005-1759-6,Article
Composition of kerogen in Kupferschiefer from southwest Poland,Chinese Journal of Geochemistry,,,,10.1007/BF02868973,Sun YuzhuangWilhelm Püttmann,2004,https://link.springer.com/article/10.1007/BF02868973,Article
Thinking about the evolution of photosynthesis,Discoveries in Photosynthesis,,,,10.1007/1-4020-3324-9_95,John M. OlsonRobert E. Blankenship,2005,https://link.springer.com/chapter/10.1007/1-4020-3324-9_95,Chapter
Muddy Depositional Systems,Mud and Mudstones,,,,10.1007/3-540-27082-5_5,,2005,https://link.springer.com/chapter/10.1007/3-540-27082-5_5,Chapter
Formation and Composition of Planetesimals,The Outer Planets and their Moons,,,,10.1007/1-4020-4038-5_3,Daniel GautierFranck Hersant,2005,https://link.springer.com/chapter/10.1007/1-4020-4038-5_3,Chapter
Petroleum enrichment characteristics in Ordovician carbonates in Lunnan area of Tarim Basin,Chinese Science Bulletin,,,,10.1007/BF02890454,Xiuxiang LüZhijun JinXinyuan ZhouNing YangQinghua WangWenqing Pan,2004,https://link.springer.com/article/10.1007/BF02890454,Article
Expectations for Infrared Spectroscopy of 9P/Tempel 1 from Deep Impact,Space Science Reviews,,,,10.1007/s11214-005-3388-2,Jessica M. SunshineMichael F. A’HearnOlivier GroussinLucy A. McFaddenKenneth P. KlaasenPeter H. SchultzCarey M. Lisse,2005,https://link.springer.com/article/10.1007/s11214-005-3388-2,Article
Anthropogenic Organic Contaminants Incorporated into the Non-Extractable Particulate Matter of Riverine Sediments from the Teltow Canal (Berlin),Environmental Chemistry,,,,10.1007/3-540-26531-7_31,J. SchwarzbauerM. RickingB. GierenR. KellerR. Littke,2005,https://link.springer.com/chapter/10.1007/3-540-26531-7_31,Chapter
Expectations for Infrared Spectroscopy of 9P/Tempel 1 from Deep Impact,Deep Impact Mission: Looking Beneath the Surface of a Cometary Nucleus,,,,10.1007/1-4020-4163-2_11,Jessica M. SunshineMichael F. A’HearnOlivier GroussinLucy A. McFaddenKenneth P. KlaasenPeter H. SchultzCarey M. Lisse,2005,https://link.springer.com/chapter/10.1007/1-4020-4163-2_11,Chapter
Formation and Composition of Planetesimals,Space Science Reviews,,,,10.1007/s11214-005-1946-2,Daniel GautierFranck Hersant,2005,https://link.springer.com/article/10.1007/s11214-005-1946-2,Article
Alkyldibenzothiophenes: molecular tracers for filling pathway in oil reservoirs,Chinese Science Bulletin,,,,10.1007/BF03183429,Tieguan WangFaqi HeMeijun LiYong HouShuqi Guo,2004,https://link.springer.com/article/10.1007/BF03183429,Article
Mineral Radioactivity in Sands as a Mechanism for Fixation of Organic Carbon on the Early Earth,Origins of life and evolution of the biosphere,,,,10.1023/B:ORIG.0000043132.23966.a1,John Parnell,2004,https://link.springer.com/article/10.1023/B:ORIG.0000043132.23966.a1,Article
Exploring The Saturn System In The Thermal Infrared: The Composite Infrared Spectrometer,Space Science Reviews,,,,10.1007/s11214-004-1454-9,F. M. FlasarV. G. KundeM. M. AbbasR. K. AchterbergP. AdeA. BarucciB. B’ezardG. L. BjorakerJ. C. BrasunasS. CalcuttR. CarlsonC. J. C’esarskyB. J. ConrathA. CoradiniR. CourtinA. CoustenisS. EdbergS. EdgingtonC. FerrariT. FouchetD. GautierP. J. GieraschK. GrossmanP. IrwinD. E. JenningsE. LellouchA. A. MamoutkineA. MartenJ. P. MeyerC. A. NixonG. S. OrtonT. C. OwenJ. C. PearlR. Prang’eF. RaulinP. L. ReadP. N. RomaniR. E. SamuelsonM. E. SeguraM. R. SHOWALTERA. A. Simon-MillerM. D. SmithJ. R. SpencerL. J. SpilkerF. W. Taylor,2004,https://link.springer.com/article/10.1007/s11214-004-1454-9,Article
Thinking About the Evolution of Photosynthesis,Photosynthesis Research,,,,10.1023/B:PRES.0000030457.06495.83,John M. OlsonRobert E. Blankenship,2004,https://link.springer.com/article/10.1023/B:PRES.0000030457.06495.83,Article
Thermoanalytical investigation of lignite humic acids fractions,Journal of Thermal Analysis and Calorimetry,,,,10.1023/B:JTAN.0000027803.24266.48,J. KuceríkJ. KovárM. Pekar,2004,https://link.springer.com/article/10.1023/B:JTAN.0000027803.24266.48,Article
Early Life on Earth: The Ancient Fossil Record,Astrobiology: Future Perspectives,,,,10.1007/1-4020-2305-7_12,Frances Westall,2004,https://link.springer.com/chapter/10.1007/1-4020-2305-7_12,Chapter
Burning Buried Sunshine: Human Consumption of Ancient Solar Energy,Climatic Change,,,,10.1023/A:1026391317686,Jeffrey S. Dukes,2003,https://link.springer.com/article/10.1023/A:1026391317686,Article
Organic–inorganic interactions in petroleum-producing sedimentary basins,Nature,,,,10.1038/nature02132,Jeffrey S. Seewald,2003,https://link.springer.com/article/10.1038/nature02132,Article
Carbon in the Bottom Sediments,Carbon Cycle in the Russian Arctic Seas,,,,10.1007/978-3-662-06208-1_6,Alexander A. VetrovEvgenii A. Romankevich,2004,https://link.springer.com/chapter/10.1007/978-3-662-06208-1_6,Chapter
Natural gas generation model and its response in accumulated fluids in the Yinggehai basin,Science in China Series D: Earth Sciences,,,,10.1360/02yd0013,Fang HaoHuayao ZouBaojia Huang,2003,https://link.springer.com/article/10.1360/02yd0013,Article
Chemistry of Protoplanetary Disks,Astrobiology: Future Perspectives,,,,10.1007/1-4020-2305-7_3,A.J. MarkwickanS.B. Charnley,2004,https://link.springer.com/chapter/10.1007/1-4020-2305-7_3,Chapter
From Elemental Carbon to Complex Macromolecular Networks in Space,Astrobiology: Future Perspectives,,,,10.1007/1-4020-2305-7_5,Franco Cataldo,2004,https://link.springer.com/chapter/10.1007/1-4020-2305-7_5,Chapter
Possible Biogeochemical Cycles on Titan,Origins,,,,10.1007/1-4020-2522-X_39,M. B. Simakov,2004,https://link.springer.com/chapter/10.1007/1-4020-2522-X_39,Chapter
Kuiper Belt: Water and Organics,Astrobiology: Future Perspectives,,,,10.1007/1-4020-2305-7_9,Catherine de Bergh,2004,https://link.springer.com/chapter/10.1007/1-4020-2305-7_9,Chapter
Evaluating Comets as A Source of Earth’s Water,Origins,,,,10.1007/1-4020-2522-X_34,Humberto CampinsTimothy D. SwindleDavid A. Kring,2004,https://link.springer.com/chapter/10.1007/1-4020-2522-X_34,Chapter
"Organic Carbon in Arctic Ocean Sediments: Sources, Variability, Burial, and Paleoenvironmental Significance",The Organic Carbon Cycle in the Arctic Ocean,,,,10.1007/978-3-642-18912-8_7,Ruediger SteinR. W. MacdonaldA. S. NaiduM. B. YunkerC. GobeilL. W. CooperJ. M. GrebmeierT. E. WhitledgeM. J. HameediV. I. PetrovaG. I. BatovaA. G. ZinchenkoA. V. KurshevaE. V. NarkevskiyK. FahlA. VetrovE. A. RomankevichD. BirgelC. SchubertH. R. HarveyD. Weiel,2004,https://link.springer.com/chapter/10.1007/978-3-642-18912-8_7,Chapter
Lacustrine biomass: An significant precursor of high wax oil,Chinese Science Bulletin,,,,10.1007/BF03183992,Haiping HuangYabin ZhengZhanwen ZhangJinyou Li,2003,https://link.springer.com/article/10.1007/BF03183992,Article
Paleoenvironment and sea-level change in the early Cretaceous Barents Sea—implications from near-shore marine sapropels,Geo-Marine Letters,,,,10.1007/s00367-003-0122-5,Uwe LangrockRuediger SteinMarcus LipinskiHans-Jürgen Brumsack,2003,https://link.springer.com/article/10.1007/s00367-003-0122-5,Article
Exploring the Saturn System in the Thermal Infrared: The Composite Infrared Spectrometer,The Cassini-Huygens Mission,,,,10.1007/1-4020-3874-7_4,F. M. FlasarV. G. KundeM. M. AbbasR. K. AchterbergP. AdeA. BarucciB. BézardG. L. BjorakerJ. C. BrasunasS. CalcuttR. CarlsonC. J. CésarskyB.J. ConrathA. CoradiniR. CourtinA. CoustenisS. EdbergS. EdgingtonC. FerrariT. FouchetD. GautierP. J. GieraschK. GrossmanP. IrwinD. E. JenningsE. LellouchA. A. MamoutkineA. MartenJ. P. MeyerC. A. NixonG. S. OrtonT. C. OwenJ. C. PearlR. PrangéF. RaulinP. L. ReadP. N. RomaniR. E. SamuelsonM. E. SeguraM. R. ShowalterA. A. Simon-MillerM. D. SmithJ. R. SpencerL. J. SpilkerF. W. Taylor,2004,https://link.springer.com/chapter/10.1007/1-4020-3874-7_4,Chapter
"Abstracts of the Oral Presentations from the 13th International Conference on the Origin of Life Oaxaca, Mexico, June 30 to July 5, 2002",Origins of life and evolution of the biosphere,,,,10.1023/A:1024826809131,,2003,https://link.springer.com/article/10.1023/A:1024826809131,Article
Biomarker Analysis in Petroleum Exploration,Analytical Advances for Hydrocarbon Research,,,,10.1007/978-1-4419-9212-3_9,C. S. HsuC. C. WaltersG. H. IsaksenM. E. SchapsK. E. Peters,2003,https://link.springer.com/chapter/10.1007/978-1-4419-9212-3_9,Chapter
Salinity variation of formation water and diagenesis reaction in abnormal pressure environments,Science in China Series D: Earth Sciences,,,,10.1360/03yd9025,Xie XinongJiao J. JiuLi SitianCheng Jianmei,2003,https://link.springer.com/article/10.1360/03yd9025,Article
The Use of Thermal Analytical Methods in Organic Geochemistry,Natural and Laboratory-Simulated Thermal Geochemical Processes,,,,10.1007/978-94-017-0111-2_9,R. Paul Philp,2003,https://link.springer.com/chapter/10.1007/978-94-017-0111-2_9,Chapter
Thermal Transformation of Soil Organic Matter by Natural Fires and Laboratory-Controlled Heatings,Natural and Laboratory-Simulated Thermal Geochemical Processes,,,,10.1007/978-94-017-0111-2_4,F. J. González-VilaGalmendros,2003,https://link.springer.com/chapter/10.1007/978-94-017-0111-2_4,Chapter
"Petroleum Generation, Extraction and Migration and Abiogenic Synthesis in Hydrothermal Systems",Natural and Laboratory-Simulated Thermal Geochemical Processes,,,,10.1007/978-94-017-0111-2_1,Bernd R. T. Simoneit,2003,https://link.springer.com/chapter/10.1007/978-94-017-0111-2_1,Chapter
Thermochemical Reactions of Middle Rank Coals,Natural and Laboratory-Simulated Thermal Geochemical Processes,,,,10.1007/978-94-017-0111-2_3,Yuqun ZhuoAlan A. HerodRafael Kandiyoti,2003,https://link.springer.com/chapter/10.1007/978-94-017-0111-2_3,Chapter
Differential Thermal Analysis (DTA) in the Study of Thermal Reactions of Organo-Clay Complexes,Natural and Laboratory-Simulated Thermal Geochemical Processes,,,,10.1007/978-94-017-0111-2_8,Shmuel Yariv,2003,https://link.springer.com/chapter/10.1007/978-94-017-0111-2_8,Chapter
Terrigenous Signals in Sediments of the Low Latitude Atlantic — Implications for Environmental Variations during the Late Quarternary: Part I: Organic Carbon,The South Atlantic in the Late Quaternary,,,,10.1007/978-3-642-18917-3_15,T. WagnerlM. ZabelL. DupontJ. HoltvoethC.J. Schubert,2003,https://link.springer.com/chapter/10.1007/978-3-642-18917-3_15,Chapter
The Effect of Management of the Fertility of Amazonian Dark Earth Soils,Amazonian Dark Earths,,,,10.1007/1-4020-2597-1_21,Beá MadariVinicius de M. BenitesTony J. F. Cunha,2003,https://link.springer.com/chapter/10.1007/1-4020-2597-1_21,Chapter
Biogeochemical Cycling of Macroelements,Modern Biogeochemistry,,,,10.1007/0-306-48103-0_3,,2003,https://link.springer.com/chapter/10.1007/0-306-48103-0_3,Chapter
Extraterrestrial Organic Compounds in Meteorites,Surveys in Geophysics,,,,10.1023/A:1020139302770,Oliver BottaJeffrey L. Bada,2002,https://link.springer.com/article/10.1023/A:1020139302770,Article
Tin–polymetallic sulfide deposits in the eastern part of the Dachang tin field (South China) and the role of black shales in their origin,Mineralium Deposita,,,,10.1007/s00126-002-0269-4,Jan PašavaBohdan KříbekPetr DobešIvan VavřínKarel ŽákFan DelianZhang TaoMarie-Christine Boiron,2002,https://link.springer.com/article/10.1007/s00126-002-0269-4,Article
Technische Geochemie — Konzepte und Praxis,Ingenieurgeochemie,,,,10.1007/978-3-662-07903-4_1,Ulrich Förstner,2003,https://link.springer.com/chapter/10.1007/978-3-662-07903-4_1,Chapter
The Early Cretaceous Anoxic Basin of the Russian Plate: Sedimentology and Geochemistry,Lithology and Mineral Resources,,,,10.1023/A:1019943305677,Yu. O. GavrilovE. V. ShchepetovaE. Yu. BaraboshkinE. A. Shcherbinina,2002,https://link.springer.com/article/10.1023/A:1019943305677,Article
Organic Tracers from Wild Fire Residues in Soils and Rain/River Wash-Out,"Water, Air, and Soil Pollution",,,,10.1023/A:1015557301467,Daniel R. OrosMonica A. MazurekJohn E. BahamBernd R. T. Simoneit,2002,https://link.springer.com/article/10.1023/A:1015557301467,Article
Search for Morphological and Biogeochemical Vestiges of Fossil Life in Extraterrestrial Settings: Utility of Terrestrial Evidence,Astrobiology,,,,10.1007/978-3-642-59381-9_24,Manfred Schidlowski,2002,https://link.springer.com/chapter/10.1007/978-3-642-59381-9_24,Chapter
"The Paragenesis of Organic Matter, Phosphorus, and Uranium in Marine Sediments",Lithology and Mineral Resources,,,,10.1023/A:1014816315203,A. V. KochenovG. N. Baturin,2002,https://link.springer.com/article/10.1023/A:1014816315203,Article
