Item Title,Publication Title,Book Series Title,Journal Volume,Journal Issue,Item DOI,Authors,Publication Year,URL,Content Type
Environmental Issues,The Soils of Serbia,,,,10.1007/978-94-017-8660-7_11,Pavle PavlovićNikola KostićBranko KaradžićMiroslava Mitrović,2017,https://link.springer.com/chapter/10.1007/978-94-017-8660-7_11,Chapter
"Hydrocarbon Potential of the Paleogene Disang Group, Manipur Region, India-A Palynological Approach",Petroleum Geosciences: Indian Contexts,,,,10.1007/978-3-319-03119-4_8,Y. Raghumani SinghB. P. SinghJianguo Li,2015,https://link.springer.com/chapter/10.1007/978-3-319-03119-4_8,Chapter
Geological Considerations for CO2 Storage in Coal,Geologic Carbon Sequestration,,,,10.1007/978-3-319-27019-7_8,Jack C. Pashin,2016,https://link.springer.com/chapter/10.1007/978-3-319-27019-7_8,Chapter
"Basin modelling of gas migration and accumulation in volcanic reservoirs in the Xujiaweizi Fault-depression, Songliao Basin",Arabian Journal of Geosciences,,,,10.1007/s12517-015-2072-4,Wenguang WangMin WangShuangfang LuShumin ChenMin ZhengXiaozhi Wu,2016,https://link.springer.com/article/10.1007/s12517-015-2072-4,Article
Source rock characteristics of Albian Kazhdumi Formation in Zagros Region,Arabian Journal of Geosciences,,,,10.1007/s12517-015-1782-y,Ebrahim SefidariAbdolhossein AminiAli Dashti,2015,https://link.springer.com/article/10.1007/s12517-015-1782-y,Article
"Light carbon isotope events of foraminifera attributed to methane release from gas hydrates on the continental slope, northeastern South China Sea",Science China Earth Sciences,,,,10.1007/s11430-016-5323-7,Chang ZhuangFang ChenSiHai ChengHongFeng LuCong WuJun CaoXiao Duan,2016,https://link.springer.com/article/10.1007/s11430-016-5323-7,Article
Valorisation of Biowastes for the Production of Green Materials Using Chemical Methods,Chemistry and Chemical Technologies in Waste Valorization,,,,10.1007/978-3-319-90653-9_4,Thomas I. J. DugmoreJames H. ClarkJulen BustamanteJoseph A. HoughtonAvtar S. Matharu,2017,https://link.springer.com/chapter/10.1007/978-3-319-90653-9_4,Chapter
Halotolerant Life in Feast or Famine: Organic Sources of Hydrocarbons and Fixers of Metals,Evaporites,,,,10.1007/978-3-319-13512-0_9,John K. Warren,2016,https://link.springer.com/chapter/10.1007/978-3-319-13512-0_9,Chapter
New data on the biostratigraphy and facies types of upper carboniferous Domanik sections in the Volga–Ural basin,Moscow University Geology Bulletin,,,,10.3103/S014587521505004X,Yu. A. GatovskiiA. V. StupakovaG. A. KalmykovN. I. KorobovaA. A. SuslovaR. S. SautkinD. G. Kalmykov,2016,https://link.springer.com/article/10.3103/S014587521505004X,Article
Spurious thermoluminescence characteristics of the Ediacaran Doushantuo Formation (ca. 635–551 Ma) and its implications for marine dissolved organic carbon reservoir,Journal of Earth Science,,,,10.1007/s12583-015-0650-3,Haiyang WangChao LiChaoyong HuShucheng Xie,2015,https://link.springer.com/article/10.1007/s12583-015-0650-3,Article
"Characterization of lacustrine carbonate reservoirs in the Eocene Sikou Sag, Bohai Bay Basin, East China",Carbonates and Evaporites,,,,10.1007/s13146-016-0301-x,Yongqiang YangLongwei QiuJay M. GreggJim PucketteKuiyuan Liu,2016,https://link.springer.com/article/10.1007/s13146-016-0301-x,Article
Black shale in late Jurassic Jhuran Formation of Kutch: Possible indicator of oceanic anoxic event?,Journal of the Geological Society of India,,,,10.1007/s12594-015-0215-6,Ashwin AroraSantanu BanerjeeSuryendu Dutta,2015,https://link.springer.com/article/10.1007/s12594-015-0215-6,Article
Lower Temperature Metals in an Evaporitic Framework,Evaporites,,,,10.1007/978-3-319-13512-0_15,John K. Warren,2016,https://link.springer.com/chapter/10.1007/978-3-319-13512-0_15,Chapter
Main Types of Organic Matter in Geosphere,Fossil Matter in the Geosphere,,,,10.1007/978-3-319-11938-0_2,Jan SchwarzbauerBranimir Jovančićević,2015,https://link.springer.com/chapter/10.1007/978-3-319-11938-0_2,Chapter
Petroleum Potential of the Congo Basin,Geology and Resource Potential of the Congo Basin,,,,10.1007/978-3-642-29482-2_18,Damien DelvauxMax Fernandez-Alonso,2015,https://link.springer.com/chapter/10.1007/978-3-642-29482-2_18,Chapter
"Technologies of seismic acoustic and electromagnetic monitoring of soils for prospecting and controlling hydrocarbon production: Arctic shelf, hard-to-extract reserves, and distributed deposits",Physics of Wave Phenomena,,,,10.3103/S1541308X16030018,F. V. BunkinA. I. BelovL. B. VolkomirskayaO. A. GulevichV. N. DrachenkoA. K. ZhornikovG. N. KuznetsovG. A. LyakhovV. G. PetnikovA. E. ReznikovI. V. Sinilschikov,2016,https://link.springer.com/article/10.3103/S1541308X16030018,Article
Chapter 9 Memories of Shock Wave Research at Sandia,Impactful Times,,,,10.1007/978-3-319-33347-2_9,James R. AsayLalit C. ChhabildasR. Jeffery LawrenceMary Ann Sweeney,2017,https://link.springer.com/chapter/10.1007/978-3-319-33347-2_9,Chapter
Stable carbon compounds in soils: Their origin and functions,Eurasian Soil Science,,,,10.1134/S1064229315090069,P. V. Krasilnikov,2015,https://link.springer.com/article/10.1134/S1064229315090069,Article
"Organic geochemical characteristics of Cretaceous Lamja Formation from Yola Sub-basin, Northern Benue Trough, NE Nigeria: implication for hydrocarbon-generating potential and paleodepositional setting",Arabian Journal of Geosciences,,,,10.1007/s12517-014-1713-3,Babangida M. Sarki YandokaWan Hasiah AbdullahM. B. AbubakarMohammed Hail HakimiKhairul Azlan MustaphaAdebanji Kayode Adegoke,2014,https://link.springer.com/article/10.1007/s12517-014-1713-3,Article
NanoSIMS investigation of glycine-derived C and N retention with soil organo-mineral associations,Biogeochemistry,,,,10.1007/s10533-015-0138-8,Pierre-Joseph HattonLaurent RemusatBernd ZellerElizabeth A. BrewerDelphine Derrien,2015,https://link.springer.com/article/10.1007/s10533-015-0138-8,Article
Predictive new geological model for future hydrocarbon exploration in Indian sedimentary basins,Journal of the Geological Society of India,,,,10.1007/s12594-015-0270-z,J. S. Rawat,2015,https://link.springer.com/article/10.1007/s12594-015-0270-z,Article
Subaqueous Salts: Salinas and Perennial Lakes,Evaporites,,,,10.1007/978-3-319-13512-0_4,John K. Warren,2016,https://link.springer.com/chapter/10.1007/978-3-319-13512-0_4,Chapter
"A refined genetic model for the Laisvall and Vassbo Mississippi Valley-type sandstone-hosted deposits, Sweden: constraints from paragenetic studies, organic geochemistry, and S, C, N, and Sr isotope data",Mineralium Deposita,,,,10.1007/s00126-015-0627-7,Nicolas J. SaintilanJorge E. SpangenbergElias SamankassouKalin KouzmanovMassimo ChiaradiaMichael B. StephensLluís Fontboté,2015,https://link.springer.com/article/10.1007/s00126-015-0627-7,Article
Contributions of non-tectonic micro-fractures to hydraulic fracturing—A numerical investigation based on FSD model,Science China Earth Sciences,,,,10.1007/s11430-015-5232-1,Yu WangXiao LiZhiHeng ZhaoRunQing ZhouBo ZhangGuanFang Li,2016,https://link.springer.com/article/10.1007/s11430-015-5232-1,Article
Hypersaline Fluid Evolution During Burial and Uplift,Evaporites,,,,10.1007/978-3-319-13512-0_8,John K. Warren,2016,https://link.springer.com/chapter/10.1007/978-3-319-13512-0_8,Chapter
First whiffs of atmospheric oxygen triggered onset of crustal gold cycle,Mineralium Deposita,,,,10.1007/s00126-014-0574-8,Hartwig E. FrimmelQuinton Hennigh,2015,https://link.springer.com/article/10.1007/s00126-014-0574-8,Article
On the estimation of shale-oil resources and reserves,Moscow University Geology Bulletin,,,,10.3103/S0145875215030096,A. V. StupakovaG. A. KalmykovN. P. FadeevaA. Kh. BogomolovT. A. KiryukhinaN. I. KorobovaV. V. MaltsevN. V. ProninaR. S. SautkinA. A. SuslovaT. A. Shardanova,2015,https://link.springer.com/article/10.3103/S0145875215030096,Article
Higher petroleum alkyltoluenes: Evaluation of thermodynamic maturity,Petroleum Chemistry,,,,10.1134/S0965544115030093,S. B. Ostroukhov,2015,https://link.springer.com/article/10.1134/S0965544115030093,Article
France,Uranium Deposits of the World,,,,10.1007/978-3-540-78554-5_6,Franz J Dahlkamp,2016,https://link.springer.com/rwe/10.1007/978-3-540-78554-5_6,Reference work entry
Structural modifications of VO<sup>2+</sup> chelates in the organic matter of oils and bitumens from the EPR spectra,Journal of Structural Chemistry,,,,10.1134/S0022476615030051,L. G. GilinskayaL. S. BorisovaE. A. Kostyreva,2015,https://link.springer.com/article/10.1134/S0022476615030051,Article
Safety and the Environment,Springer Handbook of Petroleum Technology,,,,10.1007/978-3-319-49347-3_2,Paul R. Robinson,2017,https://link.springer.com/chapter/10.1007/978-3-319-49347-3_2,Chapter
Cretaceous source rocks and associated oil and gas resources in the world and China: A review,Petroleum Science,,,,10.1007/s12182-014-0348-z,Ruofei YangYuce WangJian Cao,2014,https://link.springer.com/article/10.1007/s12182-014-0348-z,Article
"Genetic mechanisms of secondary pore development zones of Es<Stack>
                <sub>4</sub>
                <sup>x</sup>
              </Stack> in the north zone of the Minfeng Sag in the Dongying Depression, East China",Petroleum Science,,,,10.1007/s12182-016-0076-7,Yan-Zhong WangYing-Chang CaoShao-Min ZhangFu-Lai LiFan-Chao Meng,2016,https://link.springer.com/article/10.1007/s12182-016-0076-7,Article
"Predicted bulk composition of petroleum generated by Lower Cretaceous Wealden black shales, Lower Saxony Basin, Germany",International Journal of Earth Sciences,,,,10.1007/s00531-014-1081-y,Volker ZiegsNicolaj MahlstedtBenjamin BrunsBrian Horsfield,2014,https://link.springer.com/article/10.1007/s00531-014-1081-y,Article
"Hydrocarbon potential of Sargelu Formation and oil-source correlation, Iraqi Kurdistan",Arabian Journal of Geosciences,,,,10.1007/s12517-014-1651-0,Rzger A. Abdula,2014,https://link.springer.com/article/10.1007/s12517-014-1651-0,Article
The evolution of hydrocarbon systems in the North Kara sea: Evidence from 2D modeling,Moscow University Geology Bulletin,,,,10.3103/S0145875215020118,K. F. StartsevaA. V. ErshovV. A. Nikishin,2015,https://link.springer.com/article/10.3103/S0145875215020118,Article
Seepage in Field Geology and Petroleum Exploration,Natural Gas Seepage,,,,10.1007/978-3-319-14601-0_5,Giuseppe Etiope,2015,https://link.springer.com/chapter/10.1007/978-3-319-14601-0_5,Chapter
"Geochemical characteristics of a tropical lowland peat dome in the Kota Samarahan-Asajaya area, West Sarawak, Malaysia",Environmental Earth Sciences,,,,10.1007/s12665-014-3504-2,Mohamad Tarmizi Mohamad ZulkifleyTham Fatt NgWan Hasiah AbdullahJohn Kuna RajMustaffa Kamal ShuibAzman Abdul GhaniMuhammad Aqeel Ashraf,2014,https://link.springer.com/article/10.1007/s12665-014-3504-2,Article
Porphyrins in Heavy Petroleums: A Review,Structure and Modeling of Complex Petroleum Mixtures,,,,10.1007/430_2015_189,Xu ZhaoChunming XuQuan Shi,2015,https://link.springer.com/chapter/10.1007/430_2015_189,Chapter
Early Earth Systems,"Climate, Fire and Human Evolution",,,,10.1007/978-3-319-22512-8_1,Andrew Y. GliksonColin Groves,2016,https://link.springer.com/chapter/10.1007/978-3-319-22512-8_1,Chapter
Carbon Dioxide,Experimenting on a Small Planet,,,,10.1007/978-3-319-27404-1_21,William W. Hay,2016,https://link.springer.com/chapter/10.1007/978-3-319-27404-1_21,Chapter
Threats to the Soil Functions,Scheffer/SchachtschabelSoil Science,,,,10.1007/978-3-642-30942-7_10,Hans-Peter BlumeGerhard W. BrümmerHeiner FleigeRainer HornEllen KandelerIngrid Kögel-KnabnerRuben KretzschmarKarl StahrBerndt-Michael Wilke,2016,https://link.springer.com/chapter/10.1007/978-3-642-30942-7_10,Chapter
"Estimation of subsurface formation temperature in the Tarim Basin, northwest China: implications for hydrocarbon generation and preservation",International Journal of Earth Sciences,,,,10.1007/s00531-015-1253-4,Shaowen LiuXiao LeiChangge FengChunyan Hao,2015,https://link.springer.com/article/10.1007/s00531-015-1253-4,Article
"Characterization of authigenic carbonates from Huoshaogang landfill, Guangzhou, China: implication for microbial metabolism",Environmental Earth Sciences,,,,10.1007/s12665-015-4485-5,Junxi FengDuofu Chen,2015,https://link.springer.com/article/10.1007/s12665-015-4485-5,Article
Hydrocarbons and Evaporites,Evaporites,,,,10.1007/978-3-319-13512-0_10,John K. Warren,2016,https://link.springer.com/chapter/10.1007/978-3-319-13512-0_10,Chapter
"Hydrocarbon source potential and depositional environment of the Surma Group shales of Bengal basin, Bangladesh",Journal of the Geological Society of India,,,,10.1007/s12594-014-0060-z,Md. FarhaduzzamanWan Hasiah AbdullahMd. Aminul Islam,2014,https://link.springer.com/article/10.1007/s12594-014-0060-z,Article
"Stratigraphic Expression of Climate, Tectonism, and Geomorphic Forcing in an Underfilled Lake Basin: Wilkins Peak Member of the Green River Formation","Stratigraphy and Paleolimnology of the Green River Formation, Western USA",,,,10.1007/978-94-017-9906-5_4,Michael Elliot SmithAlan R. CarrollJennifer Jane Scott,2015,https://link.springer.com/chapter/10.1007/978-94-017-9906-5_4,Chapter
Variations of Stable Isotope Ratios in Nature,Stable Isotope Geochemistry,,,,10.1007/978-3-319-19716-6_3,Jochen Hoefs,2015,https://link.springer.com/chapter/10.1007/978-3-319-19716-6_3,Chapter
Evolution of concepts on the origin of the Witwatersrand gold deposit,Moscow University Geology Bulletin,,,,10.3103/S0145875215020106,V. I. StarostinD. R. Sakya,2015,https://link.springer.com/article/10.3103/S0145875215020106,Article
Source of hydrocarbons in the supergiant Romashkino oilfield (Tatarstan): Recharge from the crystalline basement or source sediments?,Geochemistry International,,,,10.1134/S0016702915020032,E. M. GalimovA. I. Kamaleeva,2015,https://link.springer.com/article/10.1134/S0016702915020032,Article
"Complexation of Surfactant/β-Cyclodextrin to Inhibit Surfactant Adsorption onto Sand, Kaolin, and Shale for Applications in Enhanced Oil Recovery Processes. Part I: Static Adsorption Analysis",Journal of Surfactants and Detergents,,,,10.1007/s11743-015-1688-4,Sirinthip KittisrisawaiLaura Beatriz Romero-Zerón,2015,https://link.springer.com/article/10.1007/s11743-015-1688-4,Article
Minerals and Energy—Non-renewable Sources,Macro-Economics of Mineral and Water Resources,,,,10.1007/978-3-319-15054-3_4,Kaulir Kisor Chatterjee,2015,https://link.springer.com/chapter/10.1007/978-3-319-15054-3_4,Chapter
Key elements controlling oil accumulation within the tight sandstones,Journal of Earth Science,,,,10.1007/s12583-015-0550-y,Haiyan HuZhiping ZengJianzhang Liu,2015,https://link.springer.com/article/10.1007/s12583-015-0550-y,Article
Heterotrophic Communities Supplied by Ancient Organic Carbon Predominate in Deep Fennoscandian Bedrock Fluids,Microbial Ecology,,,,10.1007/s00248-014-0490-6,Lotta PurkamoMalin BombergMari NyyssönenIlmo KukkonenLasse AhonenMerja Itävaara,2014,https://link.springer.com/article/10.1007/s00248-014-0490-6,Article
"Oil biomarkers, isotopes, and palynofacies are used for petroleum system type and migration pathway assessments of Iraqi oil fields",Arabian Journal of Geosciences,,,,10.1007/s12517-014-1606-5,Thamer Khazaal Al-Ameri,2014,https://link.springer.com/article/10.1007/s12517-014-1606-5,Article
Plant-Pollutant Interaction,"Plants, Pollutants and Remediation",,,,10.1007/978-94-017-7194-8_11,Rida RehmanAlvina Gul,2015,https://link.springer.com/chapter/10.1007/978-94-017-7194-8_11,Chapter
64<sup>TH</sup> ASMS Conference on Mass Spectrometry and Allied Topics,Journal of The American Society for Mass Spectrometry,,,,10.1007/s13361-016-1413-1,Judith Sjoberg,2016,https://link.springer.com/article/10.1007/s13361-016-1413-1,Article
"The shale gas potential of Tournaisian, Visean, and Namurian black shales in North Germany: baseline parameters in a geological context",Environmental Earth Sciences,,,,10.1007/s12665-013-2745-9,Dorit I. KerschkeHans-Martin Schulz,2013,https://link.springer.com/article/10.1007/s12665-013-2745-9,Article
Biodiversity of the Blue Zone,Blue Carbon Reservoir of the Blue Planet,,,,10.1007/978-81-322-2107-4_2,Abhijit MitraSufia Zaman,2015,https://link.springer.com/chapter/10.1007/978-81-322-2107-4_2,Chapter
"Petroleum prospects of Lamu Basin, South-Eastern Kenya",Journal of the Geological Society of India,,,,10.1007/s12594-014-0058-6,Mogaka D. NyaberiBernard K. Rop,2014,https://link.springer.com/article/10.1007/s12594-014-0058-6,Article
"Distribution, classification, petrological and related gochemical (SRA) characteristics of a tropical lowland peat dome in the Kota Samarahan-Asajaya area, West Sarawak, Malaysia",Central European Journal of Geosciences,,,,10.2478/s13533-012-0130-y,Mohamad Tarmizi Mohamad ZulkifleyNg Tham FattWan Hasiah AbdullahJohn Kuna RajS. Paramanathan ParamRoslan HashimMuhammad Aqeel Ashraf,2013,https://link.springer.com/article/10.2478/s13533-012-0130-y,Article
Biogeochemical Cycles,Environmental Microbiology: Fundamentals and Applications,,,,10.1007/978-94-017-9118-2_14,Jean-Claude BertrandPatricia BoninPierre CaumetteJean-Pierre GattusoGérald GrégoriRémy GuyoneaudXavier Le RouxRobert MatheronFranck Poly,2015,https://link.springer.com/chapter/10.1007/978-94-017-9118-2_14,Chapter
"Redox condition during Ediacaran–Cambrian transition in the Lower Yangtze deep water basin, South China: constraints from iron speciation and <i>δ</i>
              <sup>13</sup>C<sub>org</sub> in the Diben section, Zhejiang",Chinese Science Bulletin,,,,10.1007/s11434-014-0483-3,Yuyang YuanChunfang CaiTiankai WangLei XiangLianqi JiaYan Chen,2014,https://link.springer.com/article/10.1007/s11434-014-0483-3,Article
Sedimentogenesis in the Mesozoic-Cenozoic continental rifts of Central Asia,Moscow University Geology Bulletin,,,,10.3103/S0145875214050123,Yu. G. TsekhovskiiO. V. YapaskurtI. E. Stukalova,2014,https://link.springer.com/article/10.3103/S0145875214050123,Article
"Palynofacies, organic geochemical analyses and hydrocarbon potential of some Upper Jurassic-Lower Cretaceous rocks, the Sabatayn-1 well, Central Yemen",Arabian Journal of Geosciences,,,,10.1007/s12517-013-0961-y,Abdulwahab S. AlaugMagdy S. MahmoudAmr S. DeafThamer K. AL-Ameri,2013,https://link.springer.com/article/10.1007/s12517-013-0961-y,Article
EPR of Primitive Organic Matter: A Tool for Astrobiology,Applications of EPR in Radiation Research,,,,10.1007/978-3-319-09216-4_15,Didier GourierLaurent BinetHervé Vezin,2014,https://link.springer.com/chapter/10.1007/978-3-319-09216-4_15,Chapter
Geochemical features of low-mature lacustrine oils of China,Petroleum Chemistry,,,,10.1134/S0965544114030128,T. L. VinogradovaS. A. Punanova,2014,https://link.springer.com/article/10.1134/S0965544114030128,Article
"Hydrocarbon source potential of the Jurassic sediments of Salam-3X borehole, Khalda Concession, Northern Western Desert, Egypt",Arabian Journal of Geosciences,,,,10.1007/s12517-013-0997-z,Adel W. FelestteenMaher I. El-SoughierMustafa S. MohamedMostafa N. S. Monged,2013,https://link.springer.com/article/10.1007/s12517-013-0997-z,Article
"Palynology and depositional facet of lower Permian (Artinskian) sediments from New Majri opencast mine, Wardha basin, India",Journal of the Geological Society of India,,,,10.1007/s12594-014-0102-6,S. MaheshK. Pauline SabinaL. Mahesh Bilwa,2014,https://link.springer.com/article/10.1007/s12594-014-0102-6,Article
Thermophilic prokaryotes from deep subterranean habitats,Microbiology,,,,10.1134/S0026261714030151,A. I. SlobodkinG. B. Slobodkina,2014,https://link.springer.com/article/10.1134/S0026261714030151,Article
"Palynostratigraphy and palaeoenvironmental significance of the Cretaceous palynomorphs in the Qattara Rim-1X well, North Western Desert, Egypt",Arabian Journal of Geosciences,,,,10.1007/s12517-013-0954-x,Maher I. El-SoughierAmr S. DeafMagdy S. Mahmoud,2013,https://link.springer.com/article/10.1007/s12517-013-0954-x,Article
Environmental effects of soil contamination by shale fuel oils,Environmental Science and Pollution Research,,,,10.1007/s11356-014-3043-0,Liina KanarbikIrina BlinovaMariliis SihtmäeKai Künnis-BeresAnne Kahru,2014,https://link.springer.com/article/10.1007/s11356-014-3043-0,Article
"Sedimentary and organic facies investigation of the Gurpi Formation (Campanian–Paleocene) in southwest of Zagros, Iran",Arabian Journal of Geosciences,,,,10.1007/s12517-013-0993-3,Elahe ZareiEbrahim Ghasemi-Nejad,2013,https://link.springer.com/article/10.1007/s12517-013-0993-3,Article
Geochemical characterization of adsorbed light gaseous alkanes in near surface soils of the eastern Ganga basin for hydrocarbon prospecting,Geochemistry International,,,,10.1134/S001670291401008X,Ch. SrinivasT. MadhaviM. LakshmiDevleena ManiM. S. KalpanaD. J. PatilA. M. DayalS. V. Raju,2013,https://link.springer.com/article/10.1134/S001670291401008X,Article
"Characteristics and origin of abnormally high porosity zones in buried Paleogene clastic reservoirs in the Shengtuo area, Dongying Sag, East China",Petroleum Science,,,,10.1007/s12182-014-0349-y,Yingchang CaoGuanghui YuanXiaoyan LiYanzhong WangKelai XiXiaoming WangZhenzhen JiaTian Yang,2014,https://link.springer.com/article/10.1007/s12182-014-0349-y,Article
Interpretation of Thermal Measurements,Applied Geothermics,,,,10.1007/978-3-642-34023-9_7,Lev EppelbaumIzzy KutasovArkady Pilchin,2014,https://link.springer.com/chapter/10.1007/978-3-642-34023-9_7,Chapter
"Identification of the Kukersite-type source rocks in the Ordovician Stratigraphy from the Tarim Basin, NW China",Chinese Science Bulletin,,,,10.1007/s11434-013-5963-3,YongGe SunShengYi MaoFeiYu WangPingAn PengPingXia Chai,2013,https://link.springer.com/article/10.1007/s11434-013-5963-3,Article
"Characteristics and evaluation of the shale oil reservoir in upper E<i>s</i>
              <sup>3</sup> inter salt in Liutun sag",Journal of Earth Science,,,,10.1007/s12583-013-0389-z,Yang LuoYanchao ZhaoXinhua Lü,2013,https://link.springer.com/article/10.1007/s12583-013-0389-z,Article
"Oil seeps affinity and basin modeling used for hydrocarbon discoveries in the Kifle, Merjan, and Ekheither fields, West Iraq",Arabian Journal of Geosciences,,,,10.1007/s12517-013-1167-z,Thamer K. Al-AmeriAmer Jassim Al-Khafaji,2013,https://link.springer.com/article/10.1007/s12517-013-1167-z,Article
Palynofacies and TOC analysis of marine and non-marine sediments across the Middle–Upper Jurassic boundary in the central-northern Lusitanian Basin (Portugal),Facies,,,,10.1007/s10347-013-0369-x,Ricardo L. SilvaJoão G. Mendonça FilhoAna C. AzerêdoLuís V. Duarte,2013,https://link.springer.com/article/10.1007/s10347-013-0369-x,Article
"Evaluation of Upper Triassic T<sub>3</sub>x<sup>5</sup> Source Rocks (Western Sichuan Depression, Sichuan Basin) and their Hydrocarbon Generation and Expulsion Characteristics: Implication for Tight-Sand Gas and Shale Gas Accumulation Potential Assessment",Natural Resources Research,,,,10.1007/s11053-013-9202-z,Yingchun GuoXiongqi PangDongxia ChenKeming YangZhenxue JiangXiaopeng ZhangFujie Jiang,2013,https://link.springer.com/article/10.1007/s11053-013-9202-z,Article
"Hydrochemistry and hydrogen sulfide generating processes in the Malm aquifer, Bavarian Molasse Basin, Germany",Hydrogeology Journal,,,,10.1007/s10040-013-1064-2,Christina MayrhoferReinhard NiessnerThomas Baumann,2013,https://link.springer.com/article/10.1007/s10040-013-1064-2,Article
Source potential of the upper Jurassic rocks of the Barents Sea petroleum basin,Moscow University Geology Bulletin,,,,10.3103/S0145875213010055,N. M. KiryukhinaT. A. Kiryukhina,2013,https://link.springer.com/article/10.3103/S0145875213010055,Article
Kinetic analysis of cellulose pyrolysis: a short review,Chemical Papers,,,,10.2478/s11696-013-0529-z,Cristina Şerbănescu,2014,https://link.springer.com/article/10.2478/s11696-013-0529-z,Article
Challenges in deep basin sequence stratigraphy: a case study from the Early–Middle Cretaceous of SW Zagros,Facies,,,,10.1007/s10347-013-0377-x,Amin NavidtalabHossain Rahimpour-BonabAmir Nazari-BadiiMehdi Sarfi,2013,https://link.springer.com/article/10.1007/s10347-013-0377-x,Article
Researcher Profiles,Who is Who in Thermal Analysis and Calorimetry,,,,10.1007/978-3-319-09486-1_1,Imre Miklós SzilágyiGyörgy Liptay,2014,https://link.springer.com/chapter/10.1007/978-3-319-09486-1_1,Chapter
"Petroliferous basins at continental margins of paleozoic paleoseas: Communication 2. Petroliferous basins at continental margins in the Rheic, Uralian, and Central Asian paleoseas",Lithology and Mineral Resources,,,,10.1134/S0024490213050052,A. I. Konyukhov,2013,https://link.springer.com/article/10.1134/S0024490213050052,Article
"Geological characteristics and accumulation mechanisms of the “continuous” tight gas reservoirs of the Xu2 Member in the middle-south transition region, Sichuan Basin, China",Petroleum Science,,,,10.1007/s12182-013-0264-7,Caineng ZouYanjie GongShizhen TaoShaobo Liu,2013,https://link.springer.com/article/10.1007/s12182-013-0264-7,Article
Fractionation of humic acids upon adsorption on montmorillonite and palygorskite,Eurasian Soil Science,,,,10.1134/S106422931306001X,T. V. AlekseevaB. N. Zolotareva,2013,https://link.springer.com/article/10.1134/S106422931306001X,Article
"Oil Shale Processing, Chemistry and Technology",Fossil Energy,,,,10.1007/978-1-4614-5722-0_5,Vahur OjaEric M. Suuberg,2013,https://link.springer.com/chapter/10.1007/978-1-4614-5722-0_5,Chapter
"First microbialites associated to organic-rich facies of the Oceanic Anoxic Event 2 (Northern Tunisia, Cenomanian–Turonian transition)",Arabian Journal of Geosciences,,,,10.1007/s12517-013-0988-0,Mohsen LayebMoez Ben FadhelYosra Layeb-TounsiMohamed Ben Youssef,2013,https://link.springer.com/article/10.1007/s12517-013-0988-0,Article
