Item Title,Publication Title,Book Series Title,Journal Volume,Journal Issue,Item DOI,Authors,Publication Year,URL,Content Type
Alkylsilyl protected amino acid based versatile organogelator for potential oil spillage recovery and waste water treatment,Journal of Porous Materials,,,,10.1007/s10934-024-01739-w,Subhra Kanti MandalPiya SethTanmoy Kar,2025,https://link.springer.com/article/10.1007/s10934-024-01739-w,Article
"Characteristics of Connected Pores and Evaluation of Shale Oil Mobility in the Qianjiang Formation, Qianjiang Sag, Jianghan Basin, China",Journal of Earth Science,,,,10.1007/s12583-022-1699-9,Zhongliang SunZhiming LiChencheng HeFeng ZhuBaojian ShenLongfei Lu,2025,https://link.springer.com/article/10.1007/s12583-022-1699-9,Article
Challenges and Opportunities for Oil in the Context of Deep Decarbonization,Energy Efficiency in Oil Production,,,,10.1007/978-3-031-54274-9_6,Marcus Vinicius da Silva NevesAntonio Felipe Flutt,2024,https://link.springer.com/chapter/10.1007/978-3-031-54274-9_6,Chapter
"Palm oil nanoemulsion enhances tocotrienol stability, antioxidant, and selective anti-melanoma activity",Naunyn-Schmiedeberg's Archives of Pharmacology,,,,10.1007/s00210-025-04296-4,Ahmad Fariduddin AththarFarhana RaushaniFransiska Christydira SekaringtyasSjaikhurrizal El MuttaqienDamai Ria SetyawatiRiyona Desvy PratiwiMuhaimin Rifa’iSiti Irma RahmawatiMasteria Yunovilsa PutraPeni AhmadiDwi Wahyu IndrianiJanet Tan Sui LingEndrika WidyastutiAsep BayuA’liyatur Rosyidah,2025,https://link.springer.com/article/10.1007/s00210-025-04296-4,Article
Fish oil and probiotic food supplements: consumptions and attitudes of pregnant women in four European countries,European Journal of Nutrition,,,,10.1007/s00394-025-03654-5,Kristiina JaakkolaElla KoivuniemiKathryn HartNatalia MazanowskaRomana RoccaldoLaura CensiBernadette EganLilja MattilaPasquale BuonocoreEliisa LöyttyniemiMonique RaatsStefania RuggeriMiroslaw WielgosKirsi Laitinen,2025,https://link.springer.com/article/10.1007/s00394-025-03654-5,Article
Simulation and Experiment of Windage Power Loss of A Shrouded Spiral Bevel Gears under Oil Injection Lubrication,Chinese Journal of Mechanical Engineering,,,,10.1186/s10033-025-01212-y,Bo LiKai RongXuyang ZhangSanmin WangU-Xuan TanXuanyuan SuLaifa Tao,2025,https://link.springer.com/article/10.1186/s10033-025-01212-y,Article
"Biodiesel production from non-edible mixed oils: a sustainable approach using jatropha, karanja and waste cooking oil",Bulletin of Materials Science,,,,10.1007/s12034-025-03414-5,Sadia HusainiAkshara KadireRaj Kumar VermaMadhuri Pydimalla,2025,https://link.springer.com/article/10.1007/s12034-025-03414-5,Article
The asymmetric effect of US local oil and gas reliance on income inequality in the fracking era,The Journal of Economic Inequality,,,,10.1007/s10888-025-09667-8,Friederike Seifert,2025,https://link.springer.com/article/10.1007/s10888-025-09667-8,Article
Gaussian random fuzzy and nature-inspired neural networks: a novel approach to Brent oil price prediction,Neural Computing and Applications,,,,10.1007/s00521-025-11306-2,Sagiru MatiGoran Yousif IsmaelAbduallahi Garba UsmanAhmed SamourNazifi AliyuRaad Abdelhalim Ibrahim AlsakarnehSani I. Abba,2025,https://link.springer.com/article/10.1007/s00521-025-11306-2,Article
Synthesis and Performance Evaluation of a Novel Humic Acid-Based Viscosity Reducer for Heavy Oil,Proceedings of the International Field Exploration and Development Conference 2024,,,,10.1007/978-981-96-5158-0_30,Ke AoPing-ping ZhongQin YuanYi-heng WangShen-da Li,2025,https://link.springer.com/chapter/10.1007/978-981-96-5158-0_30,Conference paper
Advancing Heavy Metal Removal from Industrial Wastewater Using Oil Palm Waste–Based Adsorbent: toward Efficient Adsorption and Commercialization,Current Pollution Reports,,,,10.1007/s40726-025-00381-7,Mohd Amir Asyraf Mohd HamzahNorhaniza YusofMuhammad Abbas Ahmad ZainiZainul Akmar ZakariaJuhana JaafarNurasyikin Misdan,2025,https://link.springer.com/article/10.1007/s40726-025-00381-7,Article
Fabrication of straw-based graphene aerogels for oil/water separation: the effects of crude fiber fractions in straw,Environmental Science and Pollution Research,,,,10.1007/s11356-024-35745-x,Hongbing DanYue GaoXianxiao WeiQinyan YueBaoyu Gao,2024,https://link.springer.com/article/10.1007/s11356-024-35745-x,Article
Liposome-fluidic method for aroma masking of cinnamon essential oil in beverage,Journal of Polymers and the Environment,,,,10.1007/s10924-024-03444-w,Atefeh FarahmandSeyedeh Fatemeh  MousaviBahareh  Emadzadeh Behrouz Ghorani,2024,https://link.springer.com/article/10.1007/s10924-024-03444-w,Article
A Comprehensive Review of Colloidal gas aphrons applications in the Oil Industry,Journal of Petroleum Exploration and Production Technology,,,,10.1007/s13202-025-01944-6,Hossein MehrjooYousef KazemzadehIsmail IsmailVassilis Gaganis,2025,https://link.springer.com/article/10.1007/s13202-025-01944-6,Article
Can oil prices affect economic uncertainty and financial stress? Quantile-based evidence from France and Germany,Economic Change and Restructuring,,,,10.1007/s10644-024-09812-9,Muhammad LuqmanYafei Li,2024,https://link.springer.com/article/10.1007/s10644-024-09812-9,Article
Dysregulation of AR and ERα caused ovarian alterations in gerbils prenatally exposed to 17α-ethinylestradiol and pequi oil,Histochemistry and Cell Biology,,,,10.1007/s00418-025-02389-y,Amanda M. de CamposJordana S. DiasGabriel F. LopesThaisla M. PiresDaniele C. da SilvaThalles F. Rocha RuizTracy M. M. MartinsAna P. S. Perez,2025,https://link.springer.com/article/10.1007/s00418-025-02389-y,Article
Evaluation for the combination of oil palm biomass as co-firing fuel: investigation into ash-related problems,Biomass Conversion and Biorefinery,,,,10.1007/s13399-024-05893-8,Fairuz Milkiy KuswaHanafi Prida PutraPrabowoHarus Laksana GunturHafizh GhazidinArif DarmawanCuk Supriyadi Ali NandarMuhammad AzizLu DingHariana Hariana,2024,https://link.springer.com/article/10.1007/s13399-024-05893-8,Article
Oil and Gas,Applications of Analytical Chemistry in Industry,,,,10.1007/978-3-031-38952-8_8,Silvio Vaz Jr,2023,https://link.springer.com/chapter/10.1007/978-3-031-38952-8_8,Chapter
"Sustainable biodiesel from used cooking oil: a comparative life cycle, energy, and uncertainty analysis","Environment, Development and Sustainability",,,,10.1007/s10668-024-05692-1,Kulvendra PatelS. K. Singh,2024,https://link.springer.com/article/10.1007/s10668-024-05692-1,Article
"Using plant-based hydrogel-oleogels to replace palm oil: impact on texture, sensory, and fatty acid composition of chocolate spreads",Journal of Food Measurement and Characterization,,,,10.1007/s11694-024-02839-6,Şirin ObaTuğçe Yıldırım,2024,https://link.springer.com/article/10.1007/s11694-024-02839-6,Article
Non-isothermal and isothermal oxidation behavior and kinetics of shale oil during air injection,Journal of Thermal Analysis and Calorimetry,,,,10.1007/s10973-024-13397-w,Shuai ZhaoXing ZhaoChengdong YuanMikhail A. VarfolomeevHehua WangLingfeng YangChunyun Xu,2024,https://link.springer.com/article/10.1007/s10973-024-13397-w,Article
"Long-term Supplementation of Deep-fried Oil Consumption Impairs Oxidative Stress, Colon Histology and Increases Neurodegeneration",Cell Biochemistry and Biophysics,,,,10.1007/s12013-024-01301-0,Jeyakumar BalakrishnanDhavamani SugasiniKathiresan Shanmugam,2024,https://link.springer.com/article/10.1007/s12013-024-01301-0,Article
Multifunctional PANI/MnO<sub>2</sub>-Decorated Polystyrene Composite Nanofibers for Oil Adsorption and Organic Dye Removal,Water Conservation Science and Engineering,,,,10.1007/s41101-025-00367-y,Hemalatha ParangusanAzza SaadJolly Bhadra,2025,https://link.springer.com/article/10.1007/s41101-025-00367-y,Article
"Application of Nanoclays in Construction, Oil and Gas Industries",Nanoclays,,,,10.1007/978-3-031-85304-3_8,Suprakas Sinha RayJonathan Tersur OrasughLesego Tabea Temane,2025,https://link.springer.com/chapter/10.1007/978-3-031-85304-3_8,Chapter
Vegetable Oil Based Polyurethane Composites,Vegetable Oil-Based Composites,,,,10.1007/978-981-99-9959-0_5,Saima Khan AfridiKhalid UmarTabassum ParveenM. Hazwan HussinMohd Jameel,2024,https://link.springer.com/chapter/10.1007/978-981-99-9959-0_5,Chapter
"Ameliorative potential of dietary supplements, ZnO-K, citrus essential oil, and pumpkin seed oil, on sperm quality in Nile tilapia: Insights from CASA, DNA integrity, antioxidant enzymes, and gene expressions",Fish Physiology and Biochemistry,,,,10.1007/s10695-025-01529-4,Marwa M. AliKamal Fathy ElborayEngy T. MegahedHany T. Abu-TalebAlshimaa E. ElsayedEman Y. MohammadyMona S. AmerSoliman A. MorsiEman M. AbbasMohamed S. HassaanHosam Elsaied,2025,https://link.springer.com/article/10.1007/s10695-025-01529-4,Article
Comparison between methacrylate copolymers and their magnetite nanocomposite as pour point depressant for lubricating base oil,Discover Applied Sciences,,,,10.1007/s42452-024-05686-8,Alshaimaa H. El-BahnasawiSalwa A. H. AlbohyOlfat E. El-AzabawyAbeer A. El-SegaeyNagda G. El-KolyHussin I. Al-Shafey,2024,https://link.springer.com/article/10.1007/s42452-024-05686-8,Article
Research on geological characteristics and development potential of Es<sub>3</sub><sup>1</sup> oil and gas reservoir in Nanpu M Block,Heat and Mass Transfer,,,,10.1007/s00231-024-03523-7,Jie ZhangYingying LiuGuangshuai LiRuiyi SunShuoyi Ge,2024,https://link.springer.com/article/10.1007/s00231-024-03523-7,Article
Noncatalytic Technologies for Processing Oil Residues and Heavy Oils,Chemistry and Technology of Fuels and Oils,,,,10.1007/s10553-023-01520-w,E. G. TelyashevI. R. KhairudinovR. I. KhairutdinovA. A. Tikhonov,2023,https://link.springer.com/article/10.1007/s10553-023-01520-w,Article
Biocompatible Nanofibers Infused with Almond Oil: Molecular Enhancement of HDF-1 Cell Proliferation Using Polyurethane-Polycaprolactone Nanofibers,BioNanoScience,,,,10.1007/s12668-024-01669-6,Sonia Fathi-karkanAbbas RahdarZakieh KeshavarziSadanand Pandey,2024,https://link.springer.com/article/10.1007/s12668-024-01669-6,Article
Toxicity evaluation of water-accommodated fraction of heavy and light oils on the rainbow trout fish cell line RTL-W1,Environmental Science and Pollution Research,,,,10.1007/s11356-024-34458-5,Pauline PannetierChristelle ClérandeauStéphane Le FlochJérôme CachotBénédicte Morin,2024,https://link.springer.com/article/10.1007/s11356-024-34458-5,Article
Utilizing combusted PET plastic waste and biogenic oils as efficient pour point depressants for crude oil,Scientific Reports,,,,10.1038/s41598-024-65563-7,Mohamed Mohamady GhobashyA. M. RashadS. K. AttiaA. E. ElsayedD. I. Osman,2024,https://link.springer.com/article/10.1038/s41598-024-65563-7,Article
Deep Learning for&#xa0;Prediction of&#xa0;Leaks in&#xa0;Oil and&#xa0;Gas Pipelines,Proceedings of the 3rd International Conference on Computer Science's Complex Systems and Their Applications,,,,10.1007/978-3-031-90758-6_8,Basma HamrouniKhadra BouananeIzdihar HadjoujZiad LegouguiMohammed el Moncef moadBelkacem AoufiAbdelhabib BourouisAhmed Korichi,2025,https://link.springer.com/chapter/10.1007/978-3-031-90758-6_8,Conference paper
Optimized transesterification of unrefined palm and waste cooking oil blend to biodiesel using cement kiln dust catalyst,Scientific Reports,,,,10.1038/s41598-025-11752-x,Mahmoud S. HefneyMai O. AbdelmigeedTamer S. AhmedIbrahim M. Ismail,2025,https://link.springer.com/article/10.1038/s41598-025-11752-x,Article
"Investigation on the adsorption and surface activity of imidazolium chloride-based ionic liquids (n = 12, 18); resin and asphaltene synthetic oil and high salinity",Journal of Petroleum Exploration and Production Technology,,,,10.1007/s13202-025-02037-0,Reza MalekiZadehSeyednooroldin HosseiniMostafa Narimani,2025,https://link.springer.com/article/10.1007/s13202-025-02037-0,Article
"Sequestration of Crude Oil from Contaminated Water using High Capacity Sorbents Obtained from the Thermal Treatment and Chemical Modification of <i>Vigna subterranean</i> Husks: Modeling, Thermodynamics, Regeneration and Reusability","Water, Air, & Soil Pollution",,,,10.1007/s11270-025-08446-5,Ikeokwu Chris OgbuAbib LawalAbduljeleel Osunkunle,2025,https://link.springer.com/article/10.1007/s11270-025-08446-5,Article
Investigation of the temperature influence on the catalytic hydrogenation upgrading of bio-oil using industrial nickel based catalyst RZ409,Scientific Reports,,,,10.1038/s41598-025-14087-9,Xingmin XuShuwan ChenYinju WangPing LvWan GuoYouju Shu,2025,https://link.springer.com/article/10.1038/s41598-025-14087-9,Article
Facile Preparation of Robust Superhydrophobic Stainless Steel Mesh Coated with Urushiol-based Polybenzoxazine and SiO<sub>2</sub> for Efficient Oil/water Separation,Journal of Wuhan University of Technology-Mater. Sci. Ed.,,,,10.1007/s11595-025-3120-x,Yongfei ZhuYuxuan LiJianrui XiaoJiayi LiShujuan Yu,2025,https://link.springer.com/article/10.1007/s11595-025-3120-x,Article
Research Status and Prospect of Perforation Technology in Oil and Gas Wells,Proceedings of the International Field Exploration and Development Conference 2024,,,,10.1007/978-981-96-4922-8_14,Jing-wei LiangNan QiangYong WangYi-hua DouYa-fei Zhang,2025,https://link.springer.com/chapter/10.1007/978-981-96-4922-8_14,Conference paper
Kinetic modeling and CFD simulation of in-situ heavy oil upgrading using batch reactors and porous media,Scientific Reports,,,,10.1038/s41598-025-98494-y,Arman AryanzadehArezou JafariMahdi Abdi-Khanghah,2025,https://link.springer.com/article/10.1038/s41598-025-98494-y,Article
"Wear Mechanisms of Bearing Steel Under Corrosive NaCl Solution: Comparative with Dry Friction, Water and Lube Oil Environment",Journal of Failure Analysis and Prevention,,,,10.1007/s11668-025-02226-3,Geng HouLiangchi ZhangZhen Li,2025,https://link.springer.com/article/10.1007/s11668-025-02226-3,Article
Thermal Protective Performance of Oil and Gas Field Workers’ Clothing: A Review,Fire Technology,,,,10.1007/s10694-025-01714-0,Shariful Islam TusharSumit MandalIshmam Zahin ChowdhuryAdriana PetrovaLynn M. BooradyRobert J. Agnew,2025,https://link.springer.com/article/10.1007/s10694-025-01714-0,Article
Effect of Hydrocracking of Oil Distillation Heavey Residues on Production Efficiency of TAIF-NK JSC,Chemistry and Technology of Fuels and Oils,,,,10.1007/s10553-023-01494-9,R. N. AkhunovM. R. IdrisovV. V. PresnyakovR. A. ShigabutdinovM. A. NovikovA. A. KhramovA. A. KonovninA. S. UrazaikinA. K. Shigabutdinov,2023,https://link.springer.com/article/10.1007/s10553-023-01494-9,Article
Valorization of chili seed by-product: extraction of essential oil and its potential application in nanoemulsion development,Biomass Conversion and Biorefinery,,,,10.1007/s13399-025-06758-4,Jahangir A. RatherNajmeenah AkhterSamiya RasoolDarakshan MajidHilal A. MakrooB. N. Dar,2025,https://link.springer.com/article/10.1007/s13399-025-06758-4,Article
Exploring pore-scale production characteristics of oil shale after CO<sub>2</sub> huff ‘n’ puff in fractured shale with varied permeability,International Journal of Coal Science & Technology,,,,10.1007/s40789-024-00664-2,Tianhan XuJian WangYuhao LuDanling WangLi YuYe Tian,2024,https://link.springer.com/article/10.1007/s40789-024-00664-2,Article
"Genesis and Accumulation of Paleo-Oil Reservoir in Dabei Area, Kuqa Depression, Northwest China: Implications for Tight-Gas Accumulation",Journal of Earth Science,,,,10.1007/s12583-021-1562-4,Fujie JiangXiao ChenPengwei WangXinghe ShaoHaijun Yang,2024,https://link.springer.com/article/10.1007/s12583-021-1562-4,Article
Qualitative Identification and Adulteration Quantification of Extra Virgin Olive Oil Based on Raman Spectroscopy Combined with Multi-task Deep Learning Model,Food Analytical Methods,,,,10.1007/s12161-024-02728-0,Shuxin LiangGuoqing ChenChaoqun MaJiao GuChun ZhuLei LiHui GaoZichen YangJun CaoZehao Chen,2024,https://link.springer.com/article/10.1007/s12161-024-02728-0,Article
Hepatoprotective Effect of Moringa Oil on Rats under Fungicide Toxicity,Doklady Biochemistry and Biophysics,,,,10.1134/S1607672923600367,Khalid S. AlotaibiDaklallah A. Almalki,2023,https://link.springer.com/article/10.1134/S1607672923600367,Article
Superhydrophobic fabric coated with double-decker silsesquioxane-based hybrid polymer for efficient oil/water separation and enhanced antifouling performance,Cellulose,,,,10.1007/s10570-025-06593-w,Shiyao FanRungthip KunthomYanfei MengSergei V. KostjukHongzhi Liu,2025,https://link.springer.com/article/10.1007/s10570-025-06593-w,Article
Study on the Stability of the Displacement Sensing Actuator Under Oil Conditions,Proceedings of the 7th China Aeronautical Science and Technology Conference,,,,10.1007/978-981-97-9768-4_30,Xingliang LiYa FanHongxin ZhaoBin ZhangYong LiuChangyu Xu,2025,https://link.springer.com/chapter/10.1007/978-981-97-9768-4_30,Conference paper
Rhenium and Related Valuable Metals in the Oil Shales of the Volga Basin,Solid Fuel Chemistry,,,,10.3103/S0361521924010105,V. I. VyalovT. A. DyuA. V. NastavkinE. P. Shishov,2024,https://link.springer.com/article/10.3103/S0361521924010105,Article
QTL mapping and epistatic interactions for improved seed oil quality in safflower,Euphytica,,,,10.1007/s10681-024-03408-0,Seyedeh Esmat HashemiNafiseh Mahdi NezhadGhasem Mohammadi-NejadFatemeh EbrahimiBarat Ali Fakheri,2024,https://link.springer.com/article/10.1007/s10681-024-03408-0,Article
Assessment of L-cysteine Reductase Activity as an Indicator of Soil Health in Different Climatic Zones After Pollution by Oil,Bulletin of Environmental Contamination and Toxicology,,,,10.1007/s00128-025-04010-3,Minnikova TatianaKolesnikov Sergey,2025,https://link.springer.com/article/10.1007/s00128-025-04010-3,Article
Lacustrine Source Rock Oil Generation Simulation Experiment Method,Theory and Simulation Experimental Technology of Oil Generation From Nonmarine Source Rocks in China,,,,10.1007/978-981-96-3145-2_12,Defan GuanZhongliang MaYongqiang Zhao,2025,https://link.springer.com/chapter/10.1007/978-981-96-3145-2_12,Chapter
"Superhydrophobic/superoleophilic porous adsorbents for oil–water separation: a comprehensive review of materials, fabrication techniques, and performance assessments",Environmental Science and Pollution Research,,,,10.1007/s11356-025-36478-1,Hossein Kazemi MereshtSeyed Siamak Ashraf TaleshReza Mahdavi,2025,https://link.springer.com/article/10.1007/s11356-025-36478-1,Article
Advanced Techniques in Upgrading Crude Bio-oil to Biofuel,Intelligent Transportation System and Advanced Technology,,,,10.1007/978-981-97-0515-3_14,Abiodun Oluwatosin AdeoyeRukayat Oluwatobiloba QuadriOlayide Samuel LawalDosu MalomoEmmanuel Oghenero EmojevuOmotayo Oluyemisi OmonijeOlalere Kayode OdeniyiMoshood Olatunji FadahunsiMuhammad Jibrin YelwaSamson Abiodun AasaAugustine Eyikwuojo OnakpaBusuyi Patrick OmoniyiIbrahim N. MarkJoseph UsmanAminu Muhammad IsmailaAbdullahi Usmanu Saidu,2024,https://link.springer.com/chapter/10.1007/978-981-97-0515-3_14,Chapter
Characterization of Crude Oil Degrading Marine Bacterium <i>Bacillus licheniformis</i>,Indian Journal of Microbiology,,,,10.1007/s12088-024-01222-9,M. SrimathiM. SuganthiS. SugithaK. Ashok KumarC. RamprasathG. Abirami,2024,https://link.springer.com/article/10.1007/s12088-024-01222-9,Article
Hyperspectral remote sensing identification of marine oil emulsions based on the fusion of spatial and spectral features,Acta Oceanologica Sinica,,,,10.1007/s13131-023-2249-8,Xinyue HuangYi MaZongchen JiangJunfang Yang,2024,https://link.springer.com/article/10.1007/s13131-023-2249-8,Article
Influence of surfaces of different chemical composition and topology on the interaction between a fuel-spray and an oil-wetted wall,Automotive and Engine Technology,,,,10.1007/s41104-025-00152-y,Celine KrnacJan ReimerMalki MalihaHeiko KubachThomas Koch,2025,https://link.springer.com/article/10.1007/s41104-025-00152-y,Article
Investigation of pyrolysis behavior shale gas oil-based drilling cuttings kinetics and product characteristics,Scientific Reports,,,,10.1038/s41598-025-04640-x,Pu LiuWei LiRuifeng TanLiu ZhongbinZhang Bin,2025,https://link.springer.com/article/10.1038/s41598-025-04640-x,Article
Oil Fire Detection Technology Based on Fractal Geometry,The Proceedings of the 18th Annual Conference of China Electrotechnical Society,,,,10.1007/978-981-97-1064-5_7,Fuze ChenYonggang ZuoYuting HuYuliang ZhangMeichun WuJiansheng HuangZekun LiGuangchuan Song,2024,https://link.springer.com/chapter/10.1007/978-981-97-1064-5_7,Conference paper
Photo-induced grease/oil switched lubricant for friction regulation,Friction,,,,10.1007/s40544-023-0775-1,Zheng ZhangShuangxi TangLiran MaYu Tian,2023,https://link.springer.com/article/10.1007/s40544-023-0775-1,Article
Hydrotreating of Lignocellulosic Bio-Oil (A Review),Petroleum Chemistry,,,,10.1134/S0965544123090013,G. O. ZasypalovV. A. KlimovskyE. S. AbramovE. E. BrindukovaV. D. StytsenkoA. P. Glotov,2023,https://link.springer.com/article/10.1134/S0965544123090013,Article
The development and utilization of shale oil and gas resources in China and economic analysis of energy security under the background of global energy crisis,Journal of Petroleum Exploration and Production Technology,,,,10.1007/s13202-024-01818-3,Enqi FuWeida He,2024,https://link.springer.com/article/10.1007/s13202-024-01818-3,Article
Flowability enhancement of waxy crude oil using gamma-irradiated EVA-copolymers grafted with novel functionalized monomers,Journal of Polymer Research,,,,10.1007/s10965-025-04331-1,Mohamed Mohamady GhobashyAhmed SiddiqAbu-Bakr A. A. M. El-AdasyMohamed F. HamamBasem Kh. El‑DamhougyAhmed A. ZaherAshraf M. Ashmawy,2025,https://link.springer.com/article/10.1007/s10965-025-04331-1,Article
Applicability Analysis of Solar Thermal Technology in Heavy Oil Low-Carbon Thermal Recovery Development,Proceedings of the International Field Exploration and Development Conference 2024,,,,10.1007/978-981-96-2363-1_77,Yi-chang YuBo-heng ShenZhi-wei LIJun-tao ZhangShuai-hui ZhouJing-qi OuyangXiao-yue ChenXi Jing,2025,https://link.springer.com/chapter/10.1007/978-981-96-2363-1_77,Conference paper
Biocompatible antibacterial and antibiofilm activities of silver nanoparticles synthesized using palm oil mill effluent,Biomass Conversion and Biorefinery,,,,10.1007/s13399-024-06405-4,Abdulrahman Sani AlieroNurliyana Ahmad ZawawiNik Ahmad Nizam Nik MalekMohd Helmi SaniMuhammad Hariz AsrafSoon Wei ToMuhammad Hizbullahi UsmanAbdurrashid Haruna,2024,https://link.springer.com/article/10.1007/s13399-024-06405-4,Article
Frankincense oil as a novel modulator of epileptic-associated neuroinflammation induced by penicillin in rats,Bulletin of the National Research Centre,,,,10.1186/s42269-025-01335-1,Mohamed E. ElhadidyMohamed S. TahaAsmaa A. SalemGihan M. Hammoud,2025,https://link.springer.com/article/10.1186/s42269-025-01335-1,Article
"Dynamic Interlinkages Between Precious Metal, Exchange Rate and Crude Oil: Evidence from an Extended TVP‑VAR Analysis",Computational Economics,,,,10.1007/s10614-024-10750-x,Hasan Murat ErtugrulOnur PolatDurmuş Çağrı YıldırımAbdullah Açık,2024,https://link.springer.com/article/10.1007/s10614-024-10750-x,Article
Investigating the Phenological Stages of Essential Oil Yield and Essential Oil Compounds and Phytochemical Properties of <i>Artemisia absinthium</i> L. (Wormwood),Russian Journal of Plant Physiology,,,,10.1134/S1021443723601891,M. AeinehS. H. NajafianM. Hosseinifarahi,2023,https://link.springer.com/article/10.1134/S1021443723601891,Article
"NDE in Oil, Gas, and Petrochemical Facilities",Handbook of Nondestructive Evaluation 4.0,,,,10.1007/978-3-030-48200-8_60-2,Sascha SchiekeMark GeisenhoffKe Wang,2024,https://link.springer.com/rwe/10.1007/978-3-030-48200-8_60-2,Living reference work entry
Macromonomer derived from tung oil and bismaleimide: synthesis via Diels-Alder reaction and production of renewable polyesters,Journal of Polymer Research,,,,10.1007/s10965-025-04586-8,Giovanni Arneiro Guimarães SantosLuan Moreira GriloJulio Antonio Conti SilvaRafael Lopes QuirinoTalita Martins Lacerda,2025,https://link.springer.com/article/10.1007/s10965-025-04586-8,Article
Assessment of Oil Spill Pollution over the North Eastern Arabian Sea Using EOS-04&#xa0;C-Band SAR Data,Journal of the Indian Society of Remote Sensing,,,,10.1007/s12524-024-01991-2,M. SwapnaS. RajeshR. K. NayakP. V. NagamaniRajashree V. BothaleG. Srinivasa RaoPrakash Chauhan,2024,https://link.springer.com/article/10.1007/s12524-024-01991-2,Article
Production Logging Tools Interpretation for a Vertical Oil Well,Petroleum Chemistry,,,,10.1134/S0965544124070053,Emad A. Al-KhdheeawiAli K. AlhuraishawyDoaa Saleh MahdiYujie YuanJumana M. MullaAmmar A. Mola,2024,https://link.springer.com/article/10.1134/S0965544124070053,Article
Preparation of Biofuel from Kitchen Waste Cooking Oil,Scientific and Technological Advances in Materials for Energy Storage and Conversions,,,,10.1007/978-981-97-2481-9_55,Amrutha NambiarJobelyn LicardoApurv YadavHardeep Kumar,2024,https://link.springer.com/chapter/10.1007/978-981-97-2481-9_55,Conference paper
Chemical and Microbially Enhanced Oil Recovery: A Review of Methods and Their Limitations,"Proceedings of 1st International Conference on Petroleum, Hydrogen and Decarbonization",,,,10.1007/978-981-96-3667-9_3,Anurag MishraPankaj TiwariLalit Mohan Pandey,2025,https://link.springer.com/chapter/10.1007/978-981-96-3667-9_3,Conference paper
Nickel and cobalt incorporated mesoporous HZSM-5 catalysts for biofuel production from bio-oil model compounds,Research on Chemical Intermediates,,,,10.1007/s11164-024-05357-8,Birce Pekmezci Karaman,2024,https://link.springer.com/article/10.1007/s11164-024-05357-8,Article
