Item Title,Publication Title,Book Series Title,Journal Volume,Journal Issue,Item DOI,Authors,Publication Year,URL,Content Type
An intelligent and robust coating with switchable wettability for on-demand oil–water separation,Journal of Materials Science,,,,10.1007/s10853-024-10496-9,Congcong LiLulu XuXueer PanXinru ChenXiaobing LiMian Wu,2024,https://link.springer.com/article/10.1007/s10853-024-10496-9,Article
Solar-heated melamine sponge decorated with Fe<sub>3</sub>O<sub>4</sub> for continuous recovery of viscous crude oil,Journal of Porous Materials,,,,10.1007/s10934-024-01569-w,Yiduo ChenYujuan ZhaoWeiting YangZhongmin Su,2024,https://link.springer.com/article/10.1007/s10934-024-01569-w,Article
Oil recovery from Algerian petroleum sludge using indigenous bacterium: an environmentally sustainable method for handling oily sludge,International Journal of Energy and Water Resources,,,,10.1007/s42108-025-00394-4,Nesrine LenchiAmina BenchoukKahina IghilahrizAbdenour AlilatSalima Kebbouche-GanaSouad Khemili-Talbi,2025,https://link.springer.com/article/10.1007/s42108-025-00394-4,Article
Tailored Electrospun PU/S-GO Membranes for Enhanced Mechanical and Hydrophobic Properties for Efficient Oil Removal,Fibers and Polymers,,,,10.1007/s12221-025-00974-5,Riya Mariyam JohnParvathy PavithranSoney C. GeorgeNikhi Maria Raju,2025,https://link.springer.com/article/10.1007/s12221-025-00974-5,Article
Easily prepared graphene-modified melamine sponge and its solar-aided adsorption performance on viscous oil,Carbon Letters,,,,10.1007/s42823-023-00632-x,Mingkan FanHuie LiuQilin GuoYingbo ZhangShuang ChenWanqing ZhangQi ShenXiangyan Dou,2023,https://link.springer.com/article/10.1007/s42823-023-00632-x,Article
An analysis of heavy silicone oil treatment for inferior proliferative vitreoretinopathy,BMC Ophthalmology,,,,10.1186/s12886-024-03834-7,Maximilian HammerAmanda IeKatharina EibenbergerGerd Uwe AuffarthKanmin Xue,2025,https://link.springer.com/article/10.1186/s12886-024-03834-7,Article
Development Status and Prospect of Global Oil Refining Industry,"Annual Report on China’s Petroleum, Gas and New Energy Industry (2024)",,,,10.1007/978-981-96-5261-7_7,Ruiming GaoYi YangWei Zhou,2025,https://link.springer.com/chapter/10.1007/978-981-96-5261-7_7,Chapter
Valorization of Apple Waste from Cold Storage Through Seed Oil Extractions in Western Algeria,Waste and Biomass Valorization,,,,10.1007/s12649-025-03101-w,Ikram BouferaOurida ChouitahFatima Zohra KiariYehia KhelefRamazan ErenlerIbrahim DemirtasMehmet Hakki Alma,2025,https://link.springer.com/article/10.1007/s12649-025-03101-w,Article
Molecular insights into the effect of hydrocarbon gas composition characteristics on tight oil migration,Scientific Reports,,,,10.1038/s41598-025-02095-8,Yingnan ZhangXiangji DouWenteng ZhouChang Lu,2025,https://link.springer.com/article/10.1038/s41598-025-02095-8,Article
Biochemical and histopathological effects of clove oil on the land snail <i>Helix aspersa</i>,The Journal of Basic and Applied Zoology,,,,10.1186/s41936-025-00432-x,Hoda H. Abdel-Azeem,2025,https://link.springer.com/article/10.1186/s41936-025-00432-x,Article
Underwater Visible Light Communication (UVLC),Handbook of Radio and Optical Networks Convergence,,,,10.1007/978-981-33-4999-5_62-1,Mohammed ElamassieCallum GeldardWasiu Popoola,2024,https://link.springer.com/rwe/10.1007/978-981-33-4999-5_62-1,Living reference work entry
Amazonian Microorganism Strains Improve Physiological Performance to Oil Palm Seedlings Growth Promote,Journal of Plant Growth Regulation,,,,10.1007/s00344-025-11628-4,Danielle Pereira MendonçaMaria Luiza Brito BritoJuliana Tavares DiasVerônica Daniely Pereira Paes da SilvaMauro Junior Borges PachecoThayná da Cruz FerreiraMaria Carolina Sarto Fernandes RodriguesDalton Dias da Silva JuniorGisele Barata SilvaGledson Luiz Salgado de Castro,2025,https://link.springer.com/article/10.1007/s00344-025-11628-4,Article
Skin Friction from Global Luminescent Oil-Film Visualizations,Inverse Problems in Global Flow Diagnostics,,,,10.1007/978-3-031-42474-8_3,Tianshu LiuZemin Cai,2024,https://link.springer.com/chapter/10.1007/978-3-031-42474-8_3,Chapter
A novel YOLOv11-Driven deep learning algorithm for UAV multispectral oil spill detection in Inland lakes,"Journal of King Saud University Computer and Information Sciences ",,,,10.1007/s44443-025-00117-z,Yu ZhangJian XingWeida ChenHaitao WangBingyu  ShiYang SongXiaoou HuangZihan  Jiang,2025,https://link.springer.com/article/10.1007/s44443-025-00117-z,Article
It’s a Gas: The Twilight of Oil Culture in American Photography,"After Oil : A Comparative Analysis of Oil Heritage, Urban Transformations, and Resilience Paradigms",,,,10.1007/978-3-031-92188-9_6,Alicja Relidzyńska,2025,https://link.springer.com/chapter/10.1007/978-3-031-92188-9_6,Chapter
"Improving oil recovery of mature reservoirs utilizing low salinity water flooding: a case study—Kareem reservoir, Morgan field, Gulf of Suez, Egypt",Journal of Petroleum Exploration and Production Technology,,,,10.1007/s13202-025-01945-5,Mostafa A. TeamaEhab A. El KadyMaher A. MesbahAdel M. Salem,2025,https://link.springer.com/article/10.1007/s13202-025-01945-5,Article
Enhancing cement properties for oil wells using MgO-PAM nanocomposites,Scientific Reports,,,,10.1038/s41598-025-06215-2,Zan LiZahraa Sabah GhnimPrakash KanjariyaAsha RajivHaider Radhi SaudAman ShankhySachin JaidkaKamal Kant JoshiAyat Hussein AdhabMorug Salih MahdiAseel Salah MansoorUsama Kadem RadiNasr Saadoun AbdAsgar BatuliMohammad Mahtab AlamWenrui Jiang,2025,https://link.springer.com/article/10.1038/s41598-025-06215-2,Article
Therapeutic Effects of Geranium Oil in MPTP-Induced Parkinsonian Mouse Model,Plant Foods for Human Nutrition,,,,10.1007/s11130-023-01112-3,Alona TelermanUzi RavidNativ DudaiAnat Elmann,2023,https://link.springer.com/article/10.1007/s11130-023-01112-3,Article
Improved hybrid feature extractor in lightweight convolutional neural network for postharvesting technology: automated oil palm fruit grading,Neural Computing and Applications,,,,10.1007/s00521-024-10300-4,Mohamad Haniff JunosAnis Salwa Mohd KhairuddinMohamad Sofian Abu TalipMuhammad Izhar KairiYosri Mohd Siran,2024,https://link.springer.com/article/10.1007/s00521-024-10300-4,Article
Preparation and application of hierarchical ZSM-5 based catalysts for upgradation of Saudi Arabia’s medium crude oil,Journal of Porous Materials,,,,10.1007/s10934-023-01506-3,Jie ZhongKang LiJie LeiJin LvJunjie LiuFazle SubhanPeng PengYouhe WangZifeng Yan,2023,https://link.springer.com/article/10.1007/s10934-023-01506-3,Article
CO<sub>2</sub>-Enhanced Tar-Rich Coal Pyrolysis to Produce High-Quality Oil and CO-Rich Gas,Journal of Thermal Science,,,,10.1007/s11630-025-2149-7,Duoer YangBang XuJihong SunXiaoyan BaiFei DaiMaohong Fan,2025,https://link.springer.com/article/10.1007/s11630-025-2149-7,Article
Hydrodeoxygenation of Fusel Oil Over Ce-Promoted Ni/Zeolite Catalyst for Bio-Fuel Production,Waste and Biomass Valorization,,,,10.1007/s12649-025-03276-2,Le Mai Hong ThamImam SahroniGhina Kifayah PutriNatthawan PrasongthumPrasert Reubroycharoen,2025,https://link.springer.com/article/10.1007/s12649-025-03276-2,Article
"Microbial enhanced oil recovery: process perspectives, challenges, and advanced technologies for its efficient applications and feasibility",Archives of Microbiology,,,,10.1007/s00203-025-04307-1,Ankita DasNandita DasPrisha PandeyPiyush Pandey,2025,https://link.springer.com/article/10.1007/s00203-025-04307-1,Article
Mapping pollution dynamics: utilizing GNOME to model oil spill trajectories in tanker terminals,Environmental Science and Pollution Research,,,,10.1007/s11356-024-33506-4,Mehrnaz FarzingoharMilad BagheriIraj GholamiZelina Zaiton IbrahimMohd Fadzil Akhir,2024,https://link.springer.com/article/10.1007/s11356-024-33506-4,Article
Nanofillers for Transformer Oil Nanofluids,Handbook of Nanofillers,,,,10.1007/978-981-99-3516-1_127-1,Mississippi Missouri BhuniaKalyan Kumar ChattopadhyayParamita Chattopadhyay,2024,https://link.springer.com/rwe/10.1007/978-981-99-3516-1_127-1,Living reference work entry
Improving the Efficiency of Oil Displacement by Filtration of Fractured Carbonate Reservoirs and Nitrogen Flooding,Chemistry and Technology of Fuels and Oils,,,,10.1007/s10553-025-01830-1,An JieShao XiaoyanYu QichangZhao LeLiu ZhengweiHuang HaiHuang FeifeiMa Chengxue,2025,https://link.springer.com/article/10.1007/s10553-025-01830-1,Article
Digital media interactive oil painting art exhibition method based on visual communication,"Signal, Image and Video Processing",,,,10.1007/s11760-024-03310-1,Yang Ping,2024,https://link.springer.com/article/10.1007/s11760-024-03310-1,Article
Innovative Approaches to Cleaning the Soil from Oil Products,"Systems, Decision and Control in Energy VII",,,,10.1007/978-3-031-90466-0_27,Vasyl LopushniakHalyna HrytsuliakDiana LynnykVolodymyr ShymanskyiYuriy SolodjukAndrii KostyshynZorjana Kostyshyn,2025,https://link.springer.com/chapter/10.1007/978-3-031-90466-0_27,Chapter
A breakthrough in infection control: niaouli oil–chitosan hydrogels for enhanced wound healing,Polymer Bulletin,,,,10.1007/s00289-025-05823-2,Metin YildirimKemal DoganAkın YiğinMehmet CimentepeAdem NecipMadina AmangeldinovaÖzden Dellal,2025,https://link.springer.com/article/10.1007/s00289-025-05823-2,Article
Biodegradation of low sulfur fuel oil HDME 50 in seawater at sub-arctic temperatures with and without dispersants,Polar Biology,,,,10.1007/s00300-025-03370-0,Nga Phuong DangAnna ReunamoChris PetrichJohanna JärvistöKirsten S. JørgensenLisa Torske,2025,https://link.springer.com/article/10.1007/s00300-025-03370-0,Article
Surfactant-assisted detachment of oil droplet from the solid quartz substrate in water,Colloid and Polymer Science,,,,10.1007/s00396-024-05342-y,Chong-Jiang LvFu-Xin MaHui LiXiu YueAkram YasinBin HaoPeng-Cheng Ma,2024,https://link.springer.com/article/10.1007/s00396-024-05342-y,Article
A multi-omics deconstruction of red ring disease in oil palm,Journal of Plant Pathology,,,,10.1007/s42161-024-01787-w,Ítalo de Oliveira BragaThalliton Luiz Carvalho da SilvaTalita Pimenta do NascimentoAndré Pereira LeãoJosé Antônio de Aquino RibeiroLilian Margarete Paes GuimarãesManoel Teixeira Souza Júnior,2024,https://link.springer.com/article/10.1007/s42161-024-01787-w,Article
"NPK nano-fertilizers enhance growth, oil quality, and yield regularity in Picual olive trees",Scientific Reports,,,,10.1038/s41598-025-17267-9,Ibrahim HmmamHassan Mahmoud KorkarIslam AhmedAsmaa Gamal Abd El-hamiedAyman Shaban,2025,https://link.springer.com/article/10.1038/s41598-025-17267-9,Article
Optical nonlinearity and all-optical switching in pumpkin seed oil based on the spatial cross-phase modulation (SXPM) technique,Scientific Reports,,,,10.1038/s41598-024-69170-4,Amir Namiq HassanMohammad Ali HaddadAbbas BehjatMoein Golestanifar,2024,https://link.springer.com/article/10.1038/s41598-024-69170-4,Article
Grape seed oil structural changes and phenolics dynamics as influenced by oleogelation and emulsification as processing conditions,Journal of Food Science and Technology,,,,10.1007/s13197-025-06421-w,Alexandra R. LazărAndreea PușcașAndruța E. MureșanAnda E. TanislavFloricuța RangaVlad Mureșan,2025,https://link.springer.com/article/10.1007/s13197-025-06421-w,Article
Colorimetric Biocomposite Sensor Using Polyvinyl Alcohol/Sodium Alginate Film for Visual Detection of Edible Oil Deterioration,Food Analytical Methods,,,,10.1007/s12161-025-02825-8,Ayat F. HashimSaid F. HamedHamdy A. ZahranAhmed M. Youssef,2025,https://link.springer.com/article/10.1007/s12161-025-02825-8,Article
In Situ Fluid Content Evaluation of Shale Oil Reservoirs: Insights from Laboratory and Wellsite Mobile Full-Diameter Core NMR,Natural Resources Research,,,,10.1007/s11053-025-10465-2,Junjie WangPengfei ZhangShuangfang LuYajie YinChenxi WuYangjian YiPanxue LiXinlin SongWenbiao LiGuohui ChenNengwu Zhou,2025,https://link.springer.com/article/10.1007/s11053-025-10465-2,Article
"Preparation, characterization and application of chitosan/thyme essential oil composite film",Scientific Reports,,,,10.1038/s41598-025-92267-3,Jianming SunXiao PanTiantian WangLei LiuZhao LiXiaofang Wang,2025,https://link.springer.com/article/10.1038/s41598-025-92267-3,Article
Physicochemical Properties and Bioactive Lipid Composition of <i>Marrubium Vulgare</i> Seed Oil,Waste and Biomass Valorization,,,,10.1007/s12649-025-03321-0,Belsem JedidiHassen Mohamed Sbihi,2025,https://link.springer.com/article/10.1007/s12649-025-03321-0,Article
Application of Multi-scale Digital Rock Technology in Shale Oil Reservoir Evaluation: A Case Study of Shale Oil Reservoir in Chang 73 Submember in Jiyuan Area,Proceedings of the International Field Exploration and Development Conference 2024,,,,10.1007/978-981-96-4918-1_19,Chao-qiang FangZhe-hao ZhangYa-kun MaoJian ZhuJian-bin ZhaoYang XiaBo Wei,2025,https://link.springer.com/chapter/10.1007/978-981-96-4918-1_19,Conference paper
Active ions’ impact in the enhanced oil recovery process: a microfluidic-based approach,Microsystem Technologies,,,,10.1007/s00542-024-05788-8,Yajun ZhangMenghao ChaiYumeng XieKunMing LiangYiqiang Fan,2024,https://link.springer.com/article/10.1007/s00542-024-05788-8,Article
Analyzing the Divergent Effects of Oil Price Changes on BRICS Stock Markets,Asia-Pacific Financial Markets,,,,10.1007/s10690-024-09497-0,Neha GuptaNamita SahayMiklesh Prasad Yadav,2024,https://link.springer.com/article/10.1007/s10690-024-09497-0,Article
Light of Microscopes and Laboratory Environment,Quality Management in the Assisted Reproduction Laboratory,,,,10.1007/978-981-99-6659-2_6,Da LiYingzhuo Gao,2024,https://link.springer.com/chapter/10.1007/978-981-99-6659-2_6,Chapter
"Geochemical Characteristics and Correlation of Permian Condensate Oil in Shawan Sag, Junggar Basin",Proceedings of the International Field Exploration and Development Conference 2024,,,,10.1007/978-981-96-2706-6_6,Jin-Duo WangZhi-Ping ZengRui-Chao GuoHui LiuZhi-Qing LiZe-Wei Xue,2025,https://link.springer.com/chapter/10.1007/978-981-96-2706-6_6,Conference paper
"Genetic Analysis of Low-Contrast Oil Reservoirs in Doseo Basin, Chad",Proceedings of The International Field Exploration and Development Conference 2024,,,,10.1007/978-981-96-2896-4_12,Qiao-feng LiangXin HuYi-fan WangMan LuoYe-bo DuZhi-yuan Yuan,2025,https://link.springer.com/chapter/10.1007/978-981-96-2896-4_12,Conference paper
Investigation of the production and antifungal properties of nanocapsules containing chamomile essential oil,Scientific Reports,,,,10.1038/s41598-025-08802-9,Tianjiao LiuXinyao QuMojiao ZhaoDafang ZhangJianpeng Guo,2025,https://link.springer.com/article/10.1038/s41598-025-08802-9,Article
Study on the Plugging Mechanism of Carbon Dioxide Oil Drive in Shale,Chemistry and Technology of Fuels and Oils,,,,10.1007/s10553-024-01674-1,Sun WhenchenLiu XueweiXiong ShengchunDong QinghaoLiu GuozhongSu Heying,2024,https://link.springer.com/article/10.1007/s10553-024-01674-1,Article
Sustainable polyurethane for the remediation of oil spills: a review,Environmental Science and Pollution Research,,,,10.1007/s11356-024-33037-y,Sanjay B. BhagwatDipika JaspalAmit Kumar TiwariArti MalviyaPetros Petrounias,2024,https://link.springer.com/article/10.1007/s11356-024-33037-y,Article
Facile Preparation of Nanofiber Aerogel with Micrometer/Millimeter-Sized Pore Structures for Enhanced Oil Recovery Removal,Fibers and Polymers,,,,10.1007/s12221-025-01021-z,Zhong ZhengYuchen ChenZuoxing YuGuojun Jiang,2025,https://link.springer.com/article/10.1007/s12221-025-01021-z,Article
"<i>Bauhinia variegata</i> Essential Oil: Chemical Composition, Biological Activities, and In Vitro and In Silico Studies",Chemistry Africa,,,,10.1007/s42250-025-01434-6,Truong N. NguDam T. B. HanhPhan H. T. BaoNguyen T. K. AnXuan L. NgoDang D. ThanhThuy M. P. LamViet A. T. NguyenPhi H. NguyenLe M. HoangDao C. To,2025,https://link.springer.com/article/10.1007/s42250-025-01434-6,Article
"Study on morphology, biological activities, and chemical compositions of Oenanthe javanica (Blume) DC. essential oil",Chemical Papers,,,,10.1007/s11696-024-03792-w,N. T. B. ThuyenD. V. H. ThienN. V. N. HoaP. T. HangN. Q. Luan,2024,https://link.springer.com/article/10.1007/s11696-024-03792-w,Article
Why is Antactic krill (Euphasia superba) oil on the spotlight? A review,"Food Production, Processing and Nutrition",,,,10.1186/s43014-024-00260-6,Fereidoon ShahidiAbrehem Abad,2024,https://link.springer.com/article/10.1186/s43014-024-00260-6,Article
Effect of thermal maturation and organic matter content on oil shale fracturing,International Journal of Coal Science & Technology,,,,10.1007/s40789-024-00666-0,Fatemeh SaberiMahboubeh Hosseini-Barzi,2024,https://link.springer.com/article/10.1007/s40789-024-00666-0,Article
Integrated Microfluidic Extraction and Detection of Aflatoxin B1 in Olive Oil,Food Analytical Methods,,,,10.1007/s12161-025-02827-6,Nagihan Okutan ArslanLevent Trabzon,2025,https://link.springer.com/article/10.1007/s12161-025-02827-6,Article
Superhydrophobic melamine sponge prepared by radiation-induced grafting technology for efficient oil–water separation,Nuclear Science and Techniques,,,,10.1007/s41365-024-01507-0,Ying SunWen-Rui WangDan-Yi LiSi-Yi XuLin LinMan-Li LuKai FanChen-Yang XingLin-Fan LiJi-Hao Li,2024,https://link.springer.com/article/10.1007/s41365-024-01507-0,Article
Oil leak detection in substation equipment based on PFDAL-DETR network,Journal of Real-Time Image Processing,,,,10.1007/s11554-024-01593-8,Chao JiJunpeng LiuFan ZhangXinghai JiaZhiwei SongChengliang LiangXinbo Huang,2024,https://link.springer.com/article/10.1007/s11554-024-01593-8,Article
Study the Influence of Sulfur Content and Pressure Gradient for Iraqi Crude Oil Discharge through Pipelines,Petroleum Chemistry,,,,10.1134/S0965544124070090,Anwar N. Mohammed AliRamzy S. HamiedKhalid A. SukkarZaidoon M. Shakor,2024,https://link.springer.com/article/10.1134/S0965544124070090,Article
Wind-resistant design theory and safety guarantee for large oil and gas storage tanks in coastal areas,Advances in Aerodynamics,,,,10.1186/s42774-024-00184-2,Bin HuangXijie LiuZhengnong LiDabo XinJinke LiuShujie QinTianyin XiaoJinshuang Dong,2024,https://link.springer.com/article/10.1186/s42774-024-00184-2,Article
Optimizing fatty acid composition and nutritional profile of palm oil-based blends for improved functional properties,Journal of Food Measurement and Characterization,,,,10.1007/s11694-025-03152-6,V. PrathapPraduman YadavK. ManoramaG. RavichandranK. SureshR. K. Mathur,2025,https://link.springer.com/article/10.1007/s11694-025-03152-6,Article
Bionic functional membranes for separation of oil-in-water emulsions,Friction,,,,10.1007/s40544-023-0819-6,Chaolang ChenRuisong JiangZhiguang Guo,2024,https://link.springer.com/article/10.1007/s40544-023-0819-6,Article
Harnessing algae oil as a sustainable DHA source for parenteral nutrition in vegan patients,Scientific Reports,,,,10.1038/s41598-025-03319-7,Joanna CzernielAleksandra Gostyńska-StawnaNatalia UrbaniakKarina Sommerfeld-KlattaMaciej Stawny,2025,https://link.springer.com/article/10.1038/s41598-025-03319-7,Article
Map of Water–Oil Flow Regimes in a Direct Microchannel,Technical Physics Letters,,,,10.1134/S1063785023180165,M. I. PryazhnikovA. V. MinakovA. I. PryazhikovA. S. Yakimov,2024,https://link.springer.com/article/10.1134/S1063785023180165,Article
Surfactant-assisted catalytic aquathermolysis of heavy crude oil using CuO@TiO<sub>2</sub> nanocomposite,Journal of Petroleum Exploration and Production Technology,,,,10.1007/s13202-025-02027-2,Asmaa S. MorshedyM. M. AbdelhamidTahany Mahmoud,2025,https://link.springer.com/article/10.1007/s13202-025-02027-2,Article
Enhanced Tribological Performance of Engine Oil through Stabilized Copper Nanoparticles,Arabian Journal for Science and Engineering,,,,10.1007/s13369-025-10637-5,Fazel KhosrowshiriSeyed Vahid HosseiniNafiseh MahdiyarMostafa Hajian,2025,https://link.springer.com/article/10.1007/s13369-025-10637-5,Article
Research on the Application of AR Technology in Oil and Gas Emergency Management,Chemistry and Technology of Fuels and Oils,,,,10.1007/s10553-025-01884-1,Qi SongXudong ShenHuaming WangLiang Xu,2025,https://link.springer.com/article/10.1007/s10553-025-01884-1,Article
"A surfactant-polymer and macromolecular surfactant compound system for enhancing heavy oil recovery: Synthesis, characterization and mechanism",Colloid and Polymer Science,,,,10.1007/s00396-025-05373-z,Jun HuLei-ting ShiYue LuoMao ChenCheng JinYong-jun GuoNa Yuan,2025,https://link.springer.com/article/10.1007/s00396-025-05373-z,Article
Unraveling the Impact of Russian Sanctions and Oil Prices on Exchange Rate: A Comparative Approach,Comparative Economic Studies,,,,10.1057/s41294-025-00258-0,Kotbee ShinBo-Young ChoiIndira Shamsutdinova,2025,https://link.springer.com/article/10.1057/s41294-025-00258-0,Article
Oil Deposits in Highly Paraffinic Crude Oils and in Model System,Petroleum Chemistry,,,,10.1134/S0965544124030137,N. V. YudinaYu. V. Loskutova,2024,https://link.springer.com/article/10.1134/S0965544124030137,Article
A novel algorithm for modeling gas–oil dynamic interfacial tension (IFT) and component exchange mechanisms,Scientific Reports,,,,10.1038/s41598-025-03372-2,Ali SafaeiMasoud Riazi,2025,https://link.springer.com/article/10.1038/s41598-025-03372-2,Article
Oil and Meat Production Magnifying the Peripheral,The Nonhuman Narratives of Energy,,,,10.1007/978-3-031-94332-4_3,Josephine Taylor,2025,https://link.springer.com/chapter/10.1007/978-3-031-94332-4_3,Chapter
The Expansion of the Brazilian Oil Sector: From External Dependence to Oil Self-Sufficiency,"China, Brazil and Petroleum",,,,10.1007/978-981-97-5874-6_2,Pedro Henrique Batista Barbosa,2024,https://link.springer.com/chapter/10.1007/978-981-97-5874-6_2,Chapter
Advance Technologies to Eliminate Environmental Problems of Oil and Gas Processing,Innovations in Electronic Materials: Advancing Technology for a Sustainable Future,,,,10.1007/978-3-031-73816-6_32,Farid H. AgayevAlmaz M. MehdiyevaArzu E. Ibrahimova,2025,https://link.springer.com/chapter/10.1007/978-3-031-73816-6_32,Conference paper
Olive Oil: A Seasoning and Something More,Tales of Discovery,,,,10.1007/978-3-031-47620-4_16,Gerardo Ávila Martín,2024,https://link.springer.com/chapter/10.1007/978-3-031-47620-4_16,Chapter
Pumpkin seed oil: unveiling its potential in controlling inflammation and pathogenicity during experimental trichinellosis,BMC Veterinary Research,,,,10.1186/s12917-024-04241-2,Sara Salah Abdel-HakeemSulaiman Mohammed AlnasserAlotaibi MeshalMahmoud Abdel-Zaher Abdel-SamieeMohamed Salah Eldin YoussefShimaa Hamdi Abd ElsadekSalwa Mahmoud Abd-Elrahman,2024,https://link.springer.com/article/10.1186/s12917-024-04241-2,Article
Optimization and experimental validation of a high-efficiency oil–water cyclone separator for well testing conditions,Journal of Engineering and Applied Science,,,,10.1186/s44147-025-00585-0,Zhimin Li,2025,https://link.springer.com/article/10.1186/s44147-025-00585-0,Article
In-situ upgrading of Egyptian heavy crude oil using matrix polymer carboxyl methyl cellulose/silicate graphene oxide nanocomposites,Scientific Reports,,,,10.1038/s41598-024-70843-3,Eman M. MostafaAlaa GhanemRasha HosnyRaghda El-Nagar,2024,https://link.springer.com/article/10.1038/s41598-024-70843-3,Article
PAHs and Heavy Metals in Contaminated Waters of Oil Refinery and the Caspian Sea,Russian Journal of General Chemistry,,,,10.1134/S1070363224130243,E. M. GadirovaS. R. HajiyevaA. G. HuseyinliU. N. Rustamova,2024,https://link.springer.com/article/10.1134/S1070363224130243,Article
Effect of temperature on bubble characteristics and oil-air contact surface area in machine oils,Forschung im Ingenieurwesen,,,,10.1007/s10010-025-00858-3,Lukas HafnerDavid PlaczekTimm HieronymusTobias PramstallerFadi Dohnal,2025,https://link.springer.com/article/10.1007/s10010-025-00858-3,Article
Omics Technologies: A Strategy to Expedite the Geographical Traceability and Authenticity of Palm Oil,Food and Bioprocess Technology,,,,10.1007/s11947-024-03673-w,Nurul Liyana RozaliUmi Salamah RamliRajinder SinghSharifah Nabihah Syed JaafarWolfram WeckwerthKamalrul Azlan AzizanAbrizah Othman,2024,https://link.springer.com/article/10.1007/s11947-024-03673-w,Article
Comparison of the policosanol contents in commercial health foods and policosanol stability in enriched rice bran oil,"Food Production, Processing and Nutrition",,,,10.1186/s43014-024-00303-y,Donporn WongwaiwechNutthaporn MajaiSudthida KamchonemenukoolChi-Tang HoMonthana Weerawatanakorn,2025,https://link.springer.com/article/10.1186/s43014-024-00303-y,Article
Efficient directions for oil-producing developing countries to technically achieve low-carbon transition,Clean Technologies and Environmental Policy,,,,10.1007/s10098-025-03170-4,Naeun YoonSimuzar AliyevaSo Young Sohn,2025,https://link.springer.com/article/10.1007/s10098-025-03170-4,Article
Optimization of supercritical fluid extraction and characterization of essential oil from Ethiopian thymus species,Journal of Food Measurement and Characterization,,,,10.1007/s11694-025-03282-x,Yisgedu AsresAriaya HymeteHabtamu AdmassuAmare AyalewShiferaw Ayalneh,2025,https://link.springer.com/article/10.1007/s11694-025-03282-x,Article
Study on Pore Structure of Longkou Oil Shale by Supercritical Carbon Dioxide Pyrolysis,Proceedings of the International Field Exploration and Development Conference 2024,,,,10.1007/978-981-96-5158-0_5,Chuan-jin YaoJing-xuan HouFan-yi MengYang-yang XuanXing-heng Huang,2025,https://link.springer.com/chapter/10.1007/978-981-96-5158-0_5,Conference paper
