Item Title,Publication Title,Book Series Title,Journal Volume,Journal Issue,Item DOI,Authors,Publication Year,URL,Content Type
DDDAS Within the Oil and Gas Industry,Handbook of Dynamic Data Driven Applications Systems,,,,10.1007/978-3-031-27986-7_12,Shiyan WangNate SchultheissSangtae Kim,2023,https://link.springer.com/chapter/10.1007/978-3-031-27986-7_12,Chapter
"An Analysis of Oil Sorbents: Types, Characteristics, and Effectiveness",Petroleum Chemistry,,,,10.1134/S0965544122090109,K. V. SkirdinO. V. Kazmina,2022,https://link.springer.com/article/10.1134/S0965544122090109,Article
Oil Products in Lake Baikal and Its Tributaries,Water Resources,,,,10.1134/S0097807822030101,I. I. MarinaiteL. M. SorokovikovaV. N. SinyukovichN. A. ZhuchenkoN. A. OnishchukI. V. Tomberg,2022,https://link.springer.com/article/10.1134/S0097807822030101,Article
Composite sponges fabricated by silk fibers and alginate for efficient oil/water separation,Journal of Materials Science,,,,10.1007/s10853-022-08030-w,Shuhan ZhaoKehao LiuXiaochen Wu,2022,https://link.springer.com/article/10.1007/s10853-022-08030-w,Article
Viscose Mutual Involvement of Moving Contacting Liquids,Advanced Hydrodynamics Problems in Earth Sciences,,,,10.1007/978-3-031-23050-9_2,A. V. Kistovich,2023,https://link.springer.com/chapter/10.1007/978-3-031-23050-9_2,Chapter
"Haematological, renal, and hepatic function changes among Rayong oil spill clean-up workers: a longitudinal study",International Archives of Occupational and Environmental Health,,,,10.1007/s00420-022-01834-y,Benjamin Atta OwusuApiradee LimChanthip IntawongSunthorn RheanpumikankitSaijit SuksriThammasin Ingviya,2022,https://link.springer.com/article/10.1007/s00420-022-01834-y,Article
Neocolonialism Facilitated by the World Bank? A Case Study of the World Bank’s Involvement in the Development of Guyana’s Oil and Gas Sector,Global Partnerships and Neocolonialism,,,,10.1007/978-3-031-87005-7_5,Jule Lümmen,2025,https://link.springer.com/chapter/10.1007/978-3-031-87005-7_5,Chapter
The effect of chemical dispersant of the third generation (Finasol OSR 62) on the microbial biodegradation process of Zarzaitine oil in water treatment,Applied Water Science,,,,10.1007/s13201-022-01803-3,Soumaya ElarbaouiLatifa SmiiZahrah AlhaliliMoêz Smiri,2022,https://link.springer.com/article/10.1007/s13201-022-01803-3,Article
Tunable nanostructured stainless-steel coating for high-selective and high-permeable separation membranes for oil/water emulsions,npj Clean Water,,,,10.1038/s41545-023-00237-x,Yi-Jui YehJinn P. ChuJhen-De YouTing-Hao ChangJr Rong LiouWei-Hung ChiangPakman YiuChun-Hway HsuehYu-Lin ShenKuo-Lun Tung,2023,https://link.springer.com/article/10.1038/s41545-023-00237-x,Article
Species-specific responses of marine bacteria to environmental perturbation,ISME Communications,,,,10.1038/s43705-023-00310-z,Tito D. Peña-MontenegroSara KleindienstAndrew E. AllenA. Murat ErenJohn P. McCrowJuan D. Sánchez-CalderónJonathan ArnoldSamantha B. Joye,2023,https://link.springer.com/article/10.1038/s43705-023-00310-z,Article
Liability and Compensation for Pollution Damage to the Marine Environment,Environmental Law,,,,10.1007/978-3-031-68956-7_15,Emmanuel Onyeabor,2024,https://link.springer.com/chapter/10.1007/978-3-031-68956-7_15,Chapter
Oil and&#xa0;Gas Automatic Infrastructure Mapping: Leveraging High-Resolution Satellite Imagery Through Fine-Tuning of&#xa0;Object Detection Models,Neural Information Processing,,,,10.1007/978-981-99-8148-9_35,Jade Eva GuisianoÉric MoulinesThomas LauvauxJérémie Sublime,2024,https://link.springer.com/chapter/10.1007/978-981-99-8148-9_35,Conference paper
Dissolution of oil in water in the viscous-gravity stage of oil spreading,Environmental Fluid Mechanics,,,,10.1007/s10652-022-09837-6,Rachid Chebbi,2022,https://link.springer.com/article/10.1007/s10652-022-09837-6,Article
Emulsion templated cellulosic porous scaffolds of superior oleophilicity,Cellulose,,,,10.1007/s10570-023-05425-z,Advitiya KumarDheeraj KumarSweety RaniBhanu NandanBhupendra Singh ButolaMinna HakkarainenRajiv K. Srivastava,2023,https://link.springer.com/article/10.1007/s10570-023-05425-z,Article
"<b>T</b><b>reatment of crude oil-polluted water using CoFe</b><sub><b>2</b></sub><b>O</b><sub><b>4</b></sub><b>-doped mango</b> (<Emphasis Type=""BoldItalic"">Mangifera indica</Emphasis>) seed<b> shell composite</b>",Applied Water Science,,,,10.1007/s13201-024-02212-4,Christian O. AsaduChika Oliver UjahBenjamin Nnamdi EkwuemeChinonso Anthony EzemaThomas O. OnahTrobjon MakhkamovChristian Chikezie AkaFranklin O. UgweleChijioke Elijah Onu,2024,https://link.springer.com/article/10.1007/s13201-024-02212-4,Article
Glycolipid Biosurfactant-Assisted Remediation Strategy to Minimize the Petroleum Contaminant Footprint in Environmental Compartments,"Water, Air, & Soil Pollution",,,,10.1007/s11270-023-06771-1,Shweta AmbustAishwary PurohitAmar Jyoti DasRajesh KumarDebashish Ghosh,2023,https://link.springer.com/article/10.1007/s11270-023-06771-1,Article
"An Analysis of Corporate Social Responsibility (CSR)-Related Objectives Enshrined in the “National Oil and Gas Policy for Uganda, 2008”: A Policy Perspective Paper",Corporate Social Responsibility Disclosure in Developing and Emerging Economies,,,,10.1007/978-3-031-61976-2_10,David KatambaBosco AmeritMaureen BasuutaSwithern B. TumwineNgoma Muhammed,2024,https://link.springer.com/chapter/10.1007/978-3-031-61976-2_10,Chapter
Testing and Validating Against Historic Spills,Assessing Environmental Risk of Oil Spills with ERA Acute,,,,10.1007/978-3-030-70176-5_4,Cathrine StephansenAnders BjørgesæterOdd Willy BrudeUte BrönnerTonje Waterloo RogstadGrethe Kjeilen-EilertsenJean-Marie LibreChristian Collin-Hansen,2021,https://link.springer.com/chapter/10.1007/978-3-030-70176-5_4,Chapter
Biliary Polycyclic Aromatic Hydrocarbon Metabolite Equivalents Measured in Fish and Subtidal Invertebrates Following the Refugio Beach Oil Spill,Archives of Environmental Contamination and Toxicology,,,,10.1007/s00244-022-00945-4,Regina M. DonohoeBernadita AnulacionDavid WittingNatalie Cosentino-ManningApril R. DaSilvaLaurie Sullivan,2022,https://link.springer.com/article/10.1007/s00244-022-00945-4,Article
Perforation Size Effect on Lotus Leaf Based Oil/Water Separator,Proceeding of 5th International Conference on Advances in Manufacturing and Materials Engineering,,,,10.1007/978-981-19-9509-5_76,Muhammad Hariz AhatFethma M. NorS. RameshDenni Kurniawan,2023,https://link.springer.com/chapter/10.1007/978-981-19-9509-5_76,Conference paper
Expanded Polystyrene Waste Valorization as a Superhydrophobic Membrane for Oil Spill Remediation,Waste and Biomass Valorization,,,,10.1007/s12649-022-01976-7,Abdul HalimAzmi Alvian GabrielMaya IsmayatiPutra Listyo Nur RayhanUmu Azizah,2022,https://link.springer.com/article/10.1007/s12649-022-01976-7,Article
Effects of Phenanthrene on Electrical Activity of Ventricular Cardiomyocytes in Atlantic Cod (<i>Gadus morhua</i>),Journal of Evolutionary Biochemistry and Physiology,,,,10.1134/S0022093024040033,T. S. FilatovaA. V. ShamshuraD. V. Abramochkin,2024,https://link.springer.com/article/10.1134/S0022093024040033,Article
Near Real-Time Fire Management and Environmental Sustainability: Towards a Machine Learning Approach to Monitor Oil Pipeline Spill Fires with MODIS Fire Products in Nigeria,Artificial Intelligence and Environmental Sustainability,,,,10.1007/978-981-19-1434-8_10,Michael Gbenga OgungbuyiIffat AraPeter Martinez,2022,https://link.springer.com/chapter/10.1007/978-981-19-1434-8_10,Chapter
Screening and molecular identification of biosurfactant/bioemulsifier producing bacteria from crude oil contaminated soils samples,Biologia,,,,10.1007/s11756-023-01330-9,Ebru UyarTuba Avcı,2023,https://link.springer.com/article/10.1007/s11756-023-01330-9,Article
Software and Modeling Tools for Assessment of Environmental Consequences of Open Flowing of Oil Wells,"Systems, Decision and Control in Energy IV",,,,10.1007/978-3-031-22500-0_18,Oleksandr PopovTeodoziia YatsyshynMykhailo LiakhRoman FursaAndrii IatsyshynValeriia Kovach,2023,https://link.springer.com/chapter/10.1007/978-3-031-22500-0_18,Chapter
A Weaving Method to Prepare Double-Layer Janus Fabric for Oil-Water Separation,Fibers and Polymers,,,,10.1007/s12221-022-4324-8,Xiqin HuangKaili JinKeru HouBi XuZaisheng Cai,2022,https://link.springer.com/article/10.1007/s12221-022-4324-8,Article
"Market volatility and crisis dynamics: a comprehensive analysis of U.S., China, India, and Pakistan stock markets with oil and gold interconnections during COVID-19 and Russia–Ukraine war periods",Future Business Journal,,,,10.1186/s43093-024-00314-8,Muhammad Niaz Khan,2024,https://link.springer.com/article/10.1186/s43093-024-00314-8,Article
Biogeophysics for Optimized Characterization of Petroleum-Contaminated Sites,Advances in the Characterisation and Remediation of Sites Contaminated with Petroleum Hydrocarbons,,,,10.1007/978-3-031-34447-3_9,Estella A. AtekwanaEliot A. AtekwanaLeonard O. OhenhenSilvia Rossbach,2024,https://link.springer.com/chapter/10.1007/978-3-031-34447-3_9,Chapter
Experimental study of C-band microwave scattering characteristics during the emulsification process of oil spills,Acta Oceanologica Sinica,,,,10.1007/s13131-020-1612-4,Sijing ShuJunmin MengXi ZhangJie GuoGenwang Liu,2020,https://link.springer.com/article/10.1007/s13131-020-1612-4,Article
Investigating the impacts of oil contamination on geotechnical properties of laterite soils,Innovative Infrastructure Solutions,,,,10.1007/s41062-022-00901-0,Reda A. AbdelhalimHarris RamliMohamad R. Selamat,2022,https://link.springer.com/article/10.1007/s41062-022-00901-0,Article
"Ultralight, fire-resistant, lamellar nitrogen-doped graphene aerogels for highly efficient selective organic pollutant cleanup",Journal of Materials Science,,,,10.1007/s10853-023-08762-3,Ruiqian ZhangLing LiuQinghan Meng,2023,https://link.springer.com/article/10.1007/s10853-023-08762-3,Article
Oxidative damage in the Vesper mouse (<i>Calomys laucha</i>) exposed to a simulated oil spill—a multi-organ study,Ecotoxicology,,,,10.1007/s10646-023-02657-4,Krissia Aparecida de AlmeidaFernando Rafael de MouraJuliane Ventura LimaEdariane Menestrino GarciaAna Luíza Muccillo-BaischPaula Florencio RamiresJulia Oliveira PenteadoMaria da Luz MathiasDeodália DiasFlavio Manoel Rodrigues da Silva Júnior,2023,https://link.springer.com/article/10.1007/s10646-023-02657-4,Article
Efficiency Evaluation of the Rehabilitation of Oil-Contaminated Agricultural Soddy-Podzolic Soils,Agriculture Digitalization and Organic Production,,,,10.1007/978-981-99-4165-0_22,Ludmila BakinaMarina ChugunovaAlexander GerasimovYulia Polyak,2023,https://link.springer.com/chapter/10.1007/978-981-99-4165-0_22,Conference paper
Analysis of Soil Contamination with Oil and Petroleum Products,International Scientific Siberian Transport Forum TransSiberia - 2021,,,,10.1007/978-3-030-96383-5_169,Makhmud Abu-Khasan,2022,https://link.springer.com/chapter/10.1007/978-3-030-96383-5_169,Conference paper
Equipment for Rapid Freezing of Oil Contaminated Soil by Liquid Nitrogen for Its Subsequent Utilization,Chemical and Petroleum Engineering,,,,10.1007/s10556-021-00950-9,K. P. VengerV. A. StefanovaO. A. FeskovM. A. Romanov,2021,https://link.springer.com/article/10.1007/s10556-021-00950-9,Article
Micro-arc oxidation enhances the wear resistance and corrosion resistance of oil–water separating mesh,Journal of Materials Science,,,,10.1007/s10853-022-07707-6,Bowen XueHe LinGuiquan ChaiChangkai WangHuiyun YangHailin Lu,2022,https://link.springer.com/article/10.1007/s10853-022-07707-6,Article
"Law, Economy, and Society: Insights into Legal and Economic Issues in India","Accounting, Finance, Sustainability, Governance & Fraud: Theory and Application",,,,9789819533602,Ashish VirkAman Amrit CheemaPooja Sikka,2025,https://link.springer.com/book/9789819533602,Book
"Studies on the morphology, phylogeny, and bioremediation potential of <i>Penicillium</i> <i>citrinum</i> and <i>Paecilomyces</i> <i>variotii</i> (Eurotiales) from oil-contaminated areas",Archives of Microbiology,,,,10.1007/s00203-022-03383-x,Vikas KumarHarsh KumarVineet VishalShalini Lal,2023,https://link.springer.com/article/10.1007/s00203-022-03383-x,Article
Development of a policy-based distance-to-target weighting method in life cycle impact assessment for Nigeria,The International Journal of Life Cycle Assessment,,,,10.1007/s11367-024-02406-7,Mohammed Engha IsahZhengyang ZhangKazuyo Matsubae,2024,https://link.springer.com/article/10.1007/s11367-024-02406-7,Article
"Effect of ocean acidification on the growth, response and hydrocarbon degradation of coccolithophore-bacterial communities exposed to crude oil",Scientific Reports,,,,10.1038/s41598-023-31784-5,Afiq Mohd FahmiStephen SummersMartin JonesBernard BowlerSebastian HennigeTony Gutierrez,2023,https://link.springer.com/article/10.1038/s41598-023-31784-5,Article
Instant identification of hydrocarbon spill types using laser-induced fluorescence and associated hyperspectral imaging,Optical and Quantum Electronics,,,,10.1007/s11082-023-04560-y,Alaaeldin MahmoudYasser H. El-Sharkawy,2023,https://link.springer.com/article/10.1007/s11082-023-04560-y,Article
Less is more; intermediate oiling has a greater impact than heavy oiling on feather permeability in Northern Gannets <i>(Morus bassanus)</i>,Marine Biology,,,,10.1007/s00227-025-04687-4,Nina RogersonMark JessoppEmma Murphy,2025,https://link.springer.com/article/10.1007/s00227-025-04687-4,Article
"Coconut oil and fermented palm wine biodiesel production for oil spill cleanup: experimental, numerical, and hybrid metaheuristic modeling approaches",Environmental Science and Pollution Research,,,,10.1007/s11356-022-19426-1,Eric Thompson BrantsonHarrison OseiMark Shalom Kwesi AidooPrince Opoku AppauFuseini Naziru IssakaNannan LiuChukwugozie Jekwu EjehKouamelan Serge Kouamelan,2022,https://link.springer.com/article/10.1007/s11356-022-19426-1,Article
Resistance from the Global South: Nigerian Press Coverage of Bonga Oil Spill Controversy,Mediascapes of Ruined Geographies in the Global South,,,,10.1007/978-3-031-31590-9_10,Emeka Umejei,2023,https://link.springer.com/chapter/10.1007/978-3-031-31590-9_10,Chapter
Constructing robust and magnetic PU sponges modified with Fe<sub>3</sub>O<sub>4</sub>/GO nanohybrids for efficient oil/water separation,Journal of Coatings Technology and Research,,,,10.1007/s11998-022-00699-7,Dongdong GeYun ZhangZhenshan CuiGuilong WangJun LiuXiaomeng Lv,2022,https://link.springer.com/article/10.1007/s11998-022-00699-7,Article
A Case for the Application of Strict Liability in Oil and Gas Pollution Cases in Nigeria,International Law and Development in the Global South,,,,10.1007/978-3-031-13741-9_16,Sunday Gozie OgbodoA. Chinwe Umadia,2023,https://link.springer.com/chapter/10.1007/978-3-031-13741-9_16,Chapter
The Role of the Oil and Gas Industry in the Energy Transition,Sustainability in the Oil and Gas Sector,,,,10.1007/978-3-031-51586-6_3,Soheil SarajiDayo Akindipe,2024,https://link.springer.com/chapter/10.1007/978-3-031-51586-6_3,Chapter
"Biofilm-mediated bioremediation of xenobiotics and heavy metals: a comprehensive review of microbial ecology, molecular mechanisms, and emerging biotechnological applications",3 Biotech,,,,10.1007/s13205-025-04252-2,Argajit SarkarSurajit Bhattacharjee,2025,https://link.springer.com/article/10.1007/s13205-025-04252-2,Article
"Integration of hydrodynamic and water quality modeling to mitigate the effects of spill pollution into the Nile River, Egypt",Environmental Science and Pollution Research,,,,10.1007/s11356-024-34216-7,Elsayed M. RamadanAhmed MoussaAmal MagdyAbdelazim Negm,2024,https://link.springer.com/article/10.1007/s11356-024-34216-7,Article
Method of Formation Path Planning Based on Heading Information Fusion for Oil-Spill Recovery,2023 International Conference on Marine Equipment & Technology and Sustainable Development,,,,10.1007/978-981-99-4291-6_36,Yulei LiaoWen JiangJiaqi SunHailong ShenCongcong ChenShuo Pang,2023,https://link.springer.com/chapter/10.1007/978-981-99-4291-6_36,Conference paper
Experimental research on oil film thickness and its microwave scattering during emulsification,Journal of Oceanology and Limnology,,,,10.1007/s00343-021-1183-x,Jie GuoChenqi XuGenwang LiuXi ZhangJunmin MengGuangbo Ren,2021,https://link.springer.com/article/10.1007/s00343-021-1183-x,Article
"Impacts of rhizoremediation and biostimulation on soil microbial community, for enhanced degradation of petroleum hydrocarbons in crude oil-contaminated agricultural soils",Environmental Science and Pollution Research,,,,10.1007/s11356-023-29033-3," Bhrigu BhuyanRhitu KotokyPiyush Pandey",2023,https://link.springer.com/article/10.1007/s11356-023-29033-3,Article
TiO<sub>2</sub>@palygorskite composite for the efficient remediation of oil spills via a dispersion-photodegradation synergy,Frontiers of Environmental Science & Engineering,,,,10.1007/s11783-020-1365-3,Chenchen LiLijie YanYiming LiDan ZhangMutai BaoLimei Dong,2020,https://link.springer.com/article/10.1007/s11783-020-1365-3,Article
"Biodegradation, Bioaccumulation and Toxicity of Oil Spill Herding Agents in Arctic Waters as Part of an Ecotoxicological Screening","Water, Air, & Soil Pollution",,,,10.1007/s11270-021-05332-8,Janne Fritt-RasmussenEva Friis MøllerLine Anker KyhnSusse WegebergPia LassenDavid CooperKim Gustavson,2021,https://link.springer.com/article/10.1007/s11270-021-05332-8,Article
Planning for an offshore oiled wildlife response: case studies from New Zealand and Brazil,Environmental Science and Pollution Research,,,,10.1007/s11356-023-26440-4,B. L. ChilversV. Ruoppolo,2023,https://link.springer.com/article/10.1007/s11356-023-26440-4,Article
Marine Ecosystems in Peril: The Impact of the Recent War on Gaza’s Coastal and Marine Life,War on Gaza,,,,10.1007/978-3-031-88500-6_12,Nour Alhaj AbdullahAmmar HdaifehKhaled BabaadouneAli JebreenNour AwadAbderahman RejebYehia El-TemsahAbdo Hassoun,2025,https://link.springer.com/chapter/10.1007/978-3-031-88500-6_12,Chapter
"Superhydrophobic and magnetic PS/Fe<sub>3</sub>O<sub>4</sub> sponge for remote oil removal under magnetic driven, continuous oil collection, and oil/water emulsion separation",Journal of Materials Science,,,,10.1007/s10853-021-06568-9,Haoran HuangXin LiChunxia ZhaoLongbin ZhuYuntao LiYuanpeng WuZhenyu Li,2022,https://link.springer.com/article/10.1007/s10853-021-06568-9,Article
Effect of Some Bio-Stimulants in the Degradation of Petroleum Hydrocarbons in Crude Oil Contaminated Soil,TMS 2023 152nd Annual Meeting & Exhibition Supplemental Proceedings,,,,10.1007/978-3-031-22524-6_62,Ita E. UwidiaUzuazor O. EyibaraOsalodion E. Uwidia,2023,https://link.springer.com/chapter/10.1007/978-3-031-22524-6_62,Conference paper
Growth responses of <i>Avicennia germinans</i> and <i>Batis maritima</i> seedlings to weathered light sweet crude oil applied to soil and aboveground tissues,Environmental Science and Pollution Research,,,,10.1007/s11356-022-20458-w,William J. HeintzJonathan M. Willis,2022,https://link.springer.com/article/10.1007/s11356-022-20458-w,Article
Green Composite Sorbents from Coffee Capsule Waste and <i>Eucalyptus urograndis</i> Holocellulose,Arabian Journal for Science and Engineering,,,,10.1007/s13369-025-10030-2,Ana Paula Senra SoaresMichelle Gonçalves MothéJaqueline Souza de FreitasMaria de Fátima Vieira Marques,2025,https://link.springer.com/article/10.1007/s13369-025-10030-2,Article
"Biodiversity effects of the Russia–Ukraine War and the Kakhovka Dam destruction: ecological consequences and predictions for marine, estuarine, and freshwater communities in the northern Black Sea",Ecological Processes,,,,10.1186/s13717-025-00577-1,Yuriy KvachCarol A. StepienGalyna G. MinichevaPavlo Tkachenko,2025,https://link.springer.com/article/10.1186/s13717-025-00577-1,Article
Multifunctional esterified nanocellulose aerogel: impact of fatty chain length on oil/water separation and thermal insulation,Cellulose,,,,10.1007/s10570-022-04993-w,Monika ChhajedChhavi VermaPragya GuptaPradip K. Maji,2022,https://link.springer.com/article/10.1007/s10570-022-04993-w,Article
"Synthesis of porous, hydrophobic aerogel through the reinforcement of bamboo-shaped oxidized multi-walled carbon nanotubes in the silica matrix for oil spill cleaning",Clean Technologies and Environmental Policy,,,,10.1007/s10098-023-02487-2,Ahmad Ali AlZubiSrinivasa Reddy DevarapuHannoud Al MoghrabiSuresh Kumar GovindarajanD. T. K. Dora,2023,https://link.springer.com/article/10.1007/s10098-023-02487-2,Article
Monitoring the contamination dynamics and flow pathway of oil spill using 3D-4D ERT in a pollution site,Environmental Monitoring and Assessment,,,,10.1007/s10661-025-14062-x,Stanley Uchechukwu EzeKuma Joshua Ayua,2025,https://link.springer.com/article/10.1007/s10661-025-14062-x,Article
Theoretical Substantiation of Mathematical Models of Oil Filtration Through a Porous Medium,Advanced Manufacturing Processes III,,,,10.1007/978-3-030-91327-4_55,Iryna AblieievaLeonid PlyatsukOksana BurlaOleh ChekhAlex Enrich-Prast,2022,https://link.springer.com/chapter/10.1007/978-3-030-91327-4_55,Conference paper
"Dynamic Connectedness Among Oil, Food Commodity, and Renewable Energy Markets: Novel Perspective from Quantile Dependence and Deep Learning",Journal of the Knowledge Economy,,,,10.1007/s13132-023-01485-5,Yaoxun DengGuobin FangJun ZhangHuimin Ma,2023,https://link.springer.com/article/10.1007/s13132-023-01485-5,Article
Selected Applications of Artificial Intelligence in Pursuing the Sustainable Development Goals,Emerging Technologies for Developing Countries,,,,10.1007/978-3-031-93557-2_5,Mobayode O. AkinsoluChekwube EzechiWilson SakpereMingwei Sun,2026,https://link.springer.com/chapter/10.1007/978-3-031-93557-2_5,Conference paper
Oil and Natural Gas and Sustainability,The Palgrave Handbook of Global Sustainability,,,,10.1007/978-3-030-38948-2_13-1,Alban Echchelh,2022,https://link.springer.com/rwe/10.1007/978-3-030-38948-2_13-1,Living reference work entry
Waste oil management system from the maintenance of artisanal fishing craft the Peruvian case,International Journal of Environmental Science and Technology,,,,10.1007/s13762-022-04260-2,V. Razuri-EstevesV. Valverde-VeraG. Vega-Abab,2022,https://link.springer.com/article/10.1007/s13762-022-04260-2,Article
Advanced Aerogels from Wool Waste Fibers for Oil Spill Cleaning Applications,Journal of Polymers and the Environment,,,,10.1007/s10924-021-02234-y,J. W. LohXue Yang GohPhuc T. T. NguyenQuoc B. ThaiZ. Y. OngHai M. Duong,2021,https://link.springer.com/article/10.1007/s10924-021-02234-y,Article
Performance of Kapok Fibres and Kapok Ash Wood as Oil Absorption Materials,Green Infrastructure,,,,10.1007/978-981-99-7003-2_22,Abdul Hadi Firuz AhmadRohana HassanNurbaiah Mohammad NohNor Jihan Abd MalekAnizahyati AlisibramulsiEzahtul Shahreen Ab Wahab,2023,https://link.springer.com/chapter/10.1007/978-981-99-7003-2_22,Chapter
"The Nexus of Oil Consumption and Economic Growth in India, China, and Japan",The Palgrave Handbook of Global Social Problems,,,,10.1007/978-3-030-68127-2_423-1,Elizabeth Varsha Paul,2023,https://link.springer.com/rwe/10.1007/978-3-030-68127-2_423-1,Living reference work entry
Impact of Commercial Activities on the Marine World,Radiation Status in the Marine World,,,,10.1007/978-3-031-82403-6_11,Shreya OjhaUma Hapani,2025,https://link.springer.com/chapter/10.1007/978-3-031-82403-6_11,Chapter
Formation Water Analysis to Examine the Scale Formation and Wettability Alteration Behavior and Its Treatment Thereof for Sustaining Crude Oil Production from Porous Media of the Upper Assam Basin,"Proceedings of 1st International Conference on Petroleum, Hydrogen and Decarbonization",,,,10.1007/978-981-96-3667-9_2,Jahnavee BharadwajDhrubajyoti Neog,2025,https://link.springer.com/chapter/10.1007/978-981-96-3667-9_2,Conference paper
Disentangling the microbial genomic traits associated with aromatic hydrocarbon degradation in a jet fuel-contaminated aquifer,Biodegradation,,,,10.1007/s10532-024-10100-6,K. J. HidalgoV. B. CenturionL. N. LemosA. U. SorianoE. ValoniM. P. BaessaH. H. RichnowC. VogtV. M. Oliveira,2024,https://link.springer.com/article/10.1007/s10532-024-10100-6,Article
Oil/water separation and functionality of smart carbon nanotube–titania nanotube composite,Journal of Nanoparticle Research,,,,10.1007/s11051-022-05597-y,Mohamed MorsyAhmed I. Abdel-SalamDiaa A. RayanIslam GomaaAmir Elzwawy,2022,https://link.springer.com/article/10.1007/s11051-022-05597-y,Article
Advanced Electrospun Nanofibrous Materials for Efficient Oil/Water Separation,Advanced Fiber Materials,,,,10.1007/s42765-022-00158-3,Ying SuTingting FanWenying CuiYanan LiSeeram RamakrishnaYunze Long,2022,https://link.springer.com/article/10.1007/s42765-022-00158-3,Article
Do oil price fluctuations influence criminal activity in energy rich regions? Evidence from California’s Central Valley,"Crime, Law and Social Change",,,,10.1007/s10611-023-10087-w,Nyakundi M. MichiekaRichard S. Gearhart III,2023,https://link.springer.com/article/10.1007/s10611-023-10087-w,Article
Probabilistic hesitant fuzzy set-based decision support system for groundwater pollution control technologies evaluation in the oil and gas industry,Environmental Earth Sciences,,,,10.1007/s12665-025-12442-7,Abdolvahhab FetanatMohsen Tayebi,2025,https://link.springer.com/article/10.1007/s12665-025-12442-7,Article
Novel Method for Producing Oleophilic Polyurethane Foam to Remove Oil from Open Water,Journal of Polymers and the Environment,,,,10.1007/s10924-022-02565-4,Nguyen Huu DatVu Manh TuanMai Duc HuynhTran Huu TrungNguyen Thi Thu TrangDam Xuan ThangKieu Thi Quynh HoaNguyen Vu Giang,2022,https://link.springer.com/article/10.1007/s10924-022-02565-4,Article
