Item Title,Publication Title,Book Series Title,Journal Volume,Journal Issue,Item DOI,Authors,Publication Year,URL,Content Type
"Genesis of the Heima zinnwaldite deposit in the Gongshan region, Southeast Tibetan plateau",Acta Geochimica,,,,10.1007/s11631-025-00822-6,Shiping LiZechuan WangJing WangZhen JiaJialong ChengFuchuan ChenShiyin XiaoChaofang DongYitian Luo,2025,https://link.springer.com/article/10.1007/s11631-025-00822-6,Article
Mass Spectrometry-Based Approaches in Metabolomics,Advances in Omics Technologies,,,,10.1007/978-981-95-0285-1_12,Dharmendra Singh Lagoriya,2025,https://link.springer.com/chapter/10.1007/978-981-95-0285-1_12,Chapter
Unraveling factors controlling petrophysical properties and reservoir quality in a multi-facies carbonate system: case of the Cenomanian–Turonian reservoir in Southern Tunisia (Dahar Cliff) carbonates and evaporites,Carbonates and Evaporites,,,,10.1007/s13146-022-00828-8,Feten BouheliChaouki KhalfiMohamed Riadh ChebbiRiadh AhmadiHajer MejriChristian DavidMohamed Faouzi Zagrarni,2022,https://link.springer.com/article/10.1007/s13146-022-00828-8,Article
Pore Structure,Encyclopedia of Mathematical Geosciences,,,,10.1007/978-3-030-85040-1_148,Weiren LinNana Kamiya,2023,https://link.springer.com/rwe/10.1007/978-3-030-85040-1_148,Reference work entry
"Ostracods from the Middle-Upper Devonian of the Kocadere Section (Feke, Adana), Eastern Taurides and their contribution to palaeobiogeography",Palaeobiodiversity and Palaeoenvironments,,,,10.1007/s12549-024-00637-y,Emine Şeker ZorAtike Nazik,2025,https://link.springer.com/article/10.1007/s12549-024-00637-y,Article
"Hydrogeochemical signatures origin of a karst geothermal reservoir–the Sinian Dengying Formation in northern Guizhou, China",Geosciences Journal,,,,10.1007/s12303-023-0030-9,Pu LiuZhengshan ChenGanlu WangTie MaoChao LiYanan ZhouHong XieTong Xiang,2023,https://link.springer.com/article/10.1007/s12303-023-0030-9,Article
"Exploring gold mineralization in altered ultramafic rocks in south Abu Marawat, Eastern Desert, Egypt",Scientific Reports,,,,10.1038/s41598-023-33947-w,Abdelmonem EldougdougMaha AbdelazeemMohamed GobashyMohamed AbdelwahedYasser Abd El-RahmanAhmed AbdelhalimSaid Said,2023,https://link.springer.com/article/10.1038/s41598-023-33947-w,Article
"Geochemical Characteristics and Origin of Crude Oil and Natural Gas in the Southern Slope Zone, Kuqa Foreland Basin, NW China",Journal of Earth Science,,,,10.1007/s12583-021-1412-4,Chun LiuShijia ChenJilong ZhaoZhou SuHui Rong,2022,https://link.springer.com/article/10.1007/s12583-021-1412-4,Article
Geochemistry and Catagenetic Transformations of Kerogen from the Bazhenov Horizon,Geochemistry International,,,,10.1134/S0016702919060028,A. E. KontorovichL. I. BogorodskayaL. S. BorisovaL. M. BurshteinZ. P. IsmagilovO. S. EfimovaE. A. KostyrevaN. M. LeminaS. V. RyzhkovaS. A. SozinovA. N. Fomin,2019,https://link.springer.com/article/10.1134/S0016702919060028,Article
"Geochemical evolution of structure-bedding controlled hydrothermal dolomites of the Kinta Valley, Western Malaysia",Carbonates and Evaporites,,,,10.1007/s13146-022-00802-4,P. Xin HuiR. NagarajanMu. RamkumarT. F. NgNur I. TaibM. J. MathewB. SautterN. A. SiddiquiM. C. Poppelreiter,2022,https://link.springer.com/article/10.1007/s13146-022-00802-4,Article
Provenance and tectonic setting of the Yimianpo Group in the southeastern Songnen–Zhangguangcai Range Block: constraints on the closure of the Mudanjiang Ocean,Geosciences Journal,,,,10.1007/s12303-023-0014-9,Mishan ZhongJin LiuZhenghong LiuJundian ChenHongchao YuHaipeng WangJunshi LuZijie WuMingchen PanQi WangYilong Wang,2023,https://link.springer.com/article/10.1007/s12303-023-0014-9,Article
Data-driven total organic carbon prediction using feature selection methods incorporated in an automated machine learning framework,Scientific Reports,,,,10.1038/s41598-025-91224-4,Bruno da Silva MacêdoDennis Delali Kwesi WayoDeivid CamposRodrigo Barbosa De SantisAlfeu Dias MartinhoZaher Mundher YaseenCamila Martins SaporettiLeonardo Goliatt,2025,https://link.springer.com/article/10.1038/s41598-025-91224-4,Article
Temporal Changes of Sulfate-Reducing Microbial Communities Based on Functional Gene Sequencing in Production Water of Shale Gas Reservoir,Chemistry and Technology of Fuels and Oils,,,,10.1007/s10553-024-01764-0,Jianqiang ChenHaiyan QiuZhiyi ChenGuihong LanQi XiaoSongsong XueTianxiong OuBo XuTianyi Wang,2024,https://link.springer.com/article/10.1007/s10553-024-01764-0,Article
Isotope Fingerprinting in Air Pollution Source Identification: A Review,Airborne Particulate  Matter,,,,10.1007/978-3-031-84408-9_3,Mobarok HossainParul KuiryP. K. Patra,2025,https://link.springer.com/chapter/10.1007/978-3-031-84408-9_3,Chapter
Microbe Mineral Interaction and Environmental Pollution Management,Biotechnology for Environmental Sustainability,,,,10.1007/978-981-97-7221-6_10,Wajeeha NoreenSaadia FatimaHafiz Abdullah ShakirMuhammad KhanShaukat AliMarcelo FrancoMuhammad Irfan,2025,https://link.springer.com/chapter/10.1007/978-981-97-7221-6_10,Chapter
Barremian–Albian unconventional shale oil and wet gas resource systems in northeastern Tunisia,Euro-Mediterranean Journal for Environmental Integration,,,,10.1007/s41207-024-00619-8,Rachida TalbiAhlem AmriAfef HermiReginal SpillerRaymond Levey,2024,https://link.springer.com/article/10.1007/s41207-024-00619-8,Article
"Geochemical characteristics, generation, and evolution mechanism of coalbed methane in the south-western Ordos Basin, China",Frontiers of Earth Science,,,,10.1007/s11707-022-1057-3,Yabing LinYong QinDongmin MaShengquan Wang,2024,https://link.springer.com/article/10.1007/s11707-022-1057-3,Article
δ<sup>11</sup>B in Mud Volcanic Waters of the Kerch–Taman Mud-Volcanic Area (Crimea–Caucasus Region): Genesis and Formation Conditions of the Boron Mineralization,Lithology and Mineral Resources,,,,10.1134/S0024490225700191,V. Y. LavrushinY. MaC.-F. YouA. S. AidarkozhinaE. V. SokolY.-P. LinG. A. ChelnokovS. N. KochX. MaG. Zheng,2025,https://link.springer.com/article/10.1134/S0024490225700191,Article
"Devonian–Carboniferous Pillow OIB-Type Basalts in the Youjiang Basin, SW China: Implications for the Eastern Extension of the Paleo-Tethys Branch Ocean",Journal of Earth Science,,,,10.1007/s12583-020-1098-z,Jie YangYuansheng DuHu HuangJianghai YangHongwei HuangZhiqiang Huang,2023,https://link.springer.com/article/10.1007/s12583-020-1098-z,Article
"Cenozoic potassic volcanic rocks from the Keluo and Wudalianchi volcanic districts, northeast China: origin from the new sub-continental lithospheric mantle (SCLM) metasomatized by potassium-rich fluids from delaminated lower crust",Frontiers of Earth Science,,,,10.1007/s11707-021-0960-3,Fanchao MengYulu TianYaoqi ZhouJiaqi LiuGengchao ZuoQing Du,2022,https://link.springer.com/article/10.1007/s11707-021-0960-3,Article
"Geochemical Characteristics and Development Significances of Constant and Trace Elements from Coalbed Methane Co-Produced Water: A Case Study of the Shizhuangnan Block, the Southern Qinshui Basin",Journal of Earth Science,,,,10.1007/s12583-022-1628-y,Yang LiShuheng TangJian ChenSonghang ZhangZhaodong Xi,2024,https://link.springer.com/article/10.1007/s12583-022-1628-y,Article
Hydrogeochemical and rare earth element properties of geothermal waters and the use of abandoned oil wells in Diyarbakır,Environmental Earth Sciences,,,,10.1007/s12665-024-11785-x,Mehmet Furkan Şener,2024,https://link.springer.com/article/10.1007/s12665-024-11785-x,Article
"Roles of Multisourced Fluids in the Formation of Sandstone-Hosted Uranium Deposits in the SW Songliao Basin, NE China",Journal of Earth Science,,,,10.1007/s12583-022-1705-2,Zhibing FengFengjun NieLi JiangFei XiaJianfang CaiBocheng ZhangYayun LuLiangliang Zhang,2023,https://link.springer.com/article/10.1007/s12583-022-1705-2,Article
"Source rock maturity and hydrocarbon potential of Abu Rudeis-Sidri area, central province, Gulf of Suez, Egypt",Arabian Journal of Geosciences,,,,10.1007/s12517-021-09140-6,Khaled Gamal ElmaadawyMahmoud Fathy BayanHassan Mohamed El-Shayeb,2021,https://link.springer.com/article/10.1007/s12517-021-09140-6,Article
Spatial and Temporal Distribution of Metal Elements in the Rivers of Northern Jiangsu Province,Journal of Ocean University of China,,,,10.1007/s11802-025-5824-0,Liping YuanQian LiuHuimin JianTiezhu MiFuxia YangQingzhen Yao,2025,https://link.springer.com/article/10.1007/s11802-025-5824-0,Article
"Latest Carboniferous–Early Permian Rifting of the Northern Gondwanan Margin and the Opening of the Northern Neotethys: New Evidence from the Carboniferous and Permian Foraminiferal Assemblages from the Beysehir-Hoyran Nappes, Central Taurides (Southern Turkey)",Journal of Earth Science,,,,10.1007/s12583-022-1759-1,Cengiz OkuyucuU. Kagan TekinCagri GuzgunKaan Sayit,2024,https://link.springer.com/article/10.1007/s12583-022-1759-1,Article
"Hydrogeochemical evolution and contamination of groundwater in the Albertine Graben, Uganda",Environmental Earth Sciences,,,,10.1007/s12665-021-09587-6,Brian Emmanuel GumaAndrew MuwangaMichael Owor,2021,https://link.springer.com/article/10.1007/s12665-021-09587-6,Article
Surface State of Purolate Standard Activated Carbon after Sorption of Minerals,Coke and Chemistry,,,,10.3103/S1068364X24600684,E. S. MikhaylovaI. V. TimoshchukA. K. GorelkinaS. A. Semenova,2024,https://link.springer.com/article/10.3103/S1068364X24600684,Article
"Appraisal of fluoride contaminate in groundwater at an industrial area, Northwest Gulf of Suez, Egypt",Journal of Umm Al-Qura University for Applied Sciences,,,,10.1007/s43994-025-00221-w,Ahmed A. Asmoay,2025,https://link.springer.com/article/10.1007/s43994-025-00221-w,Article
"Hydrogeological, geophysical, geochemical and statistical integrated techniques to assess a multilayered groundwater aquifer system in an arid region: the case of the Sbeitla aquifers in Central Tunisia",Environmental Earth Sciences,,,,10.1007/s12665-023-11021-y,Mouez GouasmiaFerid DhahriHajer AzaiezMohamed Khalil ZidiMohamed Soussi,2023,https://link.springer.com/article/10.1007/s12665-023-11021-y,Article
Innovative Developments to Solve Major Aspects of Environmental and Radiation Safety of Ukraine,"Systems, Decision and Control in Energy II",,,,10.1007/978-3-030-69189-9_16,Yurii ZabulonovOleksandr PopovVolodymyr BurtniakAndrii IatsyshynValeriia KovachAnna Iatsyshyn,2021,https://link.springer.com/chapter/10.1007/978-3-030-69189-9_16,Chapter
Soil Pollution Source Identification in Southern Iran Using Geochemical Data as a Global Study Model,Doklady Earth Sciences,,,,10.1134/S1028334X23602559,S. AbbasiH. AmanipoorS. Battaleb-LooieS. PourmoradJ. Darvishi Khatoni,2024,https://link.springer.com/article/10.1134/S1028334X23602559,Article
Microbial remediation of oil-contaminated shorelines: a review,Environmental Science and Pollution Research,,,,10.1007/s11356-023-29151-y," Xiaoli DaiJing LvPengcheng FuShaohui Guo",2023,https://link.springer.com/article/10.1007/s11356-023-29151-y,Article
Geological Genesis of Alkaline Magnesium-Type Groundwater within the Ophiolitic Rocks Areas in Southwestern Turkey,Journal of Earth Science,,,,10.1007/s12583-022-1767-1,Selma Demer,2023,https://link.springer.com/article/10.1007/s12583-022-1767-1,Article
Volatile Organic Compounds and Carbonyls Pollution in Mexico City and an Urban Industrialized Area of Central Mexico,Aerosol and Air Quality Research,,,,10.4209/aaqr.210386,Elizabeth VegaOmar RamírezGabriela Sánchez-ReynaJudith C. ChowJohn G. WatsonDiego López-VeneroniMonica Jaimes-Palomera,2022,https://link.springer.com/article/10.4209/aaqr.210386,Article
Introduction,Deepwater Geohazards in the South China Sea,,,,10.1007/978-981-99-9692-6_1,Shiguo WuYunbao SunQingping LiJiliang WangDawei WangQiliang SunChuanxu ChenYangbing Xie,2024,https://link.springer.com/chapter/10.1007/978-981-99-9692-6_1,Chapter
"Metal budget and origin of aqueous brines depositing deep-seated Zn-Pb mineralization linked to hydrocarbon reservoirs, North German Basin",Mineralium Deposita,,,,10.1007/s00126-023-01173-z,Marta SośnickaVolker LüdersFlorian DuschlDennis KraemerOscar LaurentSamuel NiedermannDavid A. BanksFranziska WilkeCora Wohlgemuth-UeberwasserMichael Wiedenbeck,2023,https://link.springer.com/article/10.1007/s00126-023-01173-z,Article
"Early Cretaceous to Middle Eocene Magmatic Evolution of Eastern Pontides: Zircon U-Pb Ages and Hf Isotopes, and Geochemical and Sr-Nd Isotopic Constraints from Multiphase Granitoids, NE Turkey",Journal of Earth Science,,,,10.1007/s12583-022-1640-2,Abdullah SarSevcan KürümAhmet Feyzi Bingöl,2023,https://link.springer.com/article/10.1007/s12583-022-1640-2,Article
"Paleogene integrative stratigraphy, biotas, and paleogeographical evolution of the Qinghai-Tibetan Plateau and its surrounding areas",Science China Earth Sciences,,,,10.1007/s11430-023-1182-0,Jia LiuAi SongLin DingTao SuZhekun Zhou,2024,https://link.springer.com/article/10.1007/s11430-023-1182-0,Article
Nature and Occurrence of Hydrocarbons,Life Below Water,,,,10.1007/978-3-319-98536-7_26,Nuno PimentelRui Pena dos Reis,2022,https://link.springer.com/rwe/10.1007/978-3-319-98536-7_26,Reference work entry
Optimization of Gas Production from Hydrate-Bearing Sediments with Fluctuation Characteristics,Journal of Ocean University of China,,,,10.1007/s11802-024-5633-x,Yaobin LiTianfu XuXin XinHan YuYilong YuanHuixing Zhu,2024,https://link.springer.com/article/10.1007/s11802-024-5633-x,Article
"Brittleness evaluation method for shale gas reservoir based on acoustic P-wave and S-wave
testing of rock samples and its logging application",Applied Geophysics,,,,10.1007/s11770-022-1001-z,Dong WuZhong-Hao WangWang Lin,2023,https://link.springer.com/article/10.1007/s11770-022-1001-z,Article
Exploring the significance of different amendments to improve phytoremediation efficiency: focus on soil ecosystem services,Environmental Science and Pollution Research,,,,10.1007/s11356-024-35660-1,Papa Mamadou Sitor NdourJulien LangrandJoel FontaineAnissa Lounès-Hadj Sahraoui,2024,https://link.springer.com/article/10.1007/s11356-024-35660-1,Article
"Core Investigation of the International Continental Scientific Drilling Program from the Cretaceous Songliao Basin (SK-1/SK-2/SK-3), NE China",Field Trip Guidebook on Chinese Sedimentary Geology,,,,10.1007/978-981-99-6936-4_2,Yuan GaoYoufeng GaoDaniel E. Ibarra,2024,https://link.springer.com/chapter/10.1007/978-981-99-6936-4_2,Chapter
Prospects for the Use of Sulfur for the Modification of Road Bitumen and Production of Asphalt Concrete from Local Raw Materials with an Improved Set of Technical Properties,Inorganic Materials: Applied Research,,,,10.1134/S2075113323040093,O. N. BureninaV. E. KopylovA. V. AndreevaM. E. SavvinovaL. A. Nikolaeva,2023,https://link.springer.com/article/10.1134/S2075113323040093,Article
Feasibility of nitrate reduction combined with persulfate oxidation in the remediation of groundwater contaminated by gasoline,Hydrogeology Journal,,,,10.1007/s10040-021-02417-w,Huan WangYudao ChenLewei HeYaping JiangYuan XiaPengfei Yang,2021,https://link.springer.com/article/10.1007/s10040-021-02417-w,Article
"Microbial enhanced oil recovery: process perspectives, challenges, and advanced technologies for its efficient applications and feasibility",Archives of Microbiology,,,,10.1007/s00203-025-04307-1,Ankita DasNandita DasPrisha PandeyPiyush Pandey,2025,https://link.springer.com/article/10.1007/s00203-025-04307-1,Article
"Paving the way toward soil safety and health: current status, challenges, and potential solutions",Frontiers of Environmental Science & Engineering,,,,10.1007/s11783-024-1834-1,Chiheng ChuLizhong Zhu,2024,https://link.springer.com/article/10.1007/s11783-024-1834-1,Article
Greater India and the New Gondwana Geological Map (IGCP-628),Journal of the Geological Society of India,,,,10.1007/s12594-023-2330-0,Renata da Silva SchmittEvânia Alves da SilvaIgor Vasconcelos GomesMacarena Roca Benedek,2023,https://link.springer.com/article/10.1007/s12594-023-2330-0,Article
"Characters of Liptinites in Different Seams of Talcher Coalfield, Odisha, India",Journal of the Geological Society of India,,,,10.1007/s12594-022-1958-5,Rajesh BhattaNilima DashBibhuranjan Nayak,2022,https://link.springer.com/article/10.1007/s12594-022-1958-5,Article
Mass Spectrometry in Petroleum Chemistry (Petroleomics) (Review),Petroleum Chemistry,,,,10.1134/S0965544119100025,R. S. BorisovL. N. KulikovaV. G. Zaikin,2019,https://link.springer.com/article/10.1134/S0965544119100025,Article
"Geochemical characteristics and origin of Chang-9 crude oil of Triassic Yanchang Formation in Zhidan area, Ordos Basin, China",Arabian Journal of Geosciences,,,,10.1007/s12517-021-08685-w,Zhengyu WuShijia ChenChengshan LiJian YuYibo ChangZixing LuXin HeHaifeng ZhangHan Meimei,2021,https://link.springer.com/article/10.1007/s12517-021-08685-w,Article
Petrologic and Geochemical Characteristics of Shales,Sedimentation and Reservoirs of Marine Shale in South China,,,,10.1007/978-981-97-5361-1_4,Feng YangShang Xu,2024,https://link.springer.com/chapter/10.1007/978-981-97-5361-1_4,Chapter
"Preface for “Tropical Large Benthic Foraminifera: Adaption, Extinction, and Radiation”",Journal of Earth Science,,,,10.1007/s12583-021-1590-0,Claire E. ReymondPamela HallockHildegard Westphal,2022,https://link.springer.com/article/10.1007/s12583-021-1590-0,Article
Is Environmental Contamination a Concern in Global Technosols? A Bibliometric Analysis,"Water, Air, & Soil Pollution",,,,10.1007/s11270-023-06171-5,José de Souza Oliveira FilhoMarcos Gervasio Pereira,2023,https://link.springer.com/article/10.1007/s11270-023-06171-5,Article
"Evaluation of hydrocarbon occurrences of Hatay with integrated methods, SE Turkey",Geomechanics and Geophysics for Geo-Energy and Geo-Resources,,,,10.1007/s40948-021-00239-4,S. Orkun TurgayErgül Yaşar,2021,https://link.springer.com/article/10.1007/s40948-021-00239-4,Article
Surface-Active Properties of the Sea Surface Microlayerand Consequences for Pollution in the Mediterranean Sea,The Mediterranean Sea,,,,10.1007/b107150,Božena Ćosović,,https://link.springer.com/chapter/10.1007/b107150,Chapter
Triassic hydrothermal chimneys from the Ordos Basin of Northern China,Scientific Reports,,,,10.1038/s41598-021-02053-0,Jiyuan YouYiqun LiuDingwu ZhouYiyao Yang,2021,https://link.springer.com/article/10.1038/s41598-021-02053-0,Article
Paleo-environmental study of the Raniganj and Barakar Formations: Implications from the Geochemical and Geomechanical Aspects of Sandstone and Shale,Journal of the Geological Society of India,,,,10.1007/s12594-022-2204-x,Tabish RahmanKripamoy SarkarAnurag NiyogiAkash MahanandiaMd. Sakir Ahmad,2022,https://link.springer.com/article/10.1007/s12594-022-2204-x,Article
Deep low-salinity groundwater in sedimentary basins: petrophysical methods from a case study in Somalia,Hydrogeology Journal,,,,10.1007/s10040-022-02589-z,Elizabeth QuirogaClaudia BertoniFridtjov Ruden,2023,https://link.springer.com/article/10.1007/s10040-022-02589-z,Article
The Content and Speciation of Radionuclides in Water and Bottom Sediments of the Laptev Sea,Geochemistry International,,,,10.1134/S0016702923030060,T. A. GoryachenkovaA. V. TravkinaA. P. BorisovG. Y. SolovyovaI. E. KazinskayaA. N. LigaevA. P. Novikov,2023,https://link.springer.com/article/10.1134/S0016702923030060,Article
"Multi-Directional and Multiphase Tectonic Modification, and Hydrocarbon Differential Enrichment in the Middle-Upper Yangtze Region",Journal of Earth Science,,,,10.1007/s12583-022-1738-6,Zhiliang HeShuangjian LiYingqiang LiJian Gao,2022,https://link.springer.com/article/10.1007/s12583-022-1738-6,Article
Bacterial and archaeal diversity in oil fields and reservoirs and their potential role in hydrocarbon recovery and bioprospecting,Environmental Science and Pollution Research,,,,10.1007/s11356-020-11705-z,Nishi Kumari SinghSangeeta Choudhary,2021,https://link.springer.com/article/10.1007/s11356-020-11705-z,Article
"Quantitative evaluation of adsorbed and free water in deep shales: a case study on the Wufeng-Longmaxi Formations from the Luzhou area, southern Sichuan Basin, China",Frontiers of Earth Science,,,,10.1007/s11707-022-1056-4,Shengxian ZhaoYongyang LiuShuangfang LuShuaihu LiuWenbiao LiZhiyan ZhouYashuo WangZhaojing Song,2024,https://link.springer.com/article/10.1007/s11707-022-1056-4,Article
"Lithium-caesium-tantalum pegmatites in the Varuträsk area, Sweden: geological setting, timing, and source-transport-trap characteristics",Mineralium Deposita,,,,10.1007/s00126-025-01369-5,Joel B. H. AnderssonEdward P. LynchDiana SchildgerHeejin JeonMartiya SadeghiTobias E. Bauer,2025,https://link.springer.com/article/10.1007/s00126-025-01369-5,Article
Sources and evolution of sulfate in groundwater systems of northern Kuwait,Environmental Monitoring and Assessment,,,,10.1007/s10661-025-14311-z,Fawzia Al-RuwaihAmjad AliewiChidambaram SabarathinamHarish BhandaryTariq RashidAhmed AbdulhadiYogeesha JayaramuAdnan AkberShabbir Ahmad ShahidKhalid Hadi,2025,https://link.springer.com/article/10.1007/s10661-025-14311-z,Article
Geochemical Studies of the Pleistocene Sediments of the Edge Shelf Zone of the East Siberian Sea and Arctic Ocean,Geochemistry International,,,,10.1134/S0016702922100032,A. I. GresovA. V. YatsukK. I. AksentovV. V. SattarovaD. A. ShvalovN. V. Zarubina,2022,https://link.springer.com/article/10.1134/S0016702922100032,Article
"Geochemical characteristics of produced fluids from CBM wells and their indicative significance for gas accumulation in Daning-Jixian block, Ordos Basin",Frontiers of Earth Science,,,,10.1007/s11707-022-1063-5,Taotao YanChao YangShuai ZhengYadong BaiWei ChenYanfei LiuWenguang TianShasha SunShangwen JinJiahang WangZhenxing LiuHuifang Yao,2023,https://link.springer.com/article/10.1007/s11707-022-1063-5,Article
Velocity structure in the South Yellow Sea basin based on first-arrival tomography of wide-angle seismic data and its geological implications,Acta Oceanologica Sinica,,,,10.1007/s13131-022-2028-y,Weina ZhaoZhiqiang WuFanghui HouXunhua ZhangTianyao HaoHanjoon KimYanpeng ZhengShanshan ChenHuigang Wang,2023,https://link.springer.com/article/10.1007/s13131-022-2028-y,Article
"Depositional Environment, Diagenesis and Source Rock Characterization of Middle Jurassic Carbonates, North Waziristan, Khyber Pakhtunkhwa, Pakistan",Doklady Earth Sciences,,,,10.1134/S1028334X2460244X,Emad Ullah KhanMaryam SaleemSyed Muhammad Wasim SajjadSaif Ullah Khan,2024,https://link.springer.com/article/10.1134/S1028334X2460244X,Article
"Petrogenesis and Emplacement Age of the Gabbro-Diabase Sills Within the Mesoproterozoic Xiamaling Formation in Yanliao Faulted-Depression Zone, North China Craton",Meso-Neoproterozoic Geology and Petroleum Resources in China,,,,10.1007/978-981-19-5666-9_10,Li SuTieguan WangXianhua LiShuguang SongShuwen YangHongyu Zhang,2022,https://link.springer.com/chapter/10.1007/978-981-19-5666-9_10,Chapter
Considerations for Cultivating and Processing Botryococcus braunii,Microalgal Bioengineering,,,,10.1007/978-3-031-61253-4_2,Daniel R. Browne,2024,https://link.springer.com/chapter/10.1007/978-3-031-61253-4_2,Chapter
"Geo-environmental factors controlling groundwater hydrogeochemistry, salinization and quality in El Qaa plain coastal aquifer, Southwest Sinai, Egypt","Environment, Development and Sustainability",,,,10.1007/s10668-023-03830-9,Salman A. SalmanEsmat A. Abou El-AnwarSami K. AitaAhmed A. Elnazer,2023,https://link.springer.com/article/10.1007/s10668-023-03830-9,Article
Phytoremediation of Heavy Metals: Reaction Mechanisms and Selected Efficient Technologies of Heavy Metal Contamination,"Heavy Metal Toxicity: Environmental Concerns, Remediation and Opportunities",,,,10.1007/978-981-99-0397-9_12,Ahmed Haruna ShehuAbubakar Mohammad GumiNorli Ismail,2023,https://link.springer.com/chapter/10.1007/978-981-99-0397-9_12,Chapter
A numerical model for offshore Geological Carbon Storage (GCS) undergoing hydrate formation,Computational Geosciences,,,,10.1007/s10596-024-10311-z,Yufei WangEric FlauraudAnthony MichelVéronique LachetClémentine Meiller,2024,https://link.springer.com/article/10.1007/s10596-024-10311-z,Article
"Fine-grained rock fabric facies classification and its control on shale oil accumulation: a case study from the Paleogene Kong 2 Member, Bohai Bay Basin",Frontiers of Earth Science,,,,10.1007/s11707-020-0867-4,Wenzhong HanXianzheng ZhaoXiugang PuShiyue ChenHu WangYan LiuZhannan ShiWei ZhangJiapeng Wu,2021,https://link.springer.com/article/10.1007/s11707-020-0867-4,Article
"Occurrence State of Soluble Organic Matter in Shale Oil Reservoirs from the Upper Triassic Yanchang Formation in the Ordos Basin, China: Insights from Multipolarity Sequential Extraction",Natural Resources Research,,,,10.1007/s11053-021-09959-6,Shutong LiShixiang LiRuiliang GuoXinping ZhouYang WangJunlin ChenJiaqiang ZhangLewei HaoXiaofeng MaJunli Qiu,2021,https://link.springer.com/article/10.1007/s11053-021-09959-6,Article
Optical Kerogen Analysis,Advances in Petroleum Source Rock Characterizations: Integrated Methods and Case Studies,,,,10.1007/978-3-031-16396-8_5,Hartmut Jäger,2023,https://link.springer.com/chapter/10.1007/978-3-031-16396-8_5,Chapter
The majority of microorganisms in gas hydrate-bearing subseafloor sediments ferment macromolecules,Microbiome,,,,10.1186/s40168-023-01482-5,Chuwen ZhangYun-Xin FangXiuran YinHongfei LaiZenggui KuangTianxueyu ZhangXiang-Po XuGunter WegenerJiang-Hai WangXiyang Dong,2023,https://link.springer.com/article/10.1186/s40168-023-01482-5,Article
