Item Title,Publication Title,Book Series Title,Journal Volume,Journal Issue,Item DOI,Authors,Publication Year,URL,Content Type
Formation of carbonate laminae in shale and their impact on organic matter in Dongying depression,Scientific Reports,,,,10.1038/s41598-025-06582-w,Chuanming LiYong WuXuefeng DingXiankui XieTianxiang LuoJianwu ZhangYaping SunChuangtuo Xia,2025,https://link.springer.com/article/10.1038/s41598-025-06582-w,Article
Documenting the Geology of Volcanoes and Volcanic Terrains,Volcanology,,,,10.1007/978-3-319-66613-6_15,John V. WrightGuido GiordanoRay Cas,2024,https://link.springer.com/chapter/10.1007/978-3-319-66613-6_15,Chapter
Introduction,Unconventional Hydrocarbon Reservoirs: Coal and Shale,,,,10.1007/978-3-031-53484-3_1,Bodhisatwa HazraDebanjan ChandraVikram Vishal,2024,https://link.springer.com/chapter/10.1007/978-3-031-53484-3_1,Chapter
"Hydrothermal dolomitization in the Middle Permian in the Central Sichuan Basin, SW China: evidence from petrology, geochemistry, and fluid inclusions",Arabian Journal of Geosciences,,,,10.1007/s12517-020-06386-4,Lin QiYifan GuPuwei HeZhanlei WangYuqiang JiangShun LiYadong Zhou,2021,https://link.springer.com/article/10.1007/s12517-020-06386-4,Article
"Changes in Sediment Sources in the Southern Muddy Area of Weihai, China, Since the Late Pleistocene: A Record from Rare Earth Elements",Journal of Ocean University of China,,,,10.1007/s11802-024-5951-z,Zhichao ZhangJinqing LiuPing YinKe CaoXiaokun FengShengyu Wang,2024,https://link.springer.com/article/10.1007/s11802-024-5951-z,Article
"Pollution assessment and index properties of Okpulor soils, Rivers State, Nigeria: geochemical characterization, geotechnical and geoenvironmental implications",Discover Environment,,,,10.1007/s44274-024-00094-6,Nurudeen Onomhoale AhmedVictor Inumindun FagoriteAleke Godwin ChikwadoDolapo Moses ApataLuqman Jibril YunusaEmmanuel Samson ItivehZeenat Bisola Biliaminu,2024,https://link.springer.com/article/10.1007/s44274-024-00094-6,Article
"Geometry and 3D seismic characterisation of post-rift normal faults in the Pearl River Mouth Basin, northern South China Sea",Acta Oceanologica Sinica,,,,10.1007/s13131-024-2337-4,Yuanhang LiuJinwei GaoWanli ChenJiliang WangUmair Khan,2024,https://link.springer.com/article/10.1007/s13131-024-2337-4,Article
"Critical Metals Ga, Ge and In in the Global Pb-Zn Deposits: Current Understanding, Challenges and Perspectives",Journal of Earth Science,,,,10.1007/s12583-023-1909-0,Yi ZhengPeng-Peng YuZhan-Ke LiSuo-Fei XiongLing-Li ZhouJia-Xi ZhouChang-Ming WangYu-Miao MengYu ZhangYe-Jian WangJing XuYue WuLan-Xuan GuoTaiping Zhao,2023,https://link.springer.com/article/10.1007/s12583-023-1909-0,Article
Feldspar Geothermometer: A Novel Method Measuring Oilfield Fire-Flooding Temperature,Journal of Earth Science,,,,10.1007/s12583-023-2008-y,Fengliang LeiHaitao ShiMengyao GaoHan XuYonglei ZhangLiang Qiu,2023,https://link.springer.com/article/10.1007/s12583-023-2008-y,Article
"Reservoir Forming Conditions and Models of Oil Sands in Northwestern Margin of Junggar Basin, China",Journal of Earth Science,,,,10.1007/s12583-022-1751-9,Xiaoping MaXinguo ZhuangYunlong HeJibin ZhouMeng WangBaoqing LiZhenlong DaiXudong FanHaihuai Sun,2025,https://link.springer.com/article/10.1007/s12583-022-1751-9,Article
Molecular dynamics simulation: The key to reveal the enrichment mechanisms of helium,Science China Earth Sciences,,,,10.1007/s11430-024-1495-y,Wenhui Liu,2025,https://link.springer.com/article/10.1007/s11430-024-1495-y,Article
"Correlation Analysis of the Trace Element Composition of Naphthides: Method, Results, and Interpretation","Izvestiya, Atmospheric and Oceanic Physics",,,,10.1134/S0001433822130084,M. V. RodkinS. A. Punanova,2022,https://link.springer.com/article/10.1134/S0001433822130084,Article
"Carbon Isotope Stratigraphy of the Uppermost Aptian–Lower Cenomanian Strata from the Lut Block, East Iran",Journal of Earth Science,,,,10.1007/s12583-023-1911-4,Javad SharifiSeyed Naser RaisossadatMaryam Mortazavi MehriziMaryam Motamedalshariati,2023,https://link.springer.com/article/10.1007/s12583-023-1911-4,Article
"Provenance, tectonic setting and paleoenvironment of the Tura Sandstone Formation, Northeast India: An integrated approach",Acta Geochimica,,,,10.1007/s11631-025-00812-8,Pradip BorgohainDevojit BezbaruahYadav Krishna GogoiAnurag BharadwajBishal SinghGarima KonwarDipankar SaikiaMondip SarmaBubul Bharali,2025,https://link.springer.com/article/10.1007/s11631-025-00812-8,Article
Petroleum as source and carrier of metals in epigenetic sediment-hosted mineralization,Scientific Reports,,,,10.1038/s41598-019-44770-7,Nicolas J. SaintilanJorge E. SpangenbergMassimo ChiaradiaCyril Chelle-MichouMichael B. StephensLluís Fontboté,2019,https://link.springer.com/article/10.1038/s41598-019-44770-7,Article
"Southwest Boundary of Yangtze and Cathaysia Blocks: Constraints from the Luojiashan Gabbro in Yingyangguan Region, Northeastern Guangxi",Journal of Earth Science,,,,10.1007/s12583-022-1754-6,Ya QinZuohai FengJiaming ZhuYonggao HuangJie WuYun ZhouYunfeng XueChunzeng Wang,2024,https://link.springer.com/article/10.1007/s12583-022-1754-6,Article
Geochemistry and Petrogenesis of Volcanic Rocks from the Continent-Ocean Transition Zone in Northern South China Sea and Their Tectonic Implications,Journal of Ocean University of China,,,,10.1007/s11802-020-4231-9,Yue XuYaoming YangHongjun YuWei GaoXiangxing GaoBaohua LiuXu TianJichao YangWenquan Zhang,2020,https://link.springer.com/article/10.1007/s11802-020-4231-9,Article
Diversity and biogenesis contribution of sulfate-reducing bacteria in arsenic-contaminated soils from realgar deposits,Environmental Science and Pollution Research,,,,10.1007/s11356-022-18595-3,Xianbin ZhuLiyuan ChenHongzhong PanLei WangXun ZhangDan Wang,2022,https://link.springer.com/article/10.1007/s11356-022-18595-3,Article
Cold War and Earth Sciences,Handbook of the Historiography of the Earth and Environmental Sciences,,,,10.1007/978-3-030-92679-3_25-1,Ronald E. Doel,2024,https://link.springer.com/rwe/10.1007/978-3-030-92679-3_25-1,Living reference work entry
"Hydrocarbon source rocks in Kazhdumi and Pabdeh formations—a quick outlook in Gachsaran oilfield, SW Iran",Journal of Petroleum Exploration and Production Technology,,,,10.1007/s13202-021-01413-w,Majid Safaei-FaroujiMohammadreza KamaliMohammad Hail Hakimi,2021,https://link.springer.com/article/10.1007/s13202-021-01413-w,Article
"Quantitative Estimation on Methane Storage Capacity of Organic-Rich Shales from the Lower Silurian Longmaxi Formation in the Eastern Sichuan Basin, China",Journal of Earth Science,,,,10.1007/s12583-020-1394-7,Xiaowen GuoTao LuoTian DongRui YangYuanjia HanJizheng YiSheng HeZhiguo ShuHanyong Bao,2023,https://link.springer.com/article/10.1007/s12583-020-1394-7,Article
Composition and Properties of Petroleum,"Hydrocarbons, Oils and Lipids: Diversity, Origin, Chemistry and Fate",,,,10.1007/978-3-319-90569-3_13,R. Paul Philp,2020,https://link.springer.com/rwe/10.1007/978-3-319-90569-3_13,Reference work entry
Oil and gas exploration in Seferihisar Uplift (Western Turkey) containing an operable-size gold deposit: Geochemical evidence for the presence of a working petroleum system,Geomechanics and Geophysics for Geo-Energy and Geo-Resources,,,,10.1007/s40948-020-00152-2,Adil OzdemirAtilla KarataşYildiray PalabiyikErgül YaşarAlperen Sahinoglu,2020,https://link.springer.com/article/10.1007/s40948-020-00152-2,Article
Structural Geometry and Tectonic Evolution of the Gulf of Suez and Red Sea: Insights from Outcrop and Seismic Data,Seismotectonics of the East Mediterranean-Red Sea region,,,,10.1007/978-3-031-80928-6_8,Ahmad Mostafa,2025,https://link.springer.com/chapter/10.1007/978-3-031-80928-6_8,Chapter
A Toarcian Ocean Anoxic Event record from an open-ocean setting in the eastern Tethys: Implications for global climatic change and regional environmental perturbation,Science China Earth Sciences,,,,10.1007/s11430-020-9753-1,Xiugen FuJian WangHuaguo WenChunyan SongZhongwei WangShengqiang ZengXinglei FengHengye Wei,2021,https://link.springer.com/article/10.1007/s11430-020-9753-1,Article
Sources of Micro and Nano Plastic Hydrocarbon Pollutants in Marine Bodies and Their Treatment,Environmental Hydrocarbon Pollution and Zero Waste Approach Towards a Sustainable Waste Management,,,,10.1007/978-3-031-81615-4_3,Suprada SwainM. Purnima SudhaSudeshna DeyYugantika BaduSubhadra Rani BhoiMaha Awjan AlreshidiMaytham T. QasimHarjeet NathDeo Karan RamAlok Prasad Das,2025,https://link.springer.com/chapter/10.1007/978-3-031-81615-4_3,Chapter
"Compositional Analysis of Heavy Petroleum Distillates by Comprehensive Two-dimensional Gas Chromatography, Field Ionization and High-resolution Mass Spectrometry",Journal of The American Society for Mass Spectrometry,,,,10.1007/s13361-019-02349-6,Kuangnan QianFrank C. Wang,2019,https://link.springer.com/article/10.1007/s13361-019-02349-6,Article
"Detrital Zircon of Devonian Sandstones in Changning-Menglian Suture Zone, Yunnan, SW China: Implications for the Early Evolution of Paleo-Tethys",Journal of Earth Science,,,,10.1007/s12583-021-1470-7,Zhengqin GanQinglai FengYuehua WeiGuichun LiuXiaomei NieTianyu Zhao,2024,https://link.springer.com/article/10.1007/s12583-021-1470-7,Article
"Organic Geochemistry, Petrography, Depositional Environment and Hydrocarbon Potential of the Eocene Coal Deposits of west Daranggiri Coalfield, Meghalaya",Journal of the Geological Society of India,,,,10.1007/s12594-020-1389-0,Mousumi GogoiT. Satish KumarSarat Phukan,2020,https://link.springer.com/article/10.1007/s12594-020-1389-0,Article
"First Results of U–Th/He Dating of Epigenetic Pyrite from Rocks of the Bazhenov Formation, Western Siberia",Doklady Earth Sciences,,,,10.1134/S1028334X23601797,O. V. YakubovichN. A. VasilyevaK. Yu. VasilyevaM. O. AnosovaA. B. KotovM. M. PodolskayaB. M. Gorokhovskiy,2023,https://link.springer.com/article/10.1134/S1028334X23601797,Article
Level of thermal maturity estimation in unconventional reservoirs using interval inversion and simulating annealing method,Acta Geophysica,,,,10.1007/s11600-024-01413-4,Rafael Valadez VergaraNorbert Péter Szabó,2024,https://link.springer.com/article/10.1007/s11600-024-01413-4,Article
Submarine volcanism in the southern margin of the South China Sea,Journal of Oceanology and Limnology,,,,10.1007/s00343-022-2088-z,Chenglong ZhangShaohong XiaChaoyan FanJinghe Cao,2023,https://link.springer.com/article/10.1007/s00343-022-2088-z,Article
Composition and Properties of Petroleum,"Hydrocarbons, Oils and Lipids: Diversity, Origin, Chemistry and Fate",,,,10.1007/978-3-319-54529-5_13-1,R. Paul Philp,2020,https://link.springer.com/rwe/10.1007/978-3-319-54529-5_13-1,Living reference work entry
Low-Temperature Cracking of Heavy Oil on the Developed Surface of Carbonate Minerals,Chemistry and Technology of Fuels and Oils,,,,10.1007/s10553-025-01866-3,S. M. Petrov,2025,https://link.springer.com/article/10.1007/s10553-025-01866-3,Article
Rethinking Geopolitics: Climate Security in the Anthropocene (2014),Simon Dalby: A Pioneer in International Relations,,,,10.1007/978-3-031-83379-3_10,Simon Dalby,2025,https://link.springer.com/chapter/10.1007/978-3-031-83379-3_10,Chapter
Paleosalinity Reconstruction for the Paleocene Sequence of Lishui Sag in the East China Sea Shelf Basin,Arabian Journal for Science and Engineering,,,,10.1007/s13369-022-06696-7,Long SunJinliang ZhangTianya ZhangXue YanTao ChenJinshui Liu,2022,https://link.springer.com/article/10.1007/s13369-022-06696-7,Article
A Practical Recipe to Reconstruct Fluid Composition from Limited Sample or Data,"Recent Research on Sedimentology, Stratigraphy, Paleontology, Tectonics, Geochemistry, Volcanology and Petroleum Geology",,,,10.1007/978-3-031-43222-4_41,Abhijit Dandekar,2023,https://link.springer.com/chapter/10.1007/978-3-031-43222-4_41,Conference paper
"Genetic relationship between formation, accumulation and migration and dispersion of peat materials in Paleogene–Take the Qiongdongnan Basin as an example",Acta Oceanologica Sinica,,,,10.1007/s13131-024-2334-7,Xiaojing LiZengxue LiDongdong WangGuangzeng SongPingli WangHaiyan Liu,2024,https://link.springer.com/article/10.1007/s13131-024-2334-7,Article
Developments and Evolution of CCUS Technologies: A Review,Carbon Capture Utilization and Storage,,,,10.1007/978-3-031-81272-9_3,Cristina F. A. RodriguesHaline RochaColombo TasinariM. J. Lemos de Sousa,2025,https://link.springer.com/chapter/10.1007/978-3-031-81272-9_3,Chapter
Scale avoidance during waterflooding by optimized effluent mixing,Arabian Journal of Geosciences,,,,10.1007/s12517-023-11495-x,Peter BirkleYunjiao FuAnaam H. Al-ShaikhAliShouwen Shen,2023,https://link.springer.com/article/10.1007/s12517-023-11495-x,Article
The Intertemporal Analysis of Jamaica’s Energy Landscape in the Industrial Age,Energia Progresiva,,,,10.1007/978-3-031-68846-1_5,Randy Rajiv Koon Koon,2024,https://link.springer.com/chapter/10.1007/978-3-031-68846-1_5,Chapter
Orogenic Gold Deposits in Egypt,Gold Deposits in Egypt,,,,10.1007/978-3-031-75972-7_8,Amr Abdelnasser,2025,https://link.springer.com/chapter/10.1007/978-3-031-75972-7_8,Chapter
"Multi-Scale Pore Structure Heterogeneity in Tuff Reservoirs Investigated with Multi-Experimental Method and Fractal Dimensions in Chang 7 Formation, Southern Ordos Basin",Journal of Earth Science,,,,10.1007/s12583-023-1857-8,Hao LuQing LiDali YueDongdong XiaShenghe WuLang WenYu He,2024,https://link.springer.com/article/10.1007/s12583-023-1857-8,Article
Oilfield chemical-formation interaction and the effects on petrophysical properties: a review,Arabian Journal of Geosciences,,,,10.1007/s12517-022-10469-9,Ebikapaye PeretomodeGbenga OluyemiNadimul Haque Faisal,2022,https://link.springer.com/article/10.1007/s12517-022-10469-9,Article
Petroleum: Physical Types and Properties,Encyclopedia of Petroleum Geoscience,,,,10.1007/978-3-319-02330-4_53-1,Jonathan Craig,2020,https://link.springer.com/rwe/10.1007/978-3-319-02330-4_53-1,Living reference work entry
"Diagenetic heterogeneities in the Jurassic Samana Suk Formation, Foreland Sedimentary Fold and Thrust Belt, Pakistan: an integrated approach for reservoir behavior",Carbonates and Evaporites,,,,10.1007/s13146-025-01106-z,Waqar AhmadMumtaz Ali KhanMuhammad Raiees AmjadMohammad ZafarMercè CorbellaDídac Navarro-CiuranaHamad ur Rahim,2025,https://link.springer.com/article/10.1007/s13146-025-01106-z,Article
"Characteristics, Types, and Prospects of Geological Sweet Sections in Giant Continental Shale Oil Provinces in China",Journal of Earth Science,,,,10.1007/s12583-022-1735-9,Zhi YangCaineng ZouSongtao WuSongqi PanXiaoni WangHaitao LiuWenqi JiangJiarui LiQiyan LiXiaobing NiuGuohui LiZhenxing TangXuguang GuoDong HuangQizhao Wei,2022,https://link.springer.com/article/10.1007/s12583-022-1735-9,Article
History and Outlook of Evaluation on Global Oil and Gas Resources,Global Oil and Gas Resources: Potential and Distribution,,,,10.1007/978-981-97-4756-6_1,Lirong DouZhixin WenZhaoming Wang,2024,https://link.springer.com/chapter/10.1007/978-981-97-4756-6_1,Chapter
"First Discovery of Late Triassic Tuffs in the South Qilian Basin: Geochemical Characteristics, Zircon LA-ICP-MS U-Pb Ages and Potential Source Regions",Journal of Earth Science,,,,10.1007/s12583-021-1446-7,Fangpeng DuFurong TanShiming LiuXiaochen ZhaoYingtao ChenJunwei Qiao,2023,https://link.springer.com/article/10.1007/s12583-021-1446-7,Article
What are the Limiting Environmental Factors for the Evolution of Early Eukaryotic Diversity?,Journal of Earth Science,,,,10.1007/s12583-023-1876-5,Shuichang ZhangXiaomei WangHuajian WangQing TangFenglian ZhangDan Lü,2023,https://link.springer.com/article/10.1007/s12583-023-1876-5,Article
"Sequence stratigraphic analysis of superimposed coal measure gas-bearing system in Daning-Jixian block, eastern margin of Ordos Basin, China",Frontiers of Earth Science,,,,10.1007/s11707-024-1098-x,Shizhuang YangSong LiWenguang TianGuanghao ZhongJunjian Wang,2024,https://link.springer.com/article/10.1007/s11707-024-1098-x,Article
"Major Step for Phosphate Exploration in the Jerid Area, Southwest Tunisia: Reconstitution of the Paleocene-Eocene Series Geometry via Borehole Data and Seismic Reflection Profiles","Mining, Metallurgy & Exploration",,,,10.1007/s42461-021-00463-2,Rihab Guellala,2021,https://link.springer.com/article/10.1007/s42461-021-00463-2,Article
Nujiang Canyon ophiolites (eastern Tibetan Plateau): Records of early Jurassic subduction initiation at passive continental margin of the Lhasa block?,Science China Earth Sciences,,,,10.1007/s11430-024-1482-8,Qing QianBaolu SunFeiyu Dong,2025,https://link.springer.com/article/10.1007/s11430-024-1482-8,Article
"The Geochemistry of the Mineral Waters and Hydrogenic Sediments of the Antonovsky Hydrosulfuric Mineral Spring, Sakhalin Island",Russian Journal of Pacific Geology,,,,10.1134/S1819714020060020,G. A. ChelnokovI. V. BraginN. A. KharitonovaK. Yu. BushkarevaV. Yu. LavrushinR. V. ZharkovB. I. ChelnokovaA. A. Karabtsov,2020,https://link.springer.com/article/10.1134/S1819714020060020,Article
Geochemical characteristics and genesis of the elements in ferromanganese nodules from the Northwest Pacific,Acta Oceanologica Sinica,,,,10.1007/s13131-024-2449-x,Jingjing GaoJihua LiuShijuan YanLianhua HeXiangwen RenQuanshu Yan,2025,https://link.springer.com/article/10.1007/s13131-024-2449-x,Article
Dark Biosphere,Encyclopedia of Astrobiology,,,,10.1007/978-3-662-65093-6_5548,C. Escudero,2023,https://link.springer.com/rwe/10.1007/978-3-662-65093-6_5548,Reference work entry
"Hydrocarbon seeps from the unconventional petroleum system of the South Portuguese Zone, Portugal",Journal of Iberian Geology,,,,10.1007/s41513-019-00115-x,Gabriel A. BarberesAndré L. D. SpigolonRui Pena dos ReisAlbert PermanyerMaria Teresa Barata,2019,https://link.springer.com/article/10.1007/s41513-019-00115-x,Article
Characteristics and Sources of Organic Matter from the Early Cambrian Niutitang Formtion and Its Preservation Environment in Guizhou,Journal of Earth Science,,,,10.1007/s12583-020-1371-1,Hong WeiQinglai FengJianxin YuShan Chang,2022,https://link.springer.com/article/10.1007/s12583-020-1371-1,Article
Multi-stage evolution of the Ordos Basin: Its coupled basin-mountain systems and energy resource,Science China Earth Sciences,,,,10.1007/s11430-025-1627-1,Yiwen JuWei WangZhanli RenZhi YangKeyu LiuBing HouLei Xiao,2025,https://link.springer.com/article/10.1007/s11430-025-1627-1,Article
"Methane hydrate systems off South Makassar Basin, Indonesia",Geoscience Letters,,,,10.1186/s40562-025-00374-w,Feisal DirgantaraSusilohadi SusilohadiMohammad Andri Syahrir IskandarYudha Arisandhy Sintuwardhana,2025,https://link.springer.com/article/10.1186/s40562-025-00374-w,Article
Postsedimentary Transformations of Silurian Carbonate Rocks on the Central Part of the Chernyshev Ridge (Timan–Pechora Province),Lithology and Mineral Resources,,,,10.1134/S0024490223700293,I. I. DanshikovaT. V. Maydl,2023,https://link.springer.com/article/10.1134/S0024490223700293,Article
"Trace and rare earth element geochemistry of organic-rich sediments in the lacustrine Rukwa rift basin, Tanzania: implications for paleoproductivity, paleosalinity, and redox conditions",Arabian Journal of Geosciences,,,,10.1007/s12517-021-07690-3,Januarius Matata BishangaJin Qiang,2021,https://link.springer.com/article/10.1007/s12517-021-07690-3,Article
Spatio-temporal variability of potentially toxic elements’ pollution in road-deposited sediments according to health risk thresholds: a meta-analysis,Environmental Geochemistry and Health,,,,10.1007/s10653-024-02038-8,Nicole Gê Freire Dantas AroucaLucio Flavio Ferreira MoreiraEdgar Perin MoraesJosé Anderson do Nascimento Batista,2024,https://link.springer.com/article/10.1007/s10653-024-02038-8,Article
Exploration of Mineral Resources,Geology and Mineral Resources,,,,10.1007/978-981-96-0598-9_10,R. K. Upadhyay,2025,https://link.springer.com/chapter/10.1007/978-981-96-0598-9_10,Chapter
"Petroleum geochemical characterization of the shales from tertiary formation of Western Cambay Basin, India",International Journal of Earth Sciences,,,,10.1007/s00531-020-01855-3,Vaishali SharmaAnirbid Sircar,2020,https://link.springer.com/article/10.1007/s00531-020-01855-3,Article
"Mineralogy and geochemistry of clastic sediments of the Terani Formation, Cauvery Basin, southern India: implications for paleoweathering, provenance and tectonic setting",Geosciences Journal,,,,10.1007/s12303-019-0047-2,Jayagopal MadhavarajuSubin Prakash RajendraYong Il LeeErik Ramirez MontoyaSooriamuthu RamasamyRufino Lozano SantaCruz,2020,https://link.springer.com/article/10.1007/s12303-019-0047-2,Article
Gas hydrate accumulation associated with fluid escape structure in the western margin of South China Sea,Journal of Oceanology and Limnology,,,,10.1007/s00343-022-1338-4,Taotao YangLin LiYintao LuKaiqi YuZhili YangXuefeng WangWei Li,2023,https://link.springer.com/article/10.1007/s00343-022-1338-4,Article
"Hydrochemical modeling of groundwater quality from Sinai, eastern and western deserts, Egypt",Modeling Earth Systems and Environment,,,,10.1007/s40808-022-01448-w,Esmat A. Abou El-AnwarSalman A. Salman,2022,https://link.springer.com/article/10.1007/s40808-022-01448-w,Article
Geothermal Potential Regions of India,Geothermal Fields of India,,,,10.1007/978-3-031-53364-8_1,Kriti YadavAnirbid SircarManan Shah,2024,https://link.springer.com/chapter/10.1007/978-3-031-53364-8_1,Chapter
"Origin mechanism of overpressure in saline lacustrine formation of the Paleogene and Neogene in the Western Qaidam Basin, NW China",Carbonates and Evaporites,,,,10.1007/s13146-023-00912-7,Chenglin LiuTaozheng YangPei LiDehao FengHongliang Huo,2024,https://link.springer.com/article/10.1007/s13146-023-00912-7,Article
"Multiple fracture, dissolution, and cementation events of Ordovician carbonate reservoirs in T-SH Oilfield, Tarim Basin",Arabian Journal of Geosciences,,,,10.1007/s12517-022-09833-6,Teng ZhaoRui ZhaoChongyang XiaoJun HanAnpeng KuangYingtao Li,2022,https://link.springer.com/article/10.1007/s12517-022-09833-6,Article
"Source rock characteristics of organic-rich shales in the Late Jurassic Lam Member and their contribution to oil and gas generation potentials in Al-Jawf exploration region, NW Yemen",Arabian Journal of Geosciences,,,,10.1007/s12517-021-08658-z,Mohammed Hail HakimiNor Syazwani Zainal AbidinAli KahalAdeeb AhmedHussain Al FaifiSaleh Qaysi,2021,https://link.springer.com/article/10.1007/s12517-021-08658-z,Article
Reservoir property estimation of interbedded sandstone and shale layers using segmented 3D rock-physics templates,Applied Geophysics,,,,10.1007/s11770-025-1263-3,Jing BaXi-Ya BaHong-Jing DongJun-Wei ChengCong LuoZhi-Fang YangMeng-Qiang PangWen-Hui Tan,2025,https://link.springer.com/article/10.1007/s11770-025-1263-3,Article
Cable Bacteria and Their Biotechnological Application,,,,,10.1007/10_2025_284,Judith Stiefelmaier,2025,https://link.springer.com/chapter/10.1007/10_2025_284,Chapter
Organic Matter in the Ocean: Indicators of Biogeochemical Processes,Oceanology,,,,10.1134/S0001437023070159,E. A. RomankevichA. A. VetrovA. S. Ulyantsev,2023,https://link.springer.com/article/10.1134/S0001437023070159,Article
"Effects of silicate rock weathering and agricultural cultivation on carbon sequestration in saline soils: an example from the saline soils of Bayannur, Northwest China",Biogeochemistry,,,,10.1007/s10533-025-01236-5,Qian ZhouShengyin ZhangShuncun ZhangTao WangZhaoyun DingYanfang ZhouCuicui Su,2025,https://link.springer.com/article/10.1007/s10533-025-01236-5,Article
"Biomarker Hydrocarbons in Autochthonous and Migrated Bitumens in the Precambrian of Ust’-Mayskaya-366 Well, Siberian Platform",Geochemistry International,,,,10.1134/S001670292470068X,I. D. Timoshina,2024,https://link.springer.com/article/10.1134/S001670292470068X,Article
Distribution of Pre-salt Carbon Dioxide and Controlling Factors of Structural Styles in Offshore Brazil,Proceedings of the International Field Exploration and Development Conference 2022,,,,10.1007/978-981-99-1964-2_110,Xiao-fa YangZuo-ji TianYa-ming LiuYong-bin ZhaoYu-bing ZhouZhong-zhen MaDan-dan Wang,2023,https://link.springer.com/chapter/10.1007/978-981-99-1964-2_110,Conference paper
"Hydrocarbons composition of sea bottom sediments (Balaklava Bay, Black Sea)",International Journal of Environmental Science and Technology,,,,10.1007/s13762-022-04167-y,O. V. SolovevaE. A. TikhonovaK. I. GurovE. A. Kotelyanets,2022,https://link.springer.com/article/10.1007/s13762-022-04167-y,Article
Application of Fourier transform ion cyclotron resonance mass spectrometry in molecular characterization of dissolved organic matter,Science China Earth Sciences,,,,10.1007/s11430-021-9954-0,Chen HeDing HeChunmao ChenQuan Shi,2022,https://link.springer.com/article/10.1007/s11430-021-9954-0,Article
Genesis of Deep Abiogenic Hydrocarbon Systems,Chemistry and Technology of Fuels and Oils,,,,10.1007/s10553-024-01704-y,M. A. Lur’e,2024,https://link.springer.com/article/10.1007/s10553-024-01704-y,Article
A review of carbonates as hydrocarbon source rocks: basic geochemistry and oil–gas generation,Petroleum Science,,,,10.1007/s12182-019-0343-5,Liu-Wen XiaJian CaoMing WangJu-Lei MiTing-Ting Wang,2019,https://link.springer.com/article/10.1007/s12182-019-0343-5,Article
"Carboniferous integrative stratigraphy, biotas, and paleogeographical evolution of the Qinghai-Tibetan Plateau and its surrounding areas",Science China Earth Sciences,,,,10.1007/s11430-023-1150-0,Keyi HuXiangdong WangWenqi WangYingfan SongXunyan YeLu LiYukun ShiSunrong YangYing Li,2024,https://link.springer.com/article/10.1007/s11430-023-1150-0,Article
