Item Title,Publication Title,Book Series Title,Journal Volume,Journal Issue,Item DOI,Authors,Publication Year,URL,Content Type
"Untargeted metabolic profiling of <i>Zygophyllum Coccineum</i> plant near the Red Sea for phytochemical investigation by GC-MS, LC-MS, and NMR",Journal of Saudi Chemical Society,,,,10.1007/s44442-025-00003-3,Upendra SinghHanan AlmahasheerAbdul Hamid EmwasMariusz Jaremko,2025,https://link.springer.com/article/10.1007/s44442-025-00003-3,Article
Effects of different fermentation methods on the quality of wines made from <i>Actinidia argute</i>,European Food Research and Technology,,,,10.1007/s00217-024-04471-6,Jinli WenYining SunYiping YanPengqiang YuanYanli HeBowei SunZihao ZhaoWenpeng Lu,2024,https://link.springer.com/article/10.1007/s00217-024-04471-6,Article
"Defining a core breath profile for healthy, non-human primates",Scientific Reports,,,,10.1038/s41598-024-64910-y,Carly A. BobakKeisean A. J. M. StevensonNing SunMohammad S. KhanJannatul AzmirMarco BeccariaJaime A. TomkoDaniel FillmoreCharles A. ScangaPhilana L. LinJoAnne L. FlynnJane E. Hill,2024,https://link.springer.com/article/10.1038/s41598-024-64910-y,Article
Quality characterization of tobacco flavor and tobacco leaf position identification based on homemade electronic nose,Scientific Reports,,,,10.1038/s41598-024-70180-5,Hao LiQiuling WangLu HanZhifei ChenGenfa WangQingfu WangShengtao MaBin AiGaolei Xi,2024,https://link.springer.com/article/10.1038/s41598-024-70180-5,Article
Nontarget screening analysis of organic compounds in river sediments: a case study in the Taipu River of the Yangtze River Delta Region in China,Environmental Science and Pollution Research,,,,10.1007/s11356-024-32761-9,Yu MaChao YangQinglu YaoFeipeng LiLingchen MaoXuefei ZhouXiangzhou MengLing Chen,2024,https://link.springer.com/article/10.1007/s11356-024-32761-9,Article
"Pottery apprenticeship and knowledge in Bronze Age Iberia: the case of the Peñalosa archaeological site (Jaén, Spain)",Archaeological and Anthropological Sciences,,,,10.1007/s12520-023-01892-4,Eva Alarcón GarcíaAlberto Dorado AlejosJuan Jesús Padilla FernándezAlejandra García GarcíaLuis Arboledas MartínezLaura Vico TrigueroFrancisco Contreras Cortés,2024,https://link.springer.com/article/10.1007/s12520-023-01892-4,Article
In-Mouth Wine Aroma Analysis,Wine Analysis and Testing Techniques,,,,10.1007/978-1-0716-3650-3_10,María Pérez-JiménezCarolina Muñoz GonzálezMaría Ángeles Pozo-Bayón,2024,https://link.springer.com/chapter/10.1007/978-1-0716-3650-3_10,Chapter
Two-dimensional molybdenum carbide 2D-Mo<sub>2</sub>C as a superior catalyst for CO<sub>2</sub> hydrogenation,Nature Communications,,,,10.1038/s41467-021-25784-0,Hui ZhouZixuan ChenEvgenia KountoupiAthanasia TsoukalouPaula M. AbdalaPierre FlorianAlexey FedorovChristoph R. Müller,2021,https://link.springer.com/article/10.1038/s41467-021-25784-0,Article
The Advanced Technology and Clinical Application in Metabolomics,Clinical Metabolomics Applications in Genetic Diseases,,,,10.1007/978-981-99-5162-8_1,Anas M. Abdel Rahman,2023,https://link.springer.com/chapter/10.1007/978-981-99-5162-8_1,Chapter
"A review of food contamination with nitrated and oxygenated polycyclic aromatic hydrocarbons: toxicity, analysis, occurrence, and risk assessment",Food Science and Biotechnology,,,,10.1007/s10068-024-01653-6,Jihun JeongGeehyeon KimJoon-Goo Lee,2024,https://link.springer.com/article/10.1007/s10068-024-01653-6,Article
Exposure to two-dimensional ultrathin Ti<sub>3</sub>C<sub>2</sub> (MXene) nanosheets during early pregnancy impairs neurodevelopment of offspring in mice,Journal of Nanobiotechnology,,,,10.1186/s12951-022-01313-z,Yixian WenLe HuJian LiYanqing GengYang YangJing WangXuemei ChenLiliang YuHongyu TangTingli HanYongxiu YangXueqing Liu,2022,https://link.springer.com/article/10.1186/s12951-022-01313-z,Article
Analysis of multiclass organic pollutant in municipal landfill leachate by dispersive liquid-liquid microextraction and comprehensive two-dimensional gas chromatography coupled with mass spectrometry,Environmental Science and Pollution Research,,,,10.1007/s11356-019-07064-z,Mihail Simion Beldean-GaleaJerôme VialDidier ThiébautMaria-Virginia Coman,2020,https://link.springer.com/article/10.1007/s11356-019-07064-z,Article
Significance of the high-pressure properties and structural evolution of gas hydrates for inferring the interior of icy bodies,Progress in Earth and Planetary Science,,,,10.1186/s40645-023-00534-6,Hisako HiraiHirokazu Kadobayashi,2023,https://link.springer.com/article/10.1186/s40645-023-00534-6,Article
Early Warning and Identification of Transformer Defects Based on Jensen-Shannon Divergence and Dynamical Network Marker,The Proceedings of the 19th Annual Conference of China Electrotechnical Society,,,,10.1007/978-981-96-4787-3_54,Jienong ZhuangRongyan ShangRuiming FangSijia ZengChangqing Peng,2025,https://link.springer.com/chapter/10.1007/978-981-96-4787-3_54,Conference paper
Emerging advances in biosensor technologies for quorum sensing signal molecules,Analytical and Bioanalytical Chemistry,,,,10.1007/s00216-024-05659-1,Xi ChenChen WangQing Yin ZhengWen-Chao HuXing-Hua Xia,2024,https://link.springer.com/article/10.1007/s00216-024-05659-1,Article
Recent Advances in the Detection of Sulfur Compounds in Crude Oil and Petroleum Products,Journal of Analytical Chemistry,,,,10.1134/S1061934824702058,J. E. StarkovaR. S. BorisovA. Yu. Kanateva,2024,https://link.springer.com/article/10.1134/S1061934824702058,Article
Elucidation of the Human Cerebrospinal Fluid Metabolome by Ion Mobility Mass Spectrometry and NMR Spectroscopy,Cerebrospinal Fluid (CSF) Proteomics,,,,10.1007/978-1-0716-4462-1_17,Jannik SprengelGeorgy BerezhnoyChristoph Trautwein,2025,https://link.springer.com/chapter/10.1007/978-1-0716-4462-1_17,Protocol
Fabrication of two-dimensional metal–organic framework nanosheets/PDA composites as mixed-mode stationary phase for chromatographic separation,Microchimica Acta,,,,10.1007/s00604-021-05023-5,Tiantian SiXiaofeng LuHaixia ZhangXiaojing LiangShuai WangYong Guo,2021,https://link.springer.com/article/10.1007/s00604-021-05023-5,Article
Dimensional evolution of charge mobility and porosity in covalent organic frameworks,Nature Communications,,,,10.1038/s41467-025-57436-y,Shuai FuXiao LiGuanzhao WenYunyu GuoMatthew A. AddicoatMischa BonnEnquan JinKlaus MüllenHai I. Wang,2025,https://link.springer.com/article/10.1038/s41467-025-57436-y,Article
Catalytic production of low-carbon footprint sustainable natural gas,Nature Communications,,,,10.1038/s41467-021-27919-9,Xiaoqin SiRui LuZhitong ZhaoXiaofeng YangFeng WangHuifang JiangXiaolin LuoAiqin WangZhaochi FengJie XuFang Lu,2022,https://link.springer.com/article/10.1038/s41467-021-27919-9,Article
Evaluation of normalization strategies for GC-based metabolomics,Metabolomics,,,,10.1007/s11306-023-02086-8,Seo Lin NamRyland T. GiebelhausKieran S. Tarazona CarrilloA. Paulina de la MataJames J. Harynuk,2024,https://link.springer.com/article/10.1007/s11306-023-02086-8,Article
Cocamidopropyl betaine — a potential source of nitrogen-containing disinfection by-products in pool water,Environmental Science and Pollution Research,,,,10.1007/s11356-023-31315-9,Nikolay V. Ul’yanovskiiIlya S. VarsegovSergey A. SypalovDmitrii M. MazurDmitry S. KosyakovAlbert T. Lebedev,2023,https://link.springer.com/article/10.1007/s11356-023-31315-9,Article
Fungal Proteomics,Textbook of Fungal Zoonoses and Sapronoses,,,,10.1007/978-981-97-3214-2_5,Asmita SarowgiManisha GhoshRupinder Kaur,2024,https://link.springer.com/chapter/10.1007/978-981-97-3214-2_5,Chapter
Scopes of Bioanalytical Chromatography–Mass Spectrometry,Journal of Analytical Chemistry,,,,10.1134/S106193482108013X,E. I. Savelieva,2021,https://link.springer.com/article/10.1134/S106193482108013X,Article
Secondary Metabolites Identification Techniques of the Current Era,Plant Specialized Metabolites,,,,10.1007/978-3-031-51158-5_31,Mihir HalderAnirban KunduSumita Jha,2025,https://link.springer.com/rwe/10.1007/978-3-031-51158-5_31,Reference work entry
Traceability and discrimination of opium poppy shell analogues using HS-GC-IMS combined with machine learning algorithms,Analytical and Bioanalytical Chemistry,,,,10.1007/s00216-025-05909-w,Yinghua QiJunchao MaMingyuan LeiHongbin GuoXuebo LiYuhao SongWenhui LuXinhua LvNianfeng Sun,2025,https://link.springer.com/article/10.1007/s00216-025-05909-w,Article
"Identification of hexahydrocannabinol (HHC), dihydro-<i>iso</i>-tetrahydrocannabinol (dihydro-<i>iso</i>-THC) and hexahydrocannabiphorol (HHCP) in electronic cigarette cartridge products",Forensic Toxicology,,,,10.1007/s11419-023-00667-9,Rie TanakaRuri Kikura-Hanajiri,2023,https://link.springer.com/article/10.1007/s11419-023-00667-9,Article
Multiferous Analytical Applications of Zeolites,Ion Exchange Processes for Water and Environment Management,,,,10.1007/978-981-96-3989-2_15,Abhinay ThakurElyor BerdimurodovAmita SomyaAbdelkader ZarroukOmar DagdagAshish Kumar,2025,https://link.springer.com/chapter/10.1007/978-981-96-3989-2_15,Chapter
A process monitoring microreactor assembly for real-time reaction analysis using inline near-infrared spectroscopy and chemometrics,Analytical and Bioanalytical Chemistry,,,,10.1007/s00216-025-05779-2,Lukas MahlerPascal DeselMarcel SladkovAndreas RoppertzChristian MayerMartin Jaeger,2025,https://link.springer.com/article/10.1007/s00216-025-05779-2,Article
Comprehensive analysis of phenylpropanoids and butylidenephthalides in <i>Angelica sinensis</i> (Oliv.) Diels from different regions and processing methods by high-performance liquid chromatography combined with chemometrics,European Food Research and Technology,,,,10.1007/s00217-023-04422-7,Yan SunJing ZhouYuxin HuSihan ChenHui NiRuihong FengZijia ZhangMin LeiJinjun HouHuali LongWanying WuDe-an Guo,2024,https://link.springer.com/article/10.1007/s00217-023-04422-7,Article
High-throughput HPLC–SERS capable of generating a spectrum from individual eluent droplets based on a superhydrophobic SERS array,Analytical Sciences,,,,10.1007/s44211-025-00761-5,Umi YamaguchiHiroaki HondaShusuke KumagaiHiroyuki Takei,2025,https://link.springer.com/article/10.1007/s44211-025-00761-5,Article
"Polycyclic Aromatic Hydrocarbons (PAHs) in Olive Pomace Oil: Occurrence, Analytical Determination, and Mitigation Strategies",Food Analytical Methods,,,,10.1007/s12161-024-02630-9,Laura BarpSabrina Moret,2024,https://link.springer.com/article/10.1007/s12161-024-02630-9,Article
Preparation and Structural Analysis of Lipoteichoic Acid on Cell Membranes Derived from Lactic Acid Bacteria,Lactic Acid Bacteria,,,,10.1007/978-1-0716-4096-8_4,Tsukasa ShiraishiShin-ichi Yokota,2024,https://link.springer.com/chapter/10.1007/978-1-0716-4096-8_4,Protocol
Instruments and Techniques in Forensic Science,Textbook of Forensic Science,,,,10.1007/978-981-99-1377-0_5,Annapoorni AmmalVijay Kumar YadavKriti NigamAnkit Srivastava,2023,https://link.springer.com/chapter/10.1007/978-981-99-1377-0_5,Chapter
Application of Proteomics Technology Based on LC-MS Combined with Western Blotting and Co-IP in Antiviral Innate Immunity,Antiviral Innate Immunity,,,,10.1007/978-1-0716-4108-8_11,Weizheng LiangZhenpeng ZhuChunfu Zheng,2025,https://link.springer.com/chapter/10.1007/978-1-0716-4108-8_11,Protocol
Poly(ionic liquid)-hybridized silica aerogel for solid-phase microextraction of polycyclic aromatic hydrocarbons prior to gas chromatography-flame ionization detection,Microchimica Acta,,,,10.1007/s00604-021-04730-3,Min SunJuanjuan FengSen HanXiangping JiChunying LiJiaqing FengHaili SunJing Fan,2021,https://link.springer.com/article/10.1007/s00604-021-04730-3,Article
"Determination of benzene, toluene, ethylbenzene, and p-xylene with headspace-hollow fiber solid-phase microextraction-gas chromatography in wastewater and Buxus leaves, employing a chemometric approach",Chemical Papers,,,,10.1007/s11696-021-01663-2,Shahram Vaziri DozeinMahboubeh MasrourniaZarrin Es’haghiMohammad Reza Bozorgmehr,2021,https://link.springer.com/article/10.1007/s11696-021-01663-2,Article
Effects of steroid-resistant nephrotic syndrome serum on AA pathway in podocytes cultured in 3D in vitro glomerular model,Scientific Reports,,,,10.1038/s41598-025-95216-2,Gaia BianchiLinda BellucciWilliam MorelloStefano TuroloGiulia CricrìFederico CaicciChiara TamburelloStefania VillaDaniele PratiGiovanni MontiniFederica Collino,2025,https://link.springer.com/article/10.1038/s41598-025-95216-2,Article
The Use of Ion Mobility Separation as an Additional Dimension for the Screening of Organic Micropollutants in Environmental Samples,Screening of Pollutants in the Environment,,,,10.1007/698_2023_1055,Alberto Celma,2023,https://link.springer.com/chapter/10.1007/698_2023_1055,Chapter
Advanced analysis of oligomeric proanthocyanidins: latest approaches in liquid chromatography and mass spectrometry based analysis,Phytochemistry Reviews,,,,10.1007/s11101-021-09764-2,Nico SymmaAndreas Hensel,2021,https://link.springer.com/article/10.1007/s11101-021-09764-2,Article
A Сomparative Analysis of Oils from Carbonate Sediments of the Upper Usolskaya Subformation and the Vendian–Cambrian Pay Horizons in the Central Part of the Nepsko-Botuobinskaya Anteclise,Moscow University Geology Bulletin,,,,10.3103/S0145875223060066,I. V. EgorovM. A. BolshakovaO. V. Krylov,2023,https://link.springer.com/article/10.3103/S0145875223060066,Article
"Investigation on the Detoxification of Indoxyl Sulfate (IS) and Indole-3-Acetic Acid (IAA) Protein-Bound Uremic Toxins (PBUTs) Using <i>Trametes versicolor</i> Biocompatible Laccase: In Situ Synchrotron Imaging, Experimental and Computational Studies",Applied Biochemistry and Biotechnology,,,,10.1007/s12010-025-05235-y,Sana DaneshamouzShaghayegh SaadatiSishi ZhuDenis KaluginAhmed ShokerAmira Abdelrasoul,2025,https://link.springer.com/article/10.1007/s12010-025-05235-y,Article
Plasma-Enabled Liquefaction of Cellulose and Lignin as Lignocellulosic Biomass Model Compounds,Proceedings of the 5th International Symposium on Plasma and Energy Conversion,,,,10.1007/978-981-97-2245-7_18,Qing ChenJingyi MaShiyun LiuMeiling CaiDanhua MeiZhi Fang,2024,https://link.springer.com/chapter/10.1007/978-981-97-2245-7_18,Conference paper
Biogas Quality Monitoring and Indication System,Opportunities and Risks in AI for Business Development,,,,10.1007/978-3-031-65207-3_38,Kunal DeepakReetu Jain,2025,https://link.springer.com/chapter/10.1007/978-3-031-65207-3_38,Chapter
Cascadic degradation of selected polyolefin grades in a simulated closed-loop recycling process,Clean Technologies and Environmental Policy,,,,10.1007/s10098-024-02818-x,Mohamad Hassan AkhrasJohanna LangwieserSandra CzakerAlexander Felgel-FarnholzJoerg Fischer,2024,https://link.springer.com/article/10.1007/s10098-024-02818-x,Article
Interfacial self-organization of large-area mixed-dimensional polyamide membranes for rapid aqueous nanofiltration,Nature Water,,,,10.1038/s44221-024-00348-w,Si-Hua LiuWenxiong ShiWei-Song HungLe ShiBai XueJingguo SheZiping SongXiaolong LuStephen GrayKueir-Rarn LeeChunrui Wu,2024,https://link.springer.com/article/10.1038/s44221-024-00348-w,Article
A novel online two-dimensional supercritical fluid chromatography/reversed phase liquid chromatography–mass spectrometry method for lipid profiling,Analytical and Bioanalytical Chemistry,,,,10.1007/s00216-019-02242-x,Li YangHonggang NieFan ZhaoShiyao SongYing MengYu BaiHuwei Liu,2020,https://link.springer.com/article/10.1007/s00216-019-02242-x,Article
Bridging the Gap: Leveraging Student Engagement in Conservation Science,The Future of Heritage Science and Technologies,,,,10.1007/978-3-031-87068-2_5,Kate SeymourHaedeun KimCaroline BouvierArleta KazikaDanitsa DavisDaan van ZutphenMelania JaniakFrancesca DiederenLara Sofia MausGiuditta Perversi,2025,https://link.springer.com/chapter/10.1007/978-3-031-87068-2_5,Conference paper
Determination of 15 human pharmaceutical residues in fish and shrimp tissues by high-performance liquid chromatography-tandem mass spectrometry,Environmental Monitoring and Assessment,,,,10.1007/s10661-022-09993-8,Reza PashaeiReda DzingelevičienėSajjad AbbasiMałgorzata Szultka-MłyńskaBoguslaw Buszewski,2022,https://link.springer.com/article/10.1007/s10661-022-09993-8,Article
"A review on occurrences, challenges and detection methods of pesticides: recent treatment technologies",International Journal of Environmental Science and Technology,,,,10.1007/s13762-025-06640-w,E. A. López-MaldonadoA. E. D. MahmoudF. AlfarraE. Can-GüvenM. N. CinerS. Y. GuvencM. MansourG. VarankH. K. OzcanF. GhanbariS. YusanN. A. Khan,2025,https://link.springer.com/article/10.1007/s13762-025-06640-w,Article
Antimicrobial potential of <i>Hippocratea Indica</i> Willd. Acetone Leaf fractions against <i>Salmonella Typhi</i>: an in vitro and in silico study,Scientific Reports,,,,10.1038/s41598-024-75796-1,Akinyomade Oladipo OwolabiOghenerobor Benjamin AkporJames Ajigasokoa NdakoStephen Oluwagbemiga OwaAbimbola Peter OluyoriEmmanuel Olorunleke OludipeSamson Olusegun AfolabiRotdelmwa Maimako Asaleye,2024,https://link.springer.com/article/10.1038/s41598-024-75796-1,Article
Deciphering Biofilm Formation in Veterinary Pathogens: Unveiling Insights Through Proteomics Analysis,Biofilm Associated Livestock Diseases and their Management,,,,10.1007/978-981-96-1885-9_19,Anati Abd Rashid SyaidaMohd Taufiq Mat JalilMohd Shafiq AazmiMohd Izwan Mohamad YusofFaez Firdaus Abdullah JesseMohd Fakharul Zaman Raja Yahya,2025,https://link.springer.com/chapter/10.1007/978-981-96-1885-9_19,Chapter
Research of 2D-COS with metabolomics modifications through deep learning for traceability of wine,Scientific Reports,,,,10.1038/s41598-024-63280-9,Zhuo-Kang WangNa TaHai-Cheng WeiJin-Hang WangJing ZhaoMin Li,2024,https://link.springer.com/article/10.1038/s41598-024-63280-9,Article
Computational and GC-MS screening of bioactive compounds from <i>Thymus Vulgaris</i> targeting <i>mycolactone</i> protein associated with Buruli ulcer,Scientific Reports,,,,10.1038/s41598-024-83908-0,Muhammad NaveedImran AliTariq AzizAyesha SaleemZeerwah RajpootSameera KhaleelAyaz Ali KhanMitub Al-harbiThamer H. Albekairi,2025,https://link.springer.com/article/10.1038/s41598-024-83908-0,Article
Recent advances in ethanol gas sensors based on metal oxide semiconductor heterojunctions,Rare Metals,,,,10.1007/s12598-021-01937-4,Ling-Yun GaiRun-Ping LaiXian-Hui DongXing WuQiao-Tong LuanJue WangHao-Feng LinWen-Hao DingGuang-Lei WuWan-Feng Xie,2022,https://link.springer.com/article/10.1007/s12598-021-01937-4,Article
"Purification, Functional Characterization, and Atomic Structure Determination of Microbial Proteins",Industrial Microbiology and Biotechnology,,,,10.1007/978-981-97-6270-5_11,Poushali MitraKaushiki TiwariSaloni GargPrince Tiwari,2024,https://link.springer.com/chapter/10.1007/978-981-97-6270-5_11,Chapter
Achieving gas pressure-dependent luminescence from an AIEgen-based metal-organic framework,Nature Communications,,,,10.1038/s41467-022-29737-z,Zhijia LiFeilong JiangMuxin YuShengchang LiLian ChenMaochun Hong,2022,https://link.springer.com/article/10.1038/s41467-022-29737-z,Article
Ethylene Adsorption Study by Using Various MOFs in the CMC Film for Application in Postharvest of Fruit,Journal of The Institution of Engineers (India): Series E,,,,10.1007/s40034-024-00287-x,Tontrakarn PongpaiSasina KerdsiriTanwawan Duangthongyou,2024,https://link.springer.com/article/10.1007/s40034-024-00287-x,Article
Unveiling the Bioactive Potential of Bacterial Isolates from Extreme Environments of Pakistan by In Vitro and In Silico Approaches,Current Microbiology,,,,10.1007/s00284-024-03861-z,Rimsha DilshadNazia JamilAyesha NaseemRida Batool,2024,https://link.springer.com/article/10.1007/s00284-024-03861-z,Article
The Corrosion Performance and Post-corrosion Wear Mechanisms of Fully Formulated Lubricants Introduced Varying Hydrogen,Tribology Letters,,,,10.1007/s11249-025-01982-5,Xinbo WangLili JinHao ZhangRuifeng XuYansong LiuOleksandr StelmakhBaigang Sun,2025,https://link.springer.com/article/10.1007/s11249-025-01982-5,Article
Development of a classification model for extra virgin olive oil adulteration based on squalene and phytosterol profiles,Journal of Food Measurement and Characterization,,,,10.1007/s11694-025-03491-4,Quan JingXin-Yi HuangJin ShaoHui-Yuan LuWei-Jian ShenDong PeiDuo-Long DiJun Hai,2025,https://link.springer.com/article/10.1007/s11694-025-03491-4,Article
Analysis of aged microplastics: a review,Environmental Chemistry Letters,,,,10.1007/s10311-024-01731-5,Yanqi ShiLinping ShiHexinyue HuangKefu YeLuming YangZeena WangYifan SunDunzhu LiYunhong ShiLiwen XiaoShixiang Gao,2024,https://link.springer.com/article/10.1007/s10311-024-01731-5,Article
Passive Adsorbers Based on Carbon Materials and Their Comparison for Estimating the Oil and Gas Potentials of Rocks,Journal of Analytical Chemistry,,,,10.1134/S1061934821090082,A. V. PirogovE. S. MarkovaV. Yu. Anan’ev,2021,https://link.springer.com/article/10.1134/S1061934821090082,Article
2D-Layered Nanomaterials’ Modified Electrodes for the Detection of Environmental Contaminants,Nanomaterial-Modified Electrodes,,,,10.1007/978-3-031-67176-0_14,Santhosh Bullapura MattB. N. VeerabhadraswamyManjunatha Shivanna,2024,https://link.springer.com/chapter/10.1007/978-3-031-67176-0_14,Chapter
Polymer Analysis for Effective Assessment of Microplastic Pollution in Urban Water Bodies,Microplastics Pollution Control in Water Systems,,,,10.1007/978-3-031-74399-3_7,Shital ThackerEdwin PithawalaMahesh VasavaHardik Shah,2025,https://link.springer.com/chapter/10.1007/978-3-031-74399-3_7,Chapter
"Chromatography analysis, in light of vitro antioxidant, antidiabetic, antiobesity, anti-inflammatory, antimicrobial, anticancer, and three-dimensional cancer spheroids’ formation blocking activities of <i>Laurus nobilis</i> aromatic oil from Palestine",Chemical and Biological Technologies in Agriculture,,,,10.1186/s40538-023-00396-6,Nidal JaradatMurad AbualhasanMohammed HawashMohammad QadiNawaf Al-MaharikSamer AbdallahAhmed MousaAbdelrazaq ZarourMohammad ArarShorooq SobuhFatima HusseinLinda IssaAdan JaberHaya HamduniSarit Alshahatit,2023,https://link.springer.com/article/10.1186/s40538-023-00396-6,Article
GC × GC-HRMS with complementary ionization methods in the suspect screening analysis of fragrance allergens: overwhelming or justified?,Analytical and Bioanalytical Chemistry,,,,10.1007/s00216-024-05436-0,Dmitrii M. MazurVyacheslav B. ArtaevAlbert T. Lebedev,2024,https://link.springer.com/article/10.1007/s00216-024-05436-0,Article
Light-Activated Virtual Sensor Array with Machine Learning for Non-Invasive Diagnosis of Coronary Heart Disease,Nano-Micro Letters,,,,10.1007/s40820-024-01481-7,Jiawang HuHao QianSanyang HanPing ZhangYuan Lu,2024,https://link.springer.com/article/10.1007/s40820-024-01481-7,Article
Changes in the Volatome of Cancer Patients,Volatile Organic Compounds,,,,10.1007/978-3-031-83406-6_2,Francesco SegradoAndrea RomanoRosaria Orlandi,2025,https://link.springer.com/chapter/10.1007/978-3-031-83406-6_2,Chapter
Study on plasma metabolomics profiling of depression in Chinese community-dwelling older adults based on untargeted LC/GC‒MS,Scientific Reports,,,,10.1038/s41598-024-60836-7,Jiangling GuoPeipei HanYaqing ZhengYahui WuKai ZhengChuanjun HuangYue WangCheng ChenYiqiong QiXiaoyu ChenQiongying TaoJiayi ZhaiQi Guo,2024,https://link.springer.com/article/10.1038/s41598-024-60836-7,Article
Utilization of Green Chemistry Nano-Emulsion in Remediation of Real Contaminated Coastal Sediments by HOCs and Pb to Protect Shallow Aquifer,Sustainable Groundwater and Environment: Challenges and Solutions,,,,10.1007/978-3-031-82194-3_12,Moustafa Gamal SnousyMohamed Bakry MasodAhmed M. RashadEsam El-SayedAshraf R. AbouelmagdAbeer El ShahawyMahmoud F. ZawrahJianhua Wu,2025,https://link.springer.com/chapter/10.1007/978-3-031-82194-3_12,Chapter
"Breath biomarkers for esophageal cancer: identification, quantification, and diagnostic modeling",Analytical Sciences,,,,10.1007/s44211-025-00769-x,Yuke RenFei WangZiyi ZhuRaojun LuoGuojun LvHaibin Cui,2025,https://link.springer.com/article/10.1007/s44211-025-00769-x,Article
Effect of Gliding Arc Plasma Reforming of Methane on Large-Bore Low-Speed Two-Stroke Marine Engine,Proceedings of the 5th International Symposium on Plasma and Energy Conversion,,,,10.1007/978-981-97-2245-7_17,Yezeng FanZhan GaoZhuohang LiChao WangLei ZhuZhen Huang,2024,https://link.springer.com/chapter/10.1007/978-981-97-2245-7_17,Conference paper
Amino acid gas phase circular dichroism and implications for the origin of biomolecular asymmetry,Nature Communications,,,,10.1038/s41467-022-28184-0,Cornelia MeinertAdrien D. GarciaJérémie TopinNykola C. JonesMira DiekmannRobert BergerLaurent NahonSøren V. HoffmannUwe J. Meierhenrich,2022,https://link.springer.com/article/10.1038/s41467-022-28184-0,Article
Systematic Approach in Modeling the Biochemical Resistance Exhibited by&#xa0;the Plants Under Stress Conditions,Plant Holobiome Engineering for Climate-Smart Agriculture,,,,10.1007/978-981-99-9388-8_28,Hafiza Zaineb AmirYashfa TanveerSumairaAsia ZulqurnainHumaira Yasmin,2024,https://link.springer.com/chapter/10.1007/978-981-99-9388-8_28,Chapter
"Assessment of gas dispersion near an operating landfill treated by different intermediate covers with soil alone, low-density polyethylene (LLDPE), or ethylene vinyl alcohol (EVOH) geomembrane",Environmental Science and Pollution Research,,,,10.1007/s11356-022-22794-3,Yuan FengJongwan EunSunah MoonYunwoo Nam,2022,https://link.springer.com/article/10.1007/s11356-022-22794-3,Article
