Item Title,Publication Title,Book Series Title,Journal Volume,Journal Issue,Item DOI,Authors,Publication Year,URL,Content Type
Construction and application of covalently bonded CD147 cell membrane chromatography model based on polystyrene microspheres,Analytical and Bioanalytical Chemistry,,,,10.1007/s00216-023-04528-7,Yanni LvSaisai WangYamin WangXin ZhangQianqian JiaShengli HanLangchong He,2023,https://link.springer.com/article/10.1007/s00216-023-04528-7,Article
Chemical servoing with hexapod robot for gas source localization and YOLO-based visual defect detection,International Journal of Intelligent Robotics and Applications,,,,10.1007/s41315-025-00464-0,Guillaume Morin-DuponchelleAhmed Nait ChabaneBenoit Zerr,2025,https://link.springer.com/article/10.1007/s41315-025-00464-0,Article
Anti-candidal directed isolation of kaempferol from <i>Euphorbia hirta</i> against multidrug-resistant <i>Candida albicans</i>: a high-performance thin-layer chromatography-based approach,JPC – Journal of Planar Chromatography – Modern TLC,,,,10.1007/s00764-025-00363-x,Smija Kakkuth PuthenvitilPalani Perumal,2025,https://link.springer.com/article/10.1007/s00764-025-00363-x,Article
Development of a high-performance thin-layer chromatography method for the rapid quantification of S-equol in biological samples of albino Wistar rats,JPC – Journal of Planar Chromatography – Modern TLC,,,,10.1007/s00764-024-00287-y,Megha GangwarJalaluddin KhanMohammad Sarwar AlamBibhu Prasad PandaAdil Ahamad,2024,https://link.springer.com/article/10.1007/s00764-024-00287-y,Article
First Step on the Way to Identify Dermatophytes Using Odour Fingerprints,Mycopathologia,,,,10.1007/s11046-024-00905-7,Lenka MachováMeriem GaidaJaroslav SemerádMiroslav KolaříkMichaela ŠvarcováAndrej JašicaAlena GrasserováSandra Awokunle HolláVit HubkaPierre-Hugues StefanutoTomáš CajthamlJean-François FocantAdéla Wennrich,2025,https://link.springer.com/article/10.1007/s11046-024-00905-7,Article
Acidity-driven gas-particle partitioning of nitrate regulates its transport to Arctic through the industrial era,Nature Communications,,,,10.1038/s41467-025-59208-0,Yoshinori IizukaMai MatsumotoKaoru KawakamiMahiro SasageSakiko IshinoShohei HattoriRyu UemuraHitoshi MatsuiKoji FujitaNaga OshimaAndrea SpolaorAnders SvenssonBo Møllesøe VintherHiroshi OhnoOsamu SekiSumito Matoba,2025,https://link.springer.com/article/10.1038/s41467-025-59208-0,Article
Thin Layer Chromatography in Phytochemical Analysis,Handbook of Bioanalytics,,,,10.1007/978-3-030-63957-0_24-1,Monika Waksmundzka-HajnosMirosław HawryłAnna HawryłGrzegorz Jóżwiak,2022,https://link.springer.com/rwe/10.1007/978-3-030-63957-0_24-1,Living reference work entry
Thin Layer Chromatography in Phytochemical Analysis,Handbook of Bioanalytics,,,,10.1007/978-3-030-95660-8_24,Monika Waksmundzka-HajnosMirosław HawryłAnna HawryłGrzegorz Jóżwiak,2022,https://link.springer.com/rwe/10.1007/978-3-030-95660-8_24,Reference work entry
Surface frustrated Lewis pairs in titanium nitride enable gas phase heterogeneous CO<sub>2</sub> photocatalysis,Nature Communications,,,,10.1038/s41467-024-54951-2,Yunjie ZouChengliang MaoMingkai XuChao XingRuizhao WangGeoffrey A. OzinLan Ling,2024,https://link.springer.com/article/10.1038/s41467-024-54951-2,Article
Thin-layer chromatography coupled with mass spectrometry for identification of degradants for phycocyanin,JPC – Journal of Planar Chromatography – Modern TLC,,,,10.1007/s00764-024-00317-9,Minal R. GhanteNeha B. BhawareVasundhara SawantRohan ThosarSupriya G. JagtapVidhya K. Bhusari,2024,https://link.springer.com/article/10.1007/s00764-024-00317-9,Article
One-step preparation of flexible rGO/ZnO gas sensors for ppm-level H<sub>2</sub>S detection,Journal of Materials Science: Materials in Electronics,,,,10.1007/s10854-024-13597-y,Zhigang TaoBinchao WangHongxia BianXiaofeng LuoMengyao GuoYanjun CuiLi FengPeng Tu,2024,https://link.springer.com/article/10.1007/s10854-024-13597-y,Article
Phase transition of GvpU regulates gas vesicle clustering in bacteria,Nature Microbiology,,,,10.1038/s41564-024-01648-3,Zongru LiQionghua ShenEmery T. UsherAndrew P. AndersonManuel IburgRichard LinBrandon ZimmerMatthew D. MeyerAlex S. HolehouseLingchong YouAshutosh ChilkotiYifan DaiGeorge J. Lu,2024,https://link.springer.com/article/10.1038/s41564-024-01648-3,Article
"Intermediate and semi-volatility organic compounds (I/SVOCs) emission from Chinese vehicles: volatility distribution, influencing factors, and implication for SOA formation",Frontiers of Environmental Science & Engineering,,,,10.1007/s11783-025-1990-y,Yajun WuPeiji LiuYajie WangXiaoguo WangJing ZhangYan LiuJinsheng ZhangLin WuTing WangHongjun MaoJianfei Peng,2025,https://link.springer.com/article/10.1007/s11783-025-1990-y,Article
Gas Chromatography Coupled to Atmospheric Pressure Chemical Ionization High-Resolution Mass Spectrometry for Metabolite Fingerprinting of Grape (Vitis vinifera L) Berry,Plant Metabolic Engineering,,,,10.1007/978-1-0716-1822-6_8,Johana S. RevelArmando Alcázar MagañaJeffrey MorréLaurent DelucClaudia S. Maier,2022,https://link.springer.com/chapter/10.1007/978-1-0716-1822-6_8,Protocol
Metabolomics of Chinese Hamster Ovary Cells,Heterologous Protein Production in CHO Cells,,,,10.1007/978-1-0716-4104-0_14,Rita SinghSneh BajpaiAmardeep SinghPhulwanti SharmaYashwant KumarNiraj Kumar,2025,https://link.springer.com/chapter/10.1007/978-1-0716-4104-0_14,Protocol
Phase-transformable metal-organic polyhedra for membrane processing and switchable gas separation,Nature Communications,,,,10.1038/s41467-024-53560-3,Po-Chun HanChia-Hui ChuangShang-Wei LinXiangmei XiangZaoming WangMako KuzumotoShun TokudaTomoki TateishiAlexandre LegrandMin Ying TsangHsiao-Ching YangKevin C.-W. WuKenji UrayamaDun-Yen KangShuhei Furukawa,2024,https://link.springer.com/article/10.1038/s41467-024-53560-3,Article
Gas Chromatography–Mass Spectrometry and Laser Desporption Study of Substances on Surfaces of Steel after Contact with Liquid Products of Tire Pyrolysis,Russian Journal of Physical Chemistry A,,,,10.1134/S0036024421120190,A. Yu. SholokhovaS. A. BorovikovaA. K. Buryak,2021,https://link.springer.com/article/10.1134/S0036024421120190,Article
Functionalized Carbon Nanostructures for Gas Sensing Applications,Handbook of Functionalized Carbon Nanostructures,,,,10.1007/978-3-031-14955-9_55-1,Ana Paula de Oliveira Lopes InacioEliézer Quadro OresteDaiane Dias,2023,https://link.springer.com/rwe/10.1007/978-3-031-14955-9_55-1,Living reference work entry
CO<sub>2</sub>-Enhanced Tar-Rich Coal Pyrolysis to Produce High-Quality Oil and CO-Rich Gas,Journal of Thermal Science,,,,10.1007/s11630-025-2149-7,Duoer YangBang XuJihong SunXiaoyan BaiFei DaiMaohong Fan,2025,https://link.springer.com/article/10.1007/s11630-025-2149-7,Article
Identification of acetylcholinesterase inhibitory metabolites from hydroalcoholic extract of <i>Itrifal Muqawwi Dimagh</i> using thin-layer chromatography‒bioautography‒mass spectroscopy and its validation using <i>in silico</i> molecular approach,JPC – Journal of Planar Chromatography – Modern TLC,,,,10.1007/s00764-024-00302-2,Monalisha SamalAslam SiddiquiVarsha SrivastavaMohammad Irfan DarMuzayyana KhanAreeba InsafShahid Hussain AnsariSayeed Ahmad,2024,https://link.springer.com/article/10.1007/s00764-024-00302-2,Article
Sensory characterization and identification of odorants in birch wood (<i>Betula pendula</i> Roth),Wood Science and Technology,,,,10.1007/s00226-024-01575-w,Qifan WangAdina BaumLinda SchreinerBenedikt SlavikAndrea BuettnerHelene M. Loos,2024,https://link.springer.com/article/10.1007/s00226-024-01575-w,Article
"A review of experimental approaches, trends and opportunities in plasma-based gas conversion research",Frontiers of Chemical Science and Engineering,,,,10.1007/s11705-025-2567-9,Sirui LiPranav ArunHuub van den BogaardThijs van RaakChangjun LiuFausto Gallucci,2025,https://link.springer.com/article/10.1007/s11705-025-2567-9,Article
Applications of Semiconducting Metal Oxide Gas Sensors,Semiconducting Metal Oxides for Gas Sensing,,,,10.1007/978-981-99-2621-3_10,Yonghui Deng,2023,https://link.springer.com/chapter/10.1007/978-981-99-2621-3_10,Chapter
3D velocity field reconstruction of gas-liquid two-phase flow based on space-time multi-scale binocular-PIV technology,Optoelectronics Letters,,,,10.1007/s11801-022-2007-8,Hongyi WangGongcheng DouHao ZhangXinjun ZhuLimei Song,2022,https://link.springer.com/article/10.1007/s11801-022-2007-8,Article
Two-dimensional mineral hydrogel-derived single atoms-anchored heterostructures for ultrastable hydrogen evolution,Nature Communications,,,,10.1038/s41467-022-33725-8,Fucong LyuShanshan ZengZhe JiaFei-Xiang MaLigang SunLizi ChengJie PanYan BaoZhengyi MaoYu BuYang Yang LiJian Lu,2022,https://link.springer.com/article/10.1038/s41467-022-33725-8,Article
A Two-Dimensional NiMoO<sub>4</sub> Nanowire Electrode for the Sensitive Determination of Hydroquinone in Four Types of Actual Water Samples,Journal of Analysis and Testing,,,,10.1007/s41664-022-00236-w,Li-Wei BaiYu-Fen ShiXue ZhangXue-Bo LiuFeng WuChang LiuJian-Feng JiaWen-Bo Lu,2022,https://link.springer.com/article/10.1007/s41664-022-00236-w,Article
Constructing rapid water vapor transport channels within mixed matrix membranes based on two-dimensional mesoporous nanosheets,Communications Chemistry,,,,10.1038/s42004-022-00681-9,Fengkai WangShurui HanYanli ZhangLei GaoXu LiLizhi ZhaoHui YeHong LiQingping XinYuzhong Zhang,2022,https://link.springer.com/article/10.1038/s42004-022-00681-9,Article
Liquid Chromatography in Bioanalysis,Tools and Trends in Bioanalytical Chemistry,,,,10.1007/978-3-030-82381-8_21,Mariana R. GamaGisláine C. da SilvaCarla B. G. Bottoli,2022,https://link.springer.com/chapter/10.1007/978-3-030-82381-8_21,Chapter
Experimental and numerical study on the suppression mechanism of gas production and combustion in battery thermal runaway under overcharge conditions,Journal of Thermal Analysis and Calorimetry,,,,10.1007/s10973-025-14644-4,Kuo WangFangzhou LiJianqi ZhangShuai YuanXingtong WuMinghui LiWenhao HaoXinming Qian,2025,https://link.springer.com/article/10.1007/s10973-025-14644-4,Article
Comparison of gas chromatographic techniques for the analysis of iodinated derivatives of aromatic amines,Analytical and Bioanalytical Chemistry,,,,10.1007/s00216-023-04713-8,Nerea Lorenzo-ParodiErich LeitnerTorsten C. Schmidt,2023,https://link.springer.com/article/10.1007/s00216-023-04713-8,Article
Global Weak Entropy Solution of Nonlinear Ideal Reaction Chromatography System and Applications,"Acta Mathematicae Applicatae Sinica, English Series",,,,10.1007/s10255-023-1030-2,Jing ZhangHong-xia LiuTao Pan,2022,https://link.springer.com/article/10.1007/s10255-023-1030-2,Article
Temporal Changes of Sulfate-Reducing Microbial Communities Based on Functional Gene Sequencing in Production Water of Shale Gas Reservoir,Chemistry and Technology of Fuels and Oils,,,,10.1007/s10553-024-01764-0,Jianqiang ChenHaiyan QiuZhiyi ChenGuihong LanQi XiaoSongsong XueTianxiong OuBo XuTianyi Wang,2024,https://link.springer.com/article/10.1007/s10553-024-01764-0,Article
Improving Resolution of Isomeric Flavonoids and Their Glycosides Using Two-Dimensional Liquid Chromatography Coupled With High-Resolution Mass Spectrometry,Chromatographia,,,,10.1007/s10337-021-04027-w,Aileen PuaRui Min Vivian GohKim-Huey EeYunle HuangShao Quan LiuBenjamin LassabliereBin Yu,2021,https://link.springer.com/article/10.1007/s10337-021-04027-w,Article
Data Augmentation of Dissolved Gases in Transformer Oil Based on Riemannian Manifold Variational Autoencoder,The Proceedings of the 19th Annual Conference of China Electrotechnical Society,,,,10.1007/978-981-96-4675-3_63,Hang LiuBen NiuZhijian LiuZhiyu ShiMing Li,2025,https://link.springer.com/chapter/10.1007/978-981-96-4675-3_63,Conference paper
A chemiresistive-potentiometric multivariate sensor for discriminative gas detection,Nature Communications,,,,10.1038/s41467-023-39213-x,Hong ZhangZuobin ZhangZhou LiHongjie HanWeiguo SongJianxin Yi,2023,https://link.springer.com/article/10.1038/s41467-023-39213-x,Article
"Stability-indicating high-performance thin-layer chromatography method development and validation for the simultaneous estimation of azithromycin, fluconazole, and secnidazole in active pharmaceutical ingredient and its tablet dosage form",JPC – Journal of Planar Chromatography – Modern TLC,,,,10.1007/s00764-024-00321-z,Arun Maruti KashidVaibhav Balasaheb PereAditya Mahesh Shinde,2024,https://link.springer.com/article/10.1007/s00764-024-00321-z,Article
Exploring the manganese-dependent interaction between a transcription factor and its corresponding DNA: insights from gas-phase electrophoresis on a nES GEMMA instrument,Analytical and Bioanalytical Chemistry,,,,10.1007/s00216-024-05473-9,Ivana Leščić AšlerKatarina RadmanZoe Jelić MatoševićBranimir BertošaVictor U. WeissMartina Marchetti-Deschmann,2024,https://link.springer.com/article/10.1007/s00216-024-05473-9,Article
Gas-active group correlation mechanism of spontaneous combustion indicators and hierarchical early warning system of oil-impregnated coal samples based on the reference method,Journal of Thermal Analysis and Calorimetry,,,,10.1007/s10973-025-14464-6,Yuntao LiangYutao ZhangMengru RenLinjia WangFuchao TianYaqing LiYuanbo ZhangHui Jin,2025,https://link.springer.com/article/10.1007/s10973-025-14464-6,Article
"NiO/In<sub>2</sub>O<sub>3</sub> nanosheet heterojunction for the gas sensing detection of 2,7-dichlorodibenzo-p-dioxin",Journal of Materials Research,,,,10.1557/s43578-025-01566-y,Liping GaoLiwei WangHongjie LiuJincheng CaoJunhai Wang,2025,https://link.springer.com/article/10.1557/s43578-025-01566-y,Article
Two-dimensional code enables visibly mapping herbal medicine chemome: an application in <i>Ganoderma lucidum</i>,Chinese Medicine,,,,10.1186/s13020-022-00702-8,Qian WangWenjing LiuBo PengXingcheng GongJingjing ShiKe ZhangBo LiPengfei TuJun LiJun JiangYunfang ZhaoYuelin Song,2023,https://link.springer.com/article/10.1186/s13020-022-00702-8,Article
Comprehensive characterization of sulfur compounds in the diesel fraction using methylation/demethylation derived separation and GC × GC–MS/FID analysis,Analytical and Bioanalytical Chemistry,,,,10.1007/s00216-025-05860-w,Yifei LiYanfei SuZhengyu ChenJianxun WuWeilai ZhangChunming XuQuan ShiLinzhou Zhang,2025,https://link.springer.com/article/10.1007/s00216-025-05860-w,Article
Quantitative High-Throughput and High-Sensitivity Glycoprofile Analysis of Therapeutic Glycoproteins Using HILIC-FLD and ESI-MS,Heterologous Protein Production in CHO Cells,,,,10.1007/978-1-0716-4104-0_16,Yongjing XieMichael Butler,2025,https://link.springer.com/chapter/10.1007/978-1-0716-4104-0_16,Protocol
Liquid chromatography and differential mobility spectrometry—data-independent mass spectrometry for comprehensive multidimensional separations in metabolomics,Analytical and Bioanalytical Chemistry,,,,10.1007/s00216-023-04602-0,Lysi EkmekciuGérard Hopfgartner,2023,https://link.springer.com/article/10.1007/s00216-023-04602-0,Article
Comprehensive Analysis of the Liquid Fraction of Car Tire Pyrolysis Products by Gas Chromatography–Mass Spectrometry,Russian Journal of Applied Chemistry,,,,10.1134/S1070427221010183,A. Yu. SholokhovaM. V. ShashkovYu. V. PatrushevD. D. MatyushinA. A. ZhdanovP. A. DolgushevA. K. Buryak,2021,https://link.springer.com/article/10.1134/S1070427221010183,Article
Development of an ultra-high-performance supercritical fluid chromatography method for the analysis of phenols in the pyrolysis aqueous fraction,Analytical and Bioanalytical Chemistry,,,,10.1007/s00216-023-04906-1,Antonia Regina dos S. GoisCarlos Fernando de S. SantosIgor M. SantanaMárcia Cristina BreitkreitzLisiane dos S. Freitas,2023,https://link.springer.com/article/10.1007/s00216-023-04906-1,Article
MrgX2-SNAP-tag/cell membrane chromatography model coupled with liquid chromatography-mass spectrometry for anti-pseudo-allergic compound screening in Arnebiae Radix,Analytical and Bioanalytical Chemistry,,,,10.1007/s00216-022-04167-4,Qianqian JiaJia FuChunlei GaoHong WangSaisai WangPeida LiangShengli HanYanni LvLangchong He,2022,https://link.springer.com/article/10.1007/s00216-022-04167-4,Article
Analysis of Hydrothermal Aging Water of Fire-Protective Fabrics Using GC × GC–TOFMS and FID,Fibers and Polymers,,,,10.1007/s12221-024-00540-5,Md. Saiful HoqueTrevor JohnsonPaulina de la MataJames J. HarynukPatricia I. Dolez,2024,https://link.springer.com/article/10.1007/s12221-024-00540-5,Article
Flavor analysis techniques combined with multivariate statistical analysis reveal the main aroma characteristics in wasabi from different origins,Journal of Food Measurement and Characterization,,,,10.1007/s11694-025-03442-z,Xiao LiuLing-Xiao LiuFu-Rong WangQin-Guo XuLi YanXiao-Jie HuYun-Guo Liu,2025,https://link.springer.com/article/10.1007/s11694-025-03442-z,Article
Exploring extra dimensions to capture saliva metabolite fingerprints from metabolically healthy and unhealthy obese patients by comprehensive two-dimensional gas chromatography featuring Tandem Ionization mass spectrometry,Analytical and Bioanalytical Chemistry,,,,10.1007/s00216-020-03008-6,Marta Cialiè RossoFederico StiloSimone SquaraErica LibertoStefania MaiChiara MelePaolo MarzulloGianluca AimarettiStephen E. ReichenbachMassimo CollinoCarlo BicchiChiara Cordero,2020,https://link.springer.com/article/10.1007/s00216-020-03008-6,Article
Antiparasitic Activity and Potential Active Compounds from <i>Azadirachta Indica</i> Revealed by Affinity Ultrafiltration Chromatography–Mass Spectrometry with Acetylcholinesterase and Lactate Dehydrogenases,Journal of Analysis and Testing,,,,10.1007/s41664-024-00315-0,Minxia FanTojofaniry Fabien RakotondrabeGuilin ChenMingquan Guo,2024,https://link.springer.com/article/10.1007/s41664-024-00315-0,Article
"Simultaneous Extraction, Separation and Characterization of Biomolecules from Microalgal Biomass",Recent Trends and Developments in Algal Biofuels and Biorefinery,,,,10.1007/978-3-031-52319-9_7,Anuradha DeviChristina SaranMeenakshi VermaGanesh Dattatraya SarataleLuiz Fernando R. FerreiraNandkishor MoreRam Naresh Bharagava,2024,https://link.springer.com/chapter/10.1007/978-3-031-52319-9_7,Chapter
Mass transfer analysis of the isochoric–isotherm hydrate-based water desalination from CO<sub>2</sub>/C<sub>3</sub>H<sub>8</sub> gas mixtures,International Journal of Environmental Science and Technology,,,,10.1007/s13762-023-05140-z,M. NasehC. FalamakiV. Mohebbi,2023,https://link.springer.com/article/10.1007/s13762-023-05140-z,Article
Mid-IR laser measurement of acetaldehyde in the headspace gas of cell culture media samples from growth of breast cancer cells in hydrogel scaffolds,Analytical and Bioanalytical Chemistry,,,,10.1007/s00216-025-05899-9,Parker BryantPatrick McCannKhosrow NamjouVassilios SikavitsasRoger Harrison,2025,https://link.springer.com/article/10.1007/s00216-025-05899-9,Article
Characterization and identification of Chinese historical rubbings preserved in Wuyuan Museum by Pyrolysis–Gas Chromatography/Mass Spectrometry,Heritage Science,,,,10.1186/s40494-021-00596-z,Na YaoXiangsheng ZhanQinglin MaShuya Wei,2021,https://www.nature.com/articles/s40494-021-00596-z,Article
In-Situ Gas Transmission Electron Microscopy,In-Situ Transmission Electron Microscopy,,,,10.1007/978-981-19-6845-7_9,Ke FangWentao YuanJakob B. WagnerZe ZhangYong Wang,2023,https://link.springer.com/chapter/10.1007/978-981-19-6845-7_9,Chapter
High reliable gas sensor based on crystal-facet regulated α-Fe<sub>2</sub>O<sub>3</sub> nanocrystals for rapid detection of exhaled acetone,Rare Metals,,,,10.1007/s12598-024-02879-3,Jin-Yong HuHong LeiHong-Yu ZhangXiong-Xiong XueXin-Peng WangCong-Hui WangYong Zhang,2024,https://link.springer.com/article/10.1007/s12598-024-02879-3,Article
Effect of long reaction distance on gas composition from organic-rich shale pyrolysis under high-temperature steam environment,International Journal of Coal Science & Technology,,,,10.1007/s40789-024-00689-7,Lei WangRui ZhangGuoying WangJing ZhaoDong YangZhiqin KangYangsheng Zhao,2024,https://link.springer.com/article/10.1007/s40789-024-00689-7,Article
Analysis of milk with liquid chromatography–mass spectrometry: a review,European Food Research and Technology,,,,10.1007/s00217-022-04197-3,Sebastian ImperialeKsenia MorozovaGiovanna FerrentinoMatteo Scampicchio,2023,https://link.springer.com/article/10.1007/s00217-022-04197-3,Article
Gas-balancing adsorption strategy towards noble-metal-based nanowire electrocatalysts,Nature Catalysis,,,,10.1038/s41929-024-01167-8,Jiashun LiangShenzhou LiXuan LiuYangyang WanYu XiaHao ShiSiyang ZhangHsing-Lin WangGang LuGang WuYunhui HuangQing Li,2024,https://link.springer.com/article/10.1038/s41929-024-01167-8,Article
Determination of Trace-Level Anions in Electronic-Grade γ-Butyrolactone (GBL) for Lithium Ion Batteries with 2D Ion Exclusion-Ion Exchange Chromatography Coupled with Valve-Switching Technique,Advanced Energy Materials and Their Application in Devices and Systems,,,,10.1007/978-981-97-8883-5_16,Heng-jun LuYan-gang HanYan LuShang-fu LiaoRui-Rui ShiSong-li ShenDan HuLi-ying WangTao Ye,2024,https://link.springer.com/chapter/10.1007/978-981-97-8883-5_16,Conference paper
Selectivity Map of Stationary Phases: A Graphical Method for Systematizing and Searching for Conditions for the Gas Chromatographic Separation of Polar Substances,Journal of Analytical Chemistry,,,,10.1134/S1061934822070139,E. A. ZaitcevaA. M. Dolgonosov,2022,https://link.springer.com/article/10.1134/S1061934822070139,Article
BERNN: Enhancing classification of Liquid Chromatography Mass Spectrometry data with batch effect removal neural networks,Nature Communications,,,,10.1038/s41467-024-48177-5,Simon J. PelletierMickaël LeclercqFlorence Roux-DalvaiMatthijs B. de GeusShannon LeslieWeiwei WangTuKiet T. LamAngus C. NairnSteven E. ArnoldBecky C. CarlyleFrédéric PreciosoArnaud Droit,2024,https://link.springer.com/article/10.1038/s41467-024-48177-5,Article
Integration Technologies in Gas Sensor Application,Semiconducting Metal Oxides for Gas Sensing,,,,10.1007/978-981-99-2621-3_9,Yonghui Deng,2023,https://link.springer.com/chapter/10.1007/978-981-99-2621-3_9,Chapter
Influence of on-site sampling conditions on the representativeness of the sample for the analysis of trace VOCs in raw renewable gases,Analytical and Bioanalytical Chemistry,,,,10.1007/s00216-024-05604-2,A. LegendreS. BsaibesC. PaijensJ. DugayY. CourtoisL. CucciaD. Ballestas CastroD. ThiebautJ. Vial,2024,https://link.springer.com/article/10.1007/s00216-024-05604-2,Article
Micro ring CO<sub>2</sub> gas sensor using PbSe quantum dots,Optical and Quantum Electronics,,,,10.1007/s11082-023-05171-3,Anvar Shahamat Haji KhanlooMohammad Javadian SarrafAli RostamiMahboubeh Dolatyari,2023,https://link.springer.com/article/10.1007/s11082-023-05171-3,Article
"Isolation, Physico-Chemical Characteristics, and Acute Toxicity Evaluation of Water-Soluble Polysaccharide from Basidial Raw Material <i>Ganoderma lucidum</i>",Russian Journal of Bioorganic Chemistry,,,,10.1134/S1068162024010011,S. B. KhaytmetovaA. S. TuraevG. A. KhalilovaB. I. Muhitdinov,2024,https://link.springer.com/article/10.1134/S1068162024010011,Article
Characterising the Radionuclide Fingerprint of an Advanced Gas-Cooled Nuclear Power Reactor,Pure and Applied Geophysics,,,,10.1007/s00024-024-03488-y,M. A. GoodwinA. PettsB. D. MilbrathA. RingbomD. L. ChesterT. W. BowyerJ. L. BurnettJ. FrieseL. LideyJ. C. HayesP. W. EslingerM. MayerD. KellerR. SarathiC. JohnsonM. AldenerS. LiljegrenT. FritioffJ. KastlanderS. J. Leadbetter,2024,https://link.springer.com/article/10.1007/s00024-024-03488-y,Article
Study of sampling phases for body odor sampling prior to analysis by TD-GC×GC/ToFMS,Analytical and Bioanalytical Chemistry,,,,10.1007/s00216-025-05857-5,Elsa BoudardLisa FissonNabil MoumaneJosé DugayJérôme VialDidier Thiébaut,2025,https://link.springer.com/article/10.1007/s00216-025-05857-5,Article
Mechanistic modeling and CFD simulation of gas chromatography to predict separation processes,Brazilian Journal of Chemical Engineering,,,,10.1007/s43153-021-00094-6,João Pedro FerreiraLeandro Guarezi NandiAndré Wüst ZibettiBruno Augusto Mattar Carciofi,2021,https://link.springer.com/article/10.1007/s43153-021-00094-6,Article
Acetone Gas Sensing with Pt-Doped SiC Nanotubes for Diabetes Detection at Room-Temperature,Silicon,,,,10.1007/s12633-024-02965-2,Ram Sevak Singh,2024,https://link.springer.com/article/10.1007/s12633-024-02965-2,Article
Classification of Gas Sensor Data Using Multiclass SVM,Intelligent Computing,,,,10.1007/978-3-031-37717-4_88,M. JaleelA. AmiraH. Malekmohamadi,2023,https://link.springer.com/chapter/10.1007/978-3-031-37717-4_88,Conference paper
Determination of thiamine and pyridoxine in food supplements by a green ultrasensitive two-dimensional capillary electrophoresis hyphenated with mass spectrometry,Chemical Papers,,,,10.1007/s11696-022-02309-7,Ivana CizmarovaMichaela MatuskovaOndrej StefanikAndrea HorniakovaPeter MikusJuraj Piestansky,2022,https://link.springer.com/article/10.1007/s11696-022-02309-7,Article
Development and Application of Novel Extraction Method to Analyze Herbal Supplements and Adulterant Determination by GCxGC/Q-TOFMS,Food Analytical Methods,,,,10.1007/s12161-024-02657-y,Jhonatan Bispo de OliveiraMaria Fernanda Mendes CarvalhoPatterson Patrício de SouzaZenilda de Lourdes Cardeal,2024,https://link.springer.com/article/10.1007/s12161-024-02657-y,Article
